"","sentence_text_new"
"3","Make the Difference. The Liberal Democrat Manifesto 1997. 'The Liberal Democrats exist to build and safeguard a fair, free and open society in which we seek to balance the fundamental values of liberty, equality and community, and in which no-one shall be enslaved by poverty, ignorance or conformity.' "
"6","Liberal Democrat Constitution. INTRODUCTION.  This will be the last election of this century."
"7","And one of its most important."
"8","We have ducked the challenges that confront our country for too long."
"9","It is time to face them."
"10","The choice you make will shape Britain's future for the next 50 years."
"11","There are no quick fixes, no instant solutions."
"12","Eighteen years of Conservative government have left our society divided, our public services run down, our sense of community fractured and our economy under-performing."
"13","There is much to be done to prepare Britain for the next century and no time to waste in getting started."
"14","Yet a terrible fatalism seems to grip politicians."
"15","Though the challenges are immense, the solutions we are offered are all too often puny."
"16","We are told we can't ask people to pay more for a better education."
"17","Or change the way we live to protect our environment."
"18","Or share more to give better opportunities to those who have less."
"19","Or modernise our politics to give people more say."
"20","The Liberal Democrats reject this timidity."
"21","We are in politics not just to manage things better, but to make things happen."
"22","To build a more prosperous, fair and open society."
"23","We believe in the market economy as the best way to deliver prosperity and distribute economic benefits."
"24","But we recognise that market mechanisms on their own are not enough"
"25","that the private sector alone cannot ensure that there are good services for everyone, or promote employment opportunities, or tackle economic inequality, or protect the environment for future generations."
"26","We believe in a society in which every citizen shares rights and responsibilities."
"27","But, we recognise that a strong country is built from the bottom, not the top"
"28","that conformity quickly becomes the enemy of diversity."
"29","And that the imposition of social blueprints leads to authoritarian centralised government."
"30","Liberal Democrats believe that power and opportunity, like wealth, should be widely spread."
"31","Above all, Liberal Democracy is about liberty."
"32","That does not just mean freedom from oppressive government."
"33","It means providing all citizens with the opportunity to build worthwhile lives for themselves and their families and helping them to recognise their responsibilities to the wider community."
"34","Liberal Democrats believe the role of democratic government is to protect and strengthen liberty, to redress the balance between the powerful and the weak, between rich and poor and between immediate gains and long-term environmental costs."
"35","That is the Liberal Democrat vision: of active government which invests in people, promotes their long-term prosperity and welfare, safeguards their security, and is answerable to them for its actions."
"36","Much of what we propose here requires no money only political will."
"37","But where extra investment is required we say where it will come from."
"38","This is a menu with prices."
"39","The purpose of this manifesto is to widen opportunities for all."
"40","And its aim is to build a nation of self-reliant individuals, living in strong communities, backed by an enabling government."
"42","Which party will make a real difference to my child's education? Our aim: To make Britain the world's foremost learning society by 2010."
"43","The problem: This country's education has been underfunded and undermined by repeated shifts in policy."
"44","Standards are too low, especially in core skills such as reading and maths."
"45","Britain is too low in the world league tables."
"46","Our commitment: Liberal Democrats will make education the next government's top priority."
"47","We will invest an additional £2 billion per year in education, funded by an extra 1p in the pound on the basic rate of income tax."
"48","Our first priority is to: Give children the best start by providing high quality early years education for every 3 and 4 year-old child whose parents want it."
"49","Key priorities are to: Increase funding for books and equipment in schools."
"50","In the first year, we will double spending on books and equipment to overcome the effect of recent cuts."
"51","Reduce primary school class sizes so that within 5 years no child between 5 and 11 I will need to be in a class of more than 30."
"52","Tackle the backlog of repair and maintenance to buildings with £500m additional investment over 5 years."
"53","Boost chances for all adults to improve their skills and get better qualifications."
"55","Making the best start. Early years education is the essential building block for higher standards and achievement later on."
"56","Every £1 spent on high quality under-fives education raises standards in later life and adds up to £7 of value to the nations economy."
"57","We will: Give children the best start by providing high quality early years education for every 3 and 4 year-old child whose parents want it."
"58","This will be the first call on our £2 billion annual programme of extra investment in education."
"59","Promote high standards in early years education."
"60","We will set minimum standards for care, curriculum and premises."
"61","We will ensure that those in early years education are supervised by qualified staff."
"62","Provide choice in early years education."
"63","We will scrap the bureaucratic voucher scheme."
"64","We will ensure a variety of provision from a wide range of public, private and voluntary providers."
"65","Raising standards in schools."
"66","We will raise standards in schools, especially in literacy and numeracy, which are still far too low."
"67","We will: Improve teaching standards."
"68","We will set up a General Teaching Council, charged with improving teaching standards and making teaching a profession to be proud of again."
"69","We will provide more opportunities for professional development and reward excellence in teaching."
"70","We will help poor teachers improve, but if they cannot, we will ensure they do not continue to teach."
"71","Encourage schools to succeed."
"72","We will strengthen the inspection system so that it helps schools and we will extend inspection to monitoring Local Education Authorities (LEAs)."
"73","Strengthen discipline in schools."
"74","We will support teachers in maintaining discipline and provide them with the means to do so - for example, by providing better access to special referral units."
"75","We will require every school to develop a policy to tackle bullying and truancy."
"76","We will launch a national Truancy Watch scheme."
"77","We will oblige LEAs to fulfil their responsibilities to educate pupils excluded or suspended from school."
"78","Measure achievement in pupils and schools."
"79","We will give every pupil a Personal Record of Achievement which will enable them to build up a set of nationally accredited qualifications and record their other achievements."
"80","We will require schools to publish meaningful information on their standards, achievements and plans for the future."
"81","Improve the National Curriculum."
"82","We will replace the National Curriculum with a more focused and flexible Minimum Curriculum Entitlement."
"83","We will ensure that religious education provides pupils with an understanding of the major traditions of belief in this country."
"84","Boost literacy."
"85","We will establish special literacy programmes involving parents with teachers in a drive to ensure that 90 per cent of all pupils reach their expected reading age by 2005."
"87","Investing in schools. Extra investment for well-equipped classrooms and better-maintained buildings is essential if standards are to improve."
"88","We will: Increase funding for books and equipment in schools."
"89","In the first year, we will double spending on books and equipment to overcome the effect of recent cuts."
"90","A typical primary school of 250 pupils will get an extra £16,000."
"91","A typical secondary school of 1,000 pupils will get an extra £110,000."
"92","Reduce primary school class sizes so that within 5 years no child between 5 and 11 will need to be in a class of more than 30."
"93","Tackle the backlog of repairs."
"94","We will invest an additional £500 million over 5 years in repairing crumbling and unsafe buildings."
"95","Support children with special needs."
"96","We will fully fund the implementation of the Code of Practice for Special Educational Needs."
"98","A new partnership for schools. Involving parents in the education of their children and ensuring schools are supported by local communities are both essential to achieving higher standards and a better use of resources."
"99","We will: Increase the role of parents in education."
"100","We will extend home/school/pupil links, develop home-school partnership arrangements and support parents with information and resources to help them help their child."
"101","We will require the schools inspection service to report on home-school partnerships as part of school inspections."
"102","We will promote school councils and guarantee automatic representation on governing bodies to staff and, where appropriate, students."
"103","Open up schools to the whole community."
"104","We will encourage schools to develop courses for parents, build links with local leisure organisations to open up school sports facilities to the community and work with local businesses to provide improved computer education."
"105","Give all schools more independence and allow them to develop their own styles and strengths."
"106","We will devolve as many powers as possible to schools and give them more control over their budgets."
"107","We will make new 'light touch' LEAs responsible for those functions that cannot be undertaken by individual schools on their own, such as coordination, planning and monitoring standards."
"108","We will bring grant-maintained schools and City Technology Colleges into this new framework and scrap the Funding Agency for Schools."
"109","Liberal Democrats are opposed to selection, but believe that decisions on this should be made by local communities through their local Councils and not by politicians at Westminster."
"110","Recognise the valuable role of church schools in the maintained sector."
"111","We will initiate a dialogue with all the major faiths about the role they wish to play in education in the future."
"112","Where any of the major faiths wish to establish publicly funded voluntary schools we will enable them to do so, provided that they enjoy substantial community support, offer acceptable programmes of study, provide equality of opportunity and are able to deliver the Minimum Curriculum Entitlement."
"113","Forge a new partnership with the independent sector."
"114","We will encourage independent schools to work with state schools."
"115","We will phase out the Assisted Places Scheme and use the money saved to enable LEAs, if they wish, to enter into local partnership schemes."
"116","These could include assisting the funding of pupils at independent schools."
"117","Pupils currently covered by the Assisted Places Scheme would, however, be protected until they finish their studies."
"118","We will require independent schools to offer the Minimum Curriculum Entitlement."
"119","We will extend charitable status to all schools without affecting total Council funding and maintain the VAT exemption on school fees."
"121","Extending life-long learning. In the information age, education must be a life-long activity from which people can benefit anywhere and at any time, rather than being something that only happens in school."
"122","We will: Widen access to further education."
"123","We will give every person an Individual Learning Account as the basis for life-long post-school education with contributions made by the state, individuals and employers."
"124","Our aim is that the state contribution will be at least equivalent to the cost of fees on approved courses."
"125","We will replace the Student Loans Scheme with a fair repayment scheme linked to salaries in later life."
"126","We oppose top-up fees for tuition."
"127","Our aim is to ensure that students on approved courses (including part-time courses) up to first degree level are treated equally."
"128","Promote flexible learning."
"129","We will create a higher standard credit-based system for all post-14 courses, including the current A-levels and degree courses."
"130","We will work with the private sector to link all schools to the Information Super Highway and ensure that they have the equipment and skills to take advantage of this."
"131","Promote training in the workplace."
"132","To support companies that invest in education and training, and to encourage others to do so, we will introduce a 2 per cent remissible levy on company payrolls."
"133","This would be deductible against the cost of providing accredited training or making contributions to the Individual Learning Account."
"134","Small businesses will be exempt."
"135","We will give Training and Enterprise Councils the leading role in forging local partnerships to meet youth training and employment needs."
"136","Expand training opportunities for young people."
"137","Our aim is to ensure that 16-19 year-oIds receive the equivalent of at least 2 days a week education or on-the-job training."
"138","Boost chances for all adults to improve their skills and get better qualifications."
"139","We will ensure that all adults on approved courses or training have access to financial support, either through their Individual Learning Accounts or from their employer using our new remissible training levy."
"140","Improve the quality of tertiary courses."
"141","We will create a new Quality Council to ensure high standards and value for money in all post-16 education and training courses."
"142","Secure academic freedom."
"143","We will ensure the funding of university teaching and research, safeguard academic freedom and standards."
"145","Which party will be best for my job and our firm? Our aim: To end the cycle of boom and bust and equip Britain's economy to compete in the global market-place."
"146","The problem: Despite the current pre-election mini-boom, the fundamentals of Britain's economy remain weak."
"147","We continue to be held back by instability in economic management, an underskilled labour force and chronic under-investment."
"148","Britain continues to consume too much and invest too little."
"149","Our commitment: Liberal Democrats will lock in economic stability, encourage saving and promote enterprise."
"150","We will raise the quality of Britain's workforce through additional investment in education and training."
"151","As part of our strategy to build a sustainable economy, we will shift the burden of taxation from employment to the depletion of natural resources."
"152","Our priorities are to: Provide stability in economic management to encourage long-term investment."
"153","Raise the quality of Britain's workforce and get people back to work."
"154","Promote enterprise and small businesses."
"155","Begin to shift taxation from jobs, wealth and goods to pollution and the depletion of natural resources."
"157","Investing in Britain's future. Long-term investment and economic stability are crucial to future economic success."
"158","We will: Secure stable prices and low interest rates."
"159","We will turn the Bank of England into a UK Reserve Bank, free from political interference."
"160","We will charge the Bank with keeping inflation low and make it accountable to Parliament for achieving this goal."
"161","Lower inflation and greater exchange rate stability can be better secured by working with Britain's European partners."
"162","The best framework for this is a single European currency and it is in Britain's interests to take part in this."
"163","However, three conditions must be met before this can happen."
"164","First, the single currency must be firmly founded on the Maastricht criteria."
"165","Second, Britain must meet those criteria."
"166","Third, the British people must have said yes' in a referendum."
"167","If these conditions for a single currency are in place, Britain should join."
"168","Ensure responsible economic management."
"169","We will keep to the 'golden rule' of public finance: over the economic cycle, total borrowing should not exceed total investment."
"170","We will make the government accountable to Parliament for keeping to this rule, and subject it to independent monitoring."
"171","We will cut wasteful spending and ensure new spending delivers value for money."
"172","Build up Britain's capital assets."
"173","We will distinguish between capital and current spending in the national accounting system."
"174","We will promote effective public/private investment partnerships at both national and local levels, with Councils' borrowing carefully controlled."
"175","Put Britain's people back to work."
"176","We will enable long-term unemployed people to turn their unemployment benefits into 'working benefits' paid to an employer to recruit and train them."
"177","We will break open the poverty traps that stop unemployed people from working."
"178","Our plans for boosting investment in infrastructure, promoting small businesses and encouraging energy conservation will create hundreds of thousands of new jobs."
"179","Invest in a highly-skilled workforce."
"180","Our investment of an additional £2 billion a year in education and training will improve skills and increase the nation's knowledge base."
"181","Promote environmental sustainability."
"182","We will begin a long-term shift in taxation, reducing taxes on jobs, wealth and goods and shifting them to pollution and resource depletion."
"183","We will use new national indicators of progress which include measures of quality of life and environmental sustainability."
"184","Encourage people to save."
"185","Our aim is to extend the advantages of TESSAs and PEPs to a wider range of savers by developing a new save-as-you-earn scheme."
"186","We will encourage personal and portable pension plans."
"188","Investing in enterprise. Small business, enterprise and self-employment are the engine of a modern dynamic economy and a vital source of new jobs and growth."
"189","We will: Support small and medium-sized businesses."
"190","We will encourage the banks to develop new sources of private finance, including grants, equity finance and mutual guarantee schemes."
"191","We will seek to expand the sources of 'seed-corn' capital."
"192","We will legislate for a statutory right to interest on late debt payments."
"193","We will require the banks to develop new codes of banking practice for small businesses."
"194","We will cut red tape, for example by stopping European institutions interfering where they shouldn't and by preventing Whitehall departments 'goldplating' European regulations with extra rules."
"195","We will, in the long-term, abolish the Uniform Business Rate and bring in a new, fairer local rating system."
"196","We will ensure that government purchasing gives special emphasis and easier access to small and medium-sized firms."
"197","Boost regional and local economies."
"198","We will set up regionally-based Development Agencies to build new partnerships between small businesses, local Councils, Business Links, TECs and local Chambers of Commerce."
"199","We will encourage these bodies to come together to provide 'one-stop shops'."
"200","We will enable Councils to raise capital for local infrastructure investment, where they work in partnership with the private sector "
"201","We will encourage industrial development by promoting geographical centres of industrial excellence."
"202","Invest in research and innovation."
"203","We will expand support for science and research by shifting government funds away from military Research and Development and into civil science and research, and improve specialist research facilities for industry."
"204","We will encourage regional technology transfer centres to bring together the resources of industry, universities and government laboratories."
"205","Promote tourism."
"206","We will bring together the marketing and infrastructure work of government, local Councils and tourist boards."
"207","We will ensure that local communities are involved in the planning of tourist developments from the earliest stages."
"208","Build new partnerships at work."
"209","We will give employees new rights to consultation and participation in decisions and give companies and their employees access to advice on the forms of partnership which best suit them."
"210","We will promote profit-sharing, mutual structures and employee share-ownership schemes."
"211","We will extend the benefits of the Social Chapter of the Maastricht Treaty to all UK employees, while resisting the adoption of new rules that unnecessarily harm job opportunities."
"212","Encourage a culture of long-term business investment."
"213","We will require companies to publish information on their long-term investment achievements, including environmental performance, research and development, and training."
"214","We will introduce greater shareholder control over directors' pay and appointments."
"215","Promote British exports."
"216","We will make export promotion and commercial activity a higher priority for British Embassies."
"218","Making Britain more competitive. A competitive domestic economy is essential if British companies are to succeed in the global market."
"219","We will: Strengthen the law on competition."
"220","We will tighten the rules on monopolies and adopt a pro-competition stance on take-overs and mergers."
"221","We will, combine the Monopolies and Mergers Commission and the Office of Fair Trading into a single powerful body, independent of government and charged with promoting competition."
"222","Give consumers more power."
"223","We will promote the establishment of industry-wide Ombudsmen schemes to improve complaints procedures and consumer redress."
"224","We will strengthen customer guarantees, improve product standards and labelling, especially for environmental purposes, and encourage products that are easier to repair, reuse and recycle."
"225","We will insist on clear labelling for food products which include genetically modified ingredients."
"226","Reform the privatised utilities."
"227","We will combine the existing regulators into a single Office of Utility Regulation, reporting to a Cabinet Minister responsible for consumer affairs."
"228","This new office will contain a regulatory board for each industry and will be, charged with protecting the consumer and ensuring that excess profits are used to reduce prices and increase investment in improved services."
"229","Starting with the water industry, we will encourage utilities to involve their consumers in ownership and control of their company, through mutual structures."
"230","Reinforce consumer and investor protection."
"231","We will introduce independent regulation of financial services and improve processes for redress (e.g. for mis-selling)."
"232","We will protect pension and life assurance savings from fraud."
"233","We will work to maintain the City of London's pre-eminence as a financial centre and promote effective international banking standards."
"235","Which party is serious about making our environment cleaner and safer? Our aim: To make clean air, pure water and a decent environment a central priority of Government."
"236","The problem: For too long, the environment has been damaged by greed and indifference."
"237","This cannot go on."
"238","From global warming to polluted rivers and asthma in children, everyone is already paying the cost of environmental damage."
"239","The longer action is delayed, the higher the cost will be."
"240","Our commitment: To save energy, cut traffic congestion, stop the unnecessary destruction of the countryside and stem the tide of pollution."
"241","Our priorities are to: Cut taxes on things we want to encourage, like jobs, by taxing pollution instead."
"242","This will not mean more tax, it will mean taxing differently."
"243","Build environmental objectives into every government policy."
"244","Set tough targets to cut energy waste, reduce traffic congestion and control pollution."
"246","A greener economy. Environmental protection must be built into every economic decision and every area of government policy."
"247","We will: Set tough new targets for the reduction of traffic pollution and waste."
"248","This will help reduce global warming, cut air pollution and prevent waste."
"249","Our targets include cutting carbon dioxide emissions (the main cause of climate change) by 30 per cent from the 1990 level over the next 15 years."
"250","Cut VAT and taxes on jobs, and make up the difference by taxing pollution instead."
"251","This will help create more jobs and a better standard of living."
"252","Adopt a Green Action Programme."
"253","We will set targets for sustainability and biodiversity, to be met by central and local government."
"254","We will measure these by using new indicators of quality of life, progress and wealth."
"255","The Prime Minister will report to Parliament each year on the country's success in meeting these environmental targets."
"256","Protect the local environment."
"257","We will pass stronger laws to conserve the countryside."
