"","sentence_text_new"
"258","We will cut road congestion and help local Councils make Britain's towns and cities healthier and cleaner places to live."
"259","Improve the way environment policy is made."
"260","Environment policy is currently buried, with housing and local government, in a huge single Government Department."
"261","We will put environment and energy policy within a separate, new department and ensure that all government departments and agencies pursue environmentally-friendly policies."
"262","We will give the Environment Agency stronger powers to enforce compliance with environmental laws."
"264","Transporting people, tackling pollution . Travel delays and road congestion cost billions of pounds, and pollution damages the health of millions of people."
"265","We will: Invest in public transport by building new partnerships with the private sector."
"266","We will enable Councils to introduce road pricing in the most congested urban areas and use the money to support clean and rapid public transport, and to improve cycle and pedestrian access."
"267","We will retain London Underground in public ownership and give it the right to seek private finance for new investment without an assured government guarantee."
"268","Treble the freight and double the number of passengers carried on Britain's railways by the year 2010."
"269","We will strengthen the powers of the rail regulators."
"270","We will require Railtrack to meet targets for greater investment and increased passenger and freight traffic."
"271","We will withhold public subsidies from Railtrack if the targets are not met and, in the case of persistent failure, use the funds to reacquire a controlling interest in Railtrack."
"272","We will provide for legislation enabling this."
"273","Encourage people to drive more fuel-efficient cars by cutting the annual car tax, from £145 to £10 for cars up to 1600cc, over the period of the next Parliament, funded by gradually raising the duty on fuel by approximately 4 pence per litre."
"274","Under our proposals, a person with a typical family car could drive up to 23,000 miles per year and still be better off - even in rural areas, where the average motorist only drives 11,700 miles a year."
"275","We will reform tax relief on company cars to encourage smaller cars and give people new incentives to use public transport for getting to work."
"276","Reduce the need to travel."
"277","We will reform the planning system so that people have easier access to shops, offices and facilities, and promote the use of information technology to decentralise work."
"279","Warmer homes, saving energy. Official government figures show that half the energy used in Britain is wasted."
"280","This pushes up fuel bills, worsens pollution and speeds up global warming."
"281","We will: Cut fuel bills and make homes warmer."
"282","We will launch a National Homes Insulation programme to end fuel poverty starting with the 2 million lowest income households."
"283","Our proposals will be funded by the Energy Saving Trust and the energy supply companies."
"284","This will save these households an average £85 per year and reduce global warming emissions."
"285","By contrast, cutting VAT on fuel bills to 5 per cent would save the average household only £19 per year."
"286","Cut taxes on people by taxing pollution instead."
"287","To encourage energy saving, we will gradually introduce a 'carbon tax' on fossil fuels, using the funds raised to cut VAT and employers' National Insurance Contributions (the tax on jobs)."
"288","This is a tax switch, not a tax rise, and will be phased in gradually."
"289","Improve energy efficiency."
"290","We will bring in new minimum standards for the energy efficiency of products, buildings and vehicles."
"291","We will cut VAT on energy conservation materials to 8 per cent - the same as for energy supplies."
"292","Promote renewable sources of energy and combined heat and power schemes."
"293","We will shift funds from nuclear research into decommissioning and nuclear waste management, and support research for renewable energy sources."
"294","We will not provide any government subsidies for nuclear generation."
"295","We support on-site dry storage of nuclear waste, pending the long-term development of safe alternatives."
"296","Nuclear stations will not be replaced at the end of their design life."
"298","Protecting Britain's heritage . Britain's natural environment and heritage are being gradually destroyed."
"299","We will: Clean up Britain's rivers and beaches and ensure that the costs of investment are spread fairly."
"300","We will require water companies to contribute to the cost of national environmental projects."
"301","We will reduce the need for new water developments by setting targets to reduce leakage and by promoting efficiency in water use."
"302","We will introduce a fairer system of charging for water and require water companies to share excess profits with their customers through rebates or investments in environmental improvements."
"303","We will end, within 10 years, discharges that cause unnecessary water pollution."
"304","Tackle marine oil pollution."
"305","We will implement tougher rules on shipping safety and bring forward the designation of marine high risk areas."
"306","Reform land use planning."
"307","We will make protection of the natural environment a major feature of the planning system through a new Wildlife Act."
"308","This will improve protection of National Parks, Heritage Coasts, Sites Of Special Scientific Interest and Areas of Outstanding Natural Beauty."
"309","Green the countryside."
"310","Our proposed new Countryside Management Contracts will help farmers to protect vital habitats and convert to more environmentally-friendly farming methods."
"311","We will use tax and planning reforms to protect rural areas, encouraging development on derelict land sites rather than green fields."
"313","Thinking globally, acting locally. Most people understand the importance of thinking globally and acting locally."
"314","They want to play their part in protecting the environment Government should help them do so."
"315","We will: Encourage the manufacture of products that are easier to repair, reuse or recycle."
"316","We will introduce deposit refund schemes and back EU-wide standards for product design, energy efficiency and reuse."
"317","Help people to choose environmentally friendly products."
"318","We will press for comprehensive and understandable EU-wide ecologically friendly and energy efficient labelling schemes."
"320","Promoting animal welfare. The way a society treats animals is a measure of its civilisation."
"321","We will: Promote animal welfare."
"322","We will set up a compulsory national dog registration scheme."
"323","We will halt the trade in endangered species as pets."
"324","We will promote and extend training and qualification for those who work with livestock."
"325","We will insist on the enforcement of maximum time limits and for transporting live animals in the EU, a stricter timetable for banning veal crates and improved rearing conditions for pigs and chickens across the EU."
"326","We will create an Animal Protection Commission to enforce animal welfare laws and improve animal welfare standards."
"327","We will ban animal testing for cosmetics, weapons and tobacco products."
"328","We will review the law in order to reduce the use of animals in scientific experiments and seek the development of alternatives."
"329","Protect wild animals."
"330","We believe that the issues of hunting with hounds and coursing should be decided by free votes in the House of Commons."
"331","We will ban snares and leg hold traps."
"332","We will press for stronger international laws to protect endangered species."
"333","We will ban the importation of products derived from threatened wild animals."
"335","Which party will make me feel safe on the streets and secure in my home? Our aim: To give every person in Britain the security of a decent home in a safe, strong community."
"336","The problem: Crime, homelessness and insecurity now threaten the very fabric of British society."
"337","Many people feel too frightened to leave their homes."
"338","Many do not have a decent home."
"339","Our country is becoming more and more divided, our sense of community is being lost and our shared values are being undermined."
"340","Our commitment: Liberal Democrats will pursue practical measures to rebuild Britain's communities, tackle the causes of crime, reduce homelessness and make people safer in their homes and on the streets."
"341","Our priorities are to: Put 3,000 more police officers on the beat."
"342","Build more affordable and secure housing."
"343","End, by the year 2000, the scandal of people being forced to sleep rough on the streets."
"344","Revive Britain's sense of community."
"346","Housing. Boom and bust house prices, a shortage of decent homes and poor housing have wrecked the lives of millions and damaged Britain's economy."
"347","We will: Build more houses."
"348","We will encourage partnerships between the public sector, the private sector and housing associations to build high quality homes to rent and buy."
"349","We will, within strict borrowing controls, give local authorities more powers to go directly to the market to raise finance for building new homes."
"350","We will begin the phased release of capital receipts from past sales of Council houses and allow the money to be used to build new homes."
"351","Give financial security to all, whether they rent or own their homes."
"352","We will introduce a new Mortgage Benefit for first time buyers."
"353","They will receive this instead of Mortgage Interest Tax Relief."
"354","Those holding current mortgages will retain Mortgage Interest Tax Relief."
"355","Our aim is, over time, to merge the new Mortgage Benefit and the current Housing Benefit into one system of housing cost relief, available to those who buy or rent and focused on those most in need."
"356","End the scandal of people being forced to sleep rough on the streets."
"357","We will ensure that by the year 2000 no one is forced to sleep on the streets."
"358","We will require every Council to set up self-funding rent deposit schemes to help homeless people take up private tenancies."
"359","We will fund more shortstay hostel places as the first rung on the ladder to permanent accommodation."
"360","Take action to tackle homelessness and raise housing standards."
"361","We will give Councils greater power to act on unfit private housing, where the landlord has failed to do so."
"362","We will strengthen tenants' rights to repair and, in the public sector, give them rights to take part in the management and development of their homes and estates."
"363","Our Empty Homes Strategy will enable local authorities to work with, and as a last resort require, landlords to bring empty properties back into use."
"364","We will end discrimination against those under 25 by scrapping the 'shared residency rule' when assessing housing benefit."
"365","Bring confidence back to the housing market by targeting low inflation and low interest rates."
"367","Crime and policing. Crime and the fear of crime affect almost every person and every community in the country."
"368","We will: Put 3,000 more police officers on the beat."
"369","Within one year, we will give police authorities the resources to put an extra 3,000 police officers on the beat."
"370","We will increase the time the police spend on preventing and detecting crime by reducing unnecessary paperwork and making greater use of new technologies."
"371","Tackle youth crime."
"372","We will widen the use of schemes that require offenders to repay their debt to society and to confront the consequences of their actions."
"373","We will, where appropriate, require parents to participate in support projects where their children have been involved in juvenile crime."
"374","We will develop schemes that target disruptive children from an early age."
"375","We will reserve custodial sentences for more serious and persistent offenders."
"376","Our voluntary Citizens Service will enable young people to get directly involved in crime prevention schemes."
"377","Strengthen the criminal justice system."
"378","We will make the justice system work more quickly and effectively and review sentencing policy."
"379","We will overhaul the Crown Prosecution Service."
"380","We will encourage the use of community sentences, as an alternative to prison, where the result is likely to be less reoffending, and use prison sentences where they are essential to public protection or to make punishment effective."
"381","We will concentrate resources on crime prevention and on increasing conviction rates, rather than spending billions on building prisons."
"382","Focus on crime prevention."
"383","We will require Councils to take the lead in establishing cross-community partnerships against crime, setting specific targets for crime prevention."
"384","We will give Councils powers and resources to support high-quality, targeted crime prevention initiatives."
"385","Wage war on drug abuse."
"386","We will give the Police and Customs and Excise the support they need to stop drugs coming into Britain."
"387","We will set up a Royal Commission charged with developing policies to tackle the drugs problem at its roots."
"388","Give victims a new deal."
"389","We will promote restorative justice, under which offenders can be required to compensate victims for the damage they have caused."
"390","We will ensure that the Victim Support movement and the Witness Support schemes play a full role in the criminal justice system."
"391","We will provide victims with the practical support they need to prevent repeat attacks."
"392","Strengthen public confidence in the police."
"393","We will make police authorities more responsive to local communities by increasing their elected membership and creating an accountable police authority for London."
"394","We will improve co operation between police forces and work more closely with Britain's European partners to combat international crime, terrorism, drug trafficking and fraud."
"395","We will ensure that the police take further steps to reduce the level of racial and homophobic violence."
"397","Rural communities. Britain's rural economy and communities have been transformed over the last fifty years."
"398","The challenge for the next fifty years is to protect and enhance the richness of rural life, while developing a thriving rural economy."
"399","We will: Seek further reform of the Common Agricultural Policy (CAP)."
"400","We will work to replace the CAP, which currently subsidises production, with Countryside Management Contracts - a targeted system of direct payments to support economic, social and environmental goals in rural communities."
"401","Countryside Management Contracts will enable farmers and landowners to choose from a wide range of options, for example, to improve the rural environment, maximise food quality, protect natural habitats or move to less intensive or organic farming methods."
"402","Help rural economies through a period of change."
"403","We will, in partnership with the agriculture industry, draw up a national strategy for farming in order to provide a framework for public policy and private decision-making over the next 10 years."
"404","We will promote agricultural research and development, and assist farmers wishing to diversify."
"405","We will promote local processing of agricultural products and expand support for small and medium-sized enterprises in rural areas."
"406","Tackle rural crime."
"407","We will put more police into rural areas, support Farm and Neighbourhood Watch schemes and give Councils the duty to set up crime prevention schemes with the local police."
"408","We will enable rural police authorities to introduce mortgage incentive schemes to encourage rural beat officers to live in the areas they serve."
"409","Enhance rural services."
"410","We will support smaller village schools through greater use of information technology and specialist teaching teams."
"411","We will encourage schemes that enable local communities to make use of school buildings and equipment."
"412","We will promote community hospitals and use them for more out-patient consultations."
"413","Provide more affordable rural housing."
"414","We will encourage housing authorities, Parish Councils and housing associations to set up partnership schemes with the private sector in order to build low-cost homes for first-time home buyers and social needs."
"415","Improve rural transport."
"416","We will give local authorities the power to improve the co-ordination of local bus services and to reopen closed railway stations, in co-operation with Railtrack."
"417","Strengthen the network of rural sub-post offices and village shops."
"418","We will encourage the Post Office to invest in new point of sale technologies, in order to provide access, through sub-post offices, to a wide range of customer services."
"419","Where post offices and village shops which are vital to their local community are threatened, we will enable local Councils to support them with up to 100 per cent rate relief."
"420","Protect the countryside."
"421","We will help landowners meet the environmental costs of increased access to the countryside."
"422","We will take action to reduce the use of chemicals in farming."
"423","Protect rural areas from urbanisation."
"424","We will penalise the use of greenfield sites, set and enforce targets for greater use of brownland sites and encourage over-the-shop accommodation in market town centres."
"425","We will review the excessive housing totals in the current structure plans and scrap the 'predict and provide' approach to housing development."
"426","Work to preserve fish stocks and protect the livelihoods of local fishing communities."
"427","Our aim is to scrap the Common Fisheries Policy and replace it with a new Europe-wide fisheries policy based on the regional management of fish stocks."
"428","We will take firm action to end quota-hopping, begin the phased abolition of industrial fishing and strengthen decommissioning incentives."
"429","Promote safe food."
"430","We will set up a Food Commission, independent from MAFF and accountable to Parliament, maintain strict controls on the use of bio-technology and press for higher common food standards across the European Union."
"432","Urban communities . Britain's towns and cities offer civic pride, accessible facilities and, potentially, a high quality of life."
"433","However, many suffer from alienation, joblessness, high crime rates, a run down environment and loss of population."
"434","Urban areas should offer excitement, security and a strong sense of community."
"435","We will: Boost local economic development and job opportunities."
"436","We will support local development corporations."
"437","We will build new partnerships between local government and the private and voluntary sectors, to regenerate local economies and promote community enterprise."
"438","We will link local training to local jobs."
"439","We will encourage the establishment of community banks and credit unions."
"440","Tackle urban crime."
"441","We will expand community policing, ensure that all new planning takes account of the need to deter crime and focus on crime prevention."
"442","Encourage public transport."
"443","We will enable Councils to co-ordinate bus and train services and give them powers to introduce urban road pricing schemes, using the revenue raised to invest in better public transport."
"444","Reform and strengthen elected local government."
"445","We will give local Councils greater control over their own affairs."
"446","We will create a strategic authority for London."
"447","We will encourage the use of 'planning for real' strategies, in which local people can make a direct input into major planning projects in their community."
"449","Arts and media. Flourishing arts and a diverse culture are essential for a lively and open society."
"450","They can be engines of innovation that bring life to the economy."
"451","At the same time, the world is experiencing an information revolution as important and far-reaching as the Industrial Revolution."
"452","Britain must maintain a free and effective media capable of being a check on the abuse of power, and of giving people the information they need to make informed decisions."
"453","We will: Tackle the concentration of media power."
"454","We will act to prevent media mergers or take-overs, except where these can be shown to advance quality, diversity and access."
"455","We will require the Independent Television Commission to protect the position of smaller regional ITV companies, within the network supply agreement."
"456","Maintain the role of the BBC as the benchmark of public service broadcasting, committed to quality, diversity and universal access."
"457","We will protect the independence and impartiality of the BBC through its Board of Governors and its licence fee."
"458","Improve access to information technology and the Internet."
"459","We will ensure that everyone in Britain can have access, either individually or through a wide range of public access points, to a nationwide interactive communications network by the year 2000."
"460","Increase access to the arts."
"461","We will use the National Lottery to endow, house and improve access to the arts."
"462","We aim to move towards the European average for public funding of the arts."
"463","We aim to restore the principle of free access to national museum and gallery collections, starting with the removal of charges for school parties."
"464","Promote Britain's culture."
"465","We will promote film production in Britain."
"466","We will actively support the British Council and rejoin UNESCO."
"467","We will enhance the BBC World Service as a national asset."
"469","Which party will care for the NHS and put my patients first? Our aim: To make year-on-year improvements in the health of Britain's people and the quality of the National Health Service."
"470","The problem: The NHS has been squeezed between rising demand and government underfunding, and disrupted by repeated changes in government policy."
"471","Morale amongst NHS professionals is falling, and bureaucracy has grown at the expense of front-line patient care, while numbers of nurses and hospital beds have fallen."
"472","Our commitment: Liberal Democrats will increase funding for the NHS and secure funding for the future."
"473","We will maintain the NHS as a comprehensive service, free at the point of need and funded primarily from general taxation."
"474","We will immediately tackle the crisis in the hospital sector make the NHS more accountable and begin a long term shift towards preventive medicine."
"475","Our priorities are to: Halt all finance driven closures for 6 months, pending an independent audit of needs and facilities."
"476","Invest £200 million each year to recruit more staff for front-line patient care."
"477","This would be enough, for example, for 10,000 extra nurses or 5,000 extra doctors."
"478","Cut hospital waiting lists to a maximum of 6 months over 3 years."
"479","End the two-tier system in the NHS."
"480","Restore free eye and dental checks."
"482","Raising standards in the NHS. Whilst many of the recent reforms to the NHS have been beneficial, they have resulted in the creation of a two-tier health service."
"483","The standard of health care a person receives is increasingly becoming a lottery."
"484","The length of time people have to wait, the chance of treatment being postponed and the quality of health care vary enormously from one part of the UK to another."
"485","We will: Match NHS facilities to needs."
"486","We will place an immediate 6-month halt on the finance driven closure of beds and wards, and set up an independent audit of needs and facilities."
"487","End the built-in two-tier service in the NHS."
"488","We will end the present system where treatment depends on the type of GP people go to."
"489","We will treat all GPs equally, with a common basis for funding."
"490","We want all GPs to have the benefits of flexibility and access to services currently enjoyed by fundholders."
"491","Those who choose to manage their own affairs will be able to do so on their own or as part of a consortium."
"492","Those who do not will be able to leave management to the local health authority."
"493","Raise standards of care in all areas."
"494","We will set up a National Inspectorate for Health and Social Care to improve standards and promote patients' interests."
"495","This body will work with the Audit Commission to ensure that all spending is monitored and results in real improvements in patient care."
"497","Funding the Health Service. The NHS is underfunded."
"498","Too much goes into bureaucracy and not enough into patient care."
"499","There is a crisis in the NHS, especially in hospitals."
"500","Morale is dropping, standards of care are at risk from underfunding and highly qualified doctors and nurses are leaving the profession."
"501","We will: Invest more in the NHS."
"502","We will invest at least an extra £540 million every year in the NHS to pay for our policy priorities."
"503","This will be paid for by closing the loophole that allows employers to avoid paying National Insurance contributions on certain benefits in kind and by putting 5p on the price of a packet of 20 cigarettes."
"504","We will use these extra funds to tackle the crisis in staffing, especially in the hospital sector, and begin a shift to preventive care."
"505","We will ensure that the NHS budget keeps pace with increasing cost pressures."
