"","sentence_text_new"
"5","2001 Labour Party General Election Manifesto. Ambitions for Britain. Five pledges for the next five years. Economic pledge. 1 Mortgages as low as possible, low inflation and sound public finances."
"6","As we deliver economic stability not return the economy to Tory boom and bust."
"8","Schools pledge. 2 10,000 extra teachers and higher standards in secondary schools."
"9","As we invest in our schools not make reckless tax cuts."
"11","Health pledge. 3 20,000 extra nurses and 10,000 extra doctors in a reformed NHS."
"12","As we improve NHS care for all not push patients into paying for operations."
"14","Crime pledge. 4 6,000 extra recruits to raise police numbers to their highest ever level."
"15","As we tackle drugs and crime not cut police funding."
"17","Families pledge. 5 Pensioners' winter fuel payment retained, minimum wage rising to £4.20."
"18","As we help hard- working families not the privileged few."
"20","Built on five achievements since 1997. Typical mortgage £1,200 less than under the Tories, inflation lowest for '30 years."
"21","The best ever results in primary schools."
"22","17,000 extra nurses now in the NHS."
"23","Crime down ten per cent."
"24","One million more people in work and a new Children's Tax Credit."
"25","This manifesto contains the details of our plans for the future of Britain."
"26","If you would like to find out more about our policies, join the Labour Party or make a donation to Labour's election fund, please call 08705 900 200 or visit our website at www.labour.org.uk."
"28","Fulfilling Britain's great potential. This general election is in many ways even more important than the last."
"29","Since May 1997 we have laid the foundations of a Britain whose economy is stronger, where investment is now pouring into public services, where social division is being slowly healed and where influence abroad is being regained."
"30","But these are only the foundations of larger change."
"31","Now is the chance to build the future properly, to make the second term the basis for a radical programme of British renewal: to keep a firm grip on inflation, with low interest rates and the public finances sound, and then build the dynamic and productive economy of the future;"
"32","to keep investment coming into public services and then making the reforms so we use the money well;"
"33","to refashion the welfare state on the basis of rights and responsibilities, with people helped to help themselves, not just given handouts;"
"34","to ensure all families are safe in their communities by tackling crime and its causes;"
"35","and to give Britain back its leadership role in the world."
"36","We need the second term to do all this."
"37","That is the choice: to make progress or to dismantle the foundations laid."
"38","And with the state of today's Conservatives, the choice is stark."
"39","This choice will decide whether more people will be able to realise their aspirations for themselves and their children - to be able to rely on a stable economy where hard work is rewarded by rising living standards, to receive world-class education and healthcare, to enjoy a dignified old age, to feel safe and secure in a strong community, and to be proud to be British."
"40","Or whether we will be held back by the traditional British malaise of restricting life's great opportunities and blessings to a minority."
"41","There is much still to be done, but we have come a long way in four years."
"42","Britain stands more prosperous, more equal, more respected."
"43","Our country is on a new course."
"44","My passion is to continue the modernisation of Britain in favour of hard-working families, so that all our children, wherever they live, whatever their background, have an equal chance to benefit from the opportunities our country has to offer and to share in its wealth."
"46","The challenge for Britain. I am honoured to be Prime Minister."
"47","And I have a confident belief in our country."
"48","We are not boastful."
"49","But we have real strengths."
"50","Great people."
"51","Strong values."
"52","A proud history."
"53","The British people achieved magnificent things in the 20th century."
"54","But for too long, our strengths have been undermined by weaknesses of elitism and snobbery, vested interests and social division, complacency bred by harking back to the past."
"55","We achieved spurts of economic growth, but inflation would then get out of control."
"56","Our welfare state was founded to offer security, but its progress was stalled."
"57","We reached out to Europe, then drew back to become semi-detached."
"58","It is as if a glass ceiling has stopped us fulfilling our potential."
"59","In the 21st century, we have the opportunity to break through that glass ceiling, because our historic strengths match the demands of the modern world."
"60","We can use our openness and entrepreneurial flair to become a global centre in the knowledge economy."
"61","We can use our sense of fair play and mutual responsibility to be a strong, dynamic, multiracial society held together by strong values."
"62","We can use our historic and geographical position to link Europe and America, and help the developing world."
"63","The key to tapping our strengths, to breaking through this glass ceiling, is contained in a simple but hard-to-achieve idea, set out at the heart of our partyÕs constitution: the determination to put power, wealth and opportunity in the hands of the many, not the few."
"64","I know as well as anyone that we have just begun;"
"65","millions of hard-working families want, need and deserve more."
"66","That means more change in a second term, not less - to extend opportunity for all."
"67","We reject the quiet life."
"68","We must secure a mandate for change."
"70","Ten goals for 2010. Long-term economic stability."
"71","Rising living standards for all."
"72","Expanded higher education as we raise standards in secondary schools."
"73","A healthier nation with fast treatment, free at the point of use."
"74","Full employment in every region."
"75","Opportunity for all children, security for all pensioners."
"76","A modern criminal justice system."
"77","Strong and accountable local government."
"78","British ideas leading a reformed and enlarged Europe."
"79","Global poverty and climate change tackled."
"81","Shifting the odds for hard-working families. In 1997 we promised a start, not a revolution."
"82","We made five specific five-year pledges."
"83","Three have been completed early;"
"84","all will be completed within five years, as we promised."
"85","Each pledge is matched by further achievement: the lowest inflation and unemployment for a generation;"
"86","one million new jobs;"
"87","over 17,000 extra nurses, the best primary school test results ever and, as the British Crime Survey shows, crime is down by ten per cent."
"88","We also offered a ten-point contract to the British people."
"89","The results are at the back of this manifesto."
"90","Not everything has gone right - it never does."
"91","But we are getting there, easing burdens and extending opportunities, by choice not chance."
"92","Economic instability wrecks the lives of hard-working families. "
"93","So we chose to put the public finances right."
"94","It meant tough decisions that were opposed by the Conservatives."
"95","But today the economy is stable and growing, and interest rates are nearly half the level they averaged under the Conservatives."
"96","Unemployment steals dignity."
"97","So we chose to introduce a windfall tax on the excess profits of the privatised utilities and to use the money to help unemployed people back to work."
"98","That was opposed by the Conservatives, who are now pledged to abolish the New Deal."
"99","But today, youth unemployment is at its lowest level since 1975 and long-term unemployment at its lowest level since 1978."
"100","Poor education is a cruel injustice. "
"101","So we chose to introduce a new system for teaching the basics in primary schools."
"102","We met opposition, and the Conservatives want to roll back our programmes."
"103","But today, primary schools are achieving their best results ever."
"104","A run-down health service causes insecurity. "
"105","So we chose to reform the NHS, and inject new money."
"106","Waiting lists and times are now down and falling, and the number of nurses and doctors is now rising."
"107","Poverty denies basic rights. "
"108","So we chose to reform the welfare state to channel extra money to the poorest pensioners and poorest children."
"109","Today, single pensioners can look forward to a minimum income of £100 a week and pensioner couples £154, and over one million children have been taken out of poverty."
"110","The centralisation of power only helps the powerful. "
"111","So we chose to break the suffocating centralisation of British government."
"112","The UK has been strengthened."
"113","Today, it is the Conservatives who threaten the stability of the UK with their proposals for two classes of MP."
"114","Our Scottish and Welsh manifestos, alongside this one, set out our vision for continued partnership."
"115","Isolation from Europe does not help anyone. "
"116","So we chose to engage constructively in Europe, not to shout abuse from the sidelines."
"117","Today, Europe is moving in a direction that is good for Britain and good for Europe."
"118","In policy for aid, development and international debt relief, we have led the way."
"119","Of course, there are still big problems, but we are better off, better educated, better governed, better respected abroad."
"120","There has been another change too - a change of priorities and values."
"121","We learnt in the 1980s that looking after number one was not enough;"
"122","that without opportunity, responsibility was weak;"
"123","that an unfair society was a less prosperous one."
"124","The philosophy was wrong - it hurt millions of families and left our country with lasting problems."
"125","We have shown we are a reformed party, competent to govern."
"126","Now we offer more."
"127","More change, and more rewards for Britain's hard-working families: more prosperity, more opportunities, more security."
"129","Ambitions for Britain. Stretching the family budget, finding time for children as well as work, holding on to mutual respect, staying healthy when there can be danger even in the air we breathe."
"130","These are daily worries that people face."
"131","They are my concerns too."
"132","But, while there is always a market for people who say we are doomed, that all new ideas are bad ideas even as things improve, that we might as well curl up with our prejudices and shut the door on the world, I am an optimist."
"133","New Labour is ambitious for Britain's future and is ready to lead."
"134","First, we will sustain economic stability and build deeper prosperity that reaches every region of the country. "
"135","Skills, infrastructure, the technological revolution Ð all are vital to raise British living standards faster."
"136","We will put as much energy into helping the seven million adults without basic skills as we did when tackling long-term unemployment through the New Deal."
"137","Second, we seek to achieve a renaissance of status and quality for public services and their staff. "
"138","We will build on our success in primary schools to overhaul secondary schools"
"139","we will invest new resources and empower doctors and nurses to transform health services"
"140","and we will seek to extend the very best in culture and sport to all."
"141","Third, we seek to modernise the welfare state. "
"142","The benefits system will be restructured around work"
"143","support for children and families through the tax and benefits system will be transformed"
"144","cash and services for pensioners will be radically improved."
"145","Fourth, we will strengthen our communities. "
"146","We will reform the criminal justice system at every level so that criminals are caught, punished and rehabilitated."
"147","And because we know that without tackling the causes of crime we will never tackle crime, we will empower local communities by combining resources with responsibility."
"148","Fifth, we will turn our inner confidence to strength abroad, in Europe and beyond, to tackle global problems - above all, environmental degradation and the shame of global poverty."
"149","We will engage fully in Europe, help enlarge the European Union and make it more effective, and insist that the British people have the final say on any proposal to join the Euro."
"150","These ambitions are summarised in ten goals for 2010."
"151","They will never be achieved by government alone."
"152","We know it is people who ultimately change the country."
"153","Our partnership with the voluntary sector has steadily strengthened since 1997, as we learn from its diversity."
"154","We work with the private sector, drawing on its vitality."
"155","Countries only prosper on the basis of partnership - between government, employers and their employees, and the voluntary sector."
"156","What Britain needs is an active, enabling state, not a nanny state, doing things with people not to them."
"157","So, while the Conservatives will spend most of this election telling you what their government cannot do, this manifesto sets out what our government can do."
"158","We know the power and value of markets, but we also know their limits."
"159","Now is the time to renew our civic and social institutions to deliver improvements in education, health, safety, transport and the environment."
"161","Fighting for values, not just for election victory. The Conservatives always look back."
"162","In economic policy they promise to repeat the mistakes of the 1980s - unaffordable tax cuts and spending cuts, followed by ballooning deficits, rising interest rates and the old cycle of boom and bust."
"163","In social policy their renewed commitment to cuts and privatisation and to withdrawing the support helping to heal social division, is just a throwback to the 1980s."
"164","In foreign policy they risk not just isolation but exit from the EU."
"165","Jobs, trade, investment depend on our membership of the European Union."
"166","The Conservative policy of opposing the enlargement of Europe in the Nice Treaty and their pledge to renegotiate the terms of Britain's EU membership is dangerous and ill thought-out."
"167","Standing up for Britain means fighting for Britain's interests in Europe, not leaving Europe - which threatens our national interest."
"168","So the choice Britain faces today is starker than in 1997."
"169","The Conservatives have swung further to the right."
"170","And, in government, Labour's agenda has become increasingly bold and ambitious."
"171","For many years, the Conservatives claimed to offer economic strength while Labour dominated social issues."
"172","Many people found their head telling them to vote Tory, and their heart telling them to vote Labour."
"173","Today, head and heart are coming together."
"174","New Labour is proving that it is only by using the talents of all that we get a healthy economy, and that it is only by giving a stake to all that we are a healthy society."
"175","We have made our choice: stability not boom and bust"
"176","investment not cuts"
"177","engagement not isolationism"
"178","the many, not the few."
"179","A lot done and a lot more to do with new Labour - or a lot for you to lose under the Conservatives."
"180","I deeply believe that, for Britain, the best is still to come."
"181","So I ask you to continue on this journey with us."
"182","Together we can achieve so much more."
"183","Tony Blair."
"184","Prime Minister and Leader of the Labour Party."
"185","Photo caption: Better primary school results than ever before"
"186","now we focus on secondary schools"
"187","Photo caption: More jobs, more dignity, more wealth"
"188","Tony Blair with construction workers in North Tyneside."
"191","Investment and Reform. Public services: investment and reform. Renewal of our public services is at the centre of new Labour's manifesto."
"192","A single aim drives our policy programme: to liberate people's potential, by spreading power, wealth and opportunity more widely, breaking down the barriers that hold people back."
"193","But this is only possible on the continued foundation of economic stability: mortgages as low as possible, low inflation and sound public finances."
"194","The manifesto is comprehensive."
"195","Here we set out some of the key measures for investment and reform that we believe give us a historic opportunity to modernise our schools, NHS, criminal justice system and welfare state."
"197","Renewing public services: substantial investment. New Labour believes that Britain needs investment in schools and hospitals, not reckless tax cuts."
"198","Before 1997 we promised and kept to two tough years on spending to get the public finances in shape."
"199","Now, consistent with meeting our fiscal rules, we promise substantial rises for key public services."
"200","To help deliver our plans, our ten-year goal is the renewal of local government."
"201","We will now: increase education spending by more than five per cent in real terms each year for the next three years as we increase the share of national income for education in the next Parliament "
"202","increase health spending by an average of six per cent in real terms each year for the next three years "
"203","increase spending on our police Ð an extra £1.6 billion a year by 2003/04 "
"204","increase spending on transport by 20 per cent for the next three years, on our way to a £180 billion investment of public and private money for transport over the next ten years "
"205","use a £400 million reward fund for local government in return for signing up to clear targets to improve local services. "
"207","Economic stability: the foundation. New Labour believes that a stable economy is the platform for rising living standards and opportunity for all."
"208","Our ten-year goals are for long-term economic stability and faster productivity growth than our main competitors."
"209","We will now: deliver economic stability with mortgages as low as possible, low inflation and sound public finances "
"210","reform further education, and help 750,000 adults achieve basic skills "
"211","expand the Children's Tax Credit to offer up to £1,000 per year for parents of newborn children "
"212","create a new Child Trust Fund for every child at birth "
"213","increase the minimum wage to £4.20 "
"214","not raise the basic or top rate of income tax and extend the 10p band "
"215","strengthen regional economies with venture capital funds and new powers for reformed Regional Development Agencies "
"216","develop the Small Business Service and cut red tape give British people the final say in any referendum on the single currency. "
"218","Renewing public services: more frontline staff. New Labour believes in renewing a public service ethic by giving frontline staff new freedoms to respond to public needs."
"219","For public services to be renewed, we will need more staff, properly rewarded."
"220","It is these frontline staff, operating in new ways, who will drive up standards in our key public services."
"221","We will decentralise power to make that possible."
"222","We will now deliver: 20,000 more nurses who will be given new enhanced roles and more power for matrons and ward sisters with control over budgets "
"223","10,000 more doctors, and access to a £500 million Performance Fund to spend on new patient services "
"224","10,000 more teachers."
"225","Invest in further rapid promotion and rewards for classroom excellence, more classroom assistants and help with housing costs in high-cost areas "
"226","6,000 extra police recruits, raising police numbers to their highest ever level, with strong local leadership and proper rewards for those on the frontline Investment and reform "
"228","Renewing public services: education reform. New Labour believes that schools need a step change in reform to make quality education open to all."
"229","We plan a radical improvement in secondary schools, building on our success in primary schools."
"230","Our aim is to develop fully the talents of each child."
"231","Our ten-year goal is 50 per cent of young adults entering higher education."
"232","We will now: ensure every secondary school develops a distinctive mission including the expansion of specialist schools "
"233","diversify state schools with new City Academies and more church schools "
"234","direct more money to headteachers, more freedom for successful schools "
"235","reform provision for 11- to 14-year-olds to ensure higher standards in English, maths, science and information technology "
"236","introduce new vocational options from 14 onwards, with expanded apprenticeship opportunities "
"237","ensure primary schools offer more chance to learn languages, music and sport, as well as higher standards in the basics "
"238","provide a good-quality nursery place for every three-year-old "
"240","Renewing public services: NHS reform. New Labour believes that the NHS needs radical reform to fulfil its founding principle of quality treatment based on need, not ability to pay."
"241","The NHS needs radical reform if it is to be designed around the needs of patients."
"242","Investment is vital but not enough."
"243","Labour's ten-year goal is a maximum waiting time of three months as we become a healthier nation with fast, high-quality treatment, free at the point of use."
"244","We will now:  decentralise power to give local Primary Care Trusts control of 75 per cent of NHS funding, and cut by two thirds the number of health authorities "
"245","reform the appointments system so that by the end of 2005 every hospital appointment is booked for the convenience of the patient "
"246","cut maximum waiting times by the end of 2005 for outpatient appointments from six months to three months and inpatients, from 18 to six months "
"247","work with the private sector to use spare capacity, where it makes sense, for NHS patients create a new type of hospital - specially built surgical units, managed by the NHS or the private sector - to guarantee shorter waiting times "
"248","allow successful NHS hospitals to take over failing ones."
"250","Renewing public services: welfare reform. New Labour believes that rights and responsibilities should be at the centre of reform of the welfare state - to lift children and pensioners out of poverty, and help parents balance work and family."
"251","We will continue to reform the tax and benefit system to reward work, not irresponsibility."
"252","Our ten-year goals are to achieve full employment in every region, to halve child poverty and tackle pensioner poverty."
"253","We will now: create an integrated Child Credit of cash support for children, built on the foundation of universal child benefit "
"254","establish a new Pension Credit for lower- and middle-income pensioners "
"255","establish a new 'Employment First' interview for people entering the welfare system, and integrate the Benefits Agency and Employment Service through major reform "
"256","extend and increase paid maternity leave to £100 each week for six months "
"257","introduce paid paternity leave "
"258","expand childcare places to provide for 1.6 million children "
"260","Renewing public services: criminal justice reform. New Labour believes that crime can only be cut by dealing with the causes of crime as well as being tough on criminals."
"261","We plan the most comprehensive reform of the criminal justice system since the war - to catch, convict, punish and rehabilitate more of the 100,000 persistent offenders."
"262","Our ten-year goal is a modernised criminal justice system with the burglary rate halved."
"263","We will now: overhaul sentencing so that persistent offending results in more severe punishment "
"264","reform custodial sentences so that every offender gets punishment and rehabilitation designed to minimise reoffending "
"265","reform rules of evidence to simplify trials and bring the guilty to justice "
"266","introduce specialist, late-sitting and review courts to reflect crime patterns and properly monitor offenders "
"267","establish a new Criminal Assets Recovery Agency to seize assets of crime barons and a register of dealers to tackle drugs "
"268","introduce a victims bill of rights providing legal rights to compensation, support and information"
"270","1 Prosperity for all. Labour's purpose is to help every family, not just a few, to raise their living standards and plan ahead with security."
"271","We have a ten-year vision: higher living standards, affordable mortgages and fairer taxes combined with much greater investment in vital public services."
"272","Economic stability is the foundation."
"273","We know the price of boom and bust - it was paid in the 1980s and 1990s by millions of hard-working families."
"274","Our reforms since 1997 have helped cut interest rates to nearly half the average under the Conservatives, saving mortgage payers on average £1,200 a year."
"275","By 2010, we want Britain to break away from the decades of boom and bust, as we stick to clear rules for spending and borrowing."
"276","We will take no risks with economic policy, make no compromise on fiscal responsibility."
"277","Stability comes first."
"278","But stability is not enough."
"279","We need to produce more, better and to a higher value to raise our earning power and to meet our ten-year goal of faster productivity growth than our main competitors."
"280","We must make Britain the best place to do business in Europe - a dynamic economy, founded on skills and knowledge, developing the talent of all our people, and contributing to sustainable development."
