"","sentence_text_new"
"230","We look forward to action from the banking industry to remove delays in processing cheques and other payments and, if necessary, will legislate to ensure this early in the next Parliament."
"231","There are many bank accounts that are lying dormant and unclaimed, often because people have forgotten about them or because the owner has died."
"232","We will work with the financial services industry to establish a common definition and a comprehensive record of unclaimed assets."
"233","We will then expect banks, over the course of the Parliament, to either reunite those assets with their owners or to channel them back into the community."
"234","An effective planning regime protects the environment while promoting economic growth - and does so quickly and responsively."
"235","In the next term, we will ensure that our planning system continues to protect the sustainability of local and regional environments - and we will continue to develop a regime which is simpler, faster and more responsive to local and business needs including the need to create jobs and regenerate our cities."
"237","Fostering entrepreneurship. There are 300,000 more businesses now than in 1997."
"238","We are tackling barriers to financing for small and growing businesses - especially enterprises in deprived areas."
"239","Through Business Links we will offer star t-ups, social enterprises and small businesses access to tailored intensive support and coaching."
"240","To foster the entrepreneurs of tomorrow, by 2006 every school in the country will offer enterprise education, and every college and university should be twinned with a business champion."
"242","Modern transport infrastructure. An efficient transport system is vital to the country's future, to our economy and to our quality of life."
"243","We welcome the freedom that additional travel provides and support the continuing development of a competitive and efficient freight sector."
"244","Investment, better management of road and rail, and planning ahead are vital to deal with the pressures on the system in a way that respects our environmental objectives."
"245","We have doubled transport spending since 1997 and will increase it year on year - committing over £180 billion in public money between now and 2015 as well as private investment."
"246","The Eddington Review will work with the Government to advise on how this investment should be targeted - in particular, where transport is vital to underpin economic growth."
"247","We are now taking charge of setting the strategy for rail to further raise the standard of service and reliability."
"248","We will examine options for increasing capacity, including a new generation of high-speed trains on intercity routes and a new life for rural branch lines as community railways."
"249","We are committed to continuing to work to develop a funding and finance solution for the Crossrail project"
"250"," and will look at the feasibility and affordability of a new North-South high-speed link."
"251","We will support light-rail improvements where they represent value for money and are part of the best integrated transport solution."
"252","To that end, we are working with cities across the country and have committed £520 million to Manchester for Metrolink."
"253","We will support the continuing upgrade of the London Underground and the extension of the East London line."
"254","Major investment is planned to expand capacity on the M1, M6 and M25."
"255","We must also manage road space better."
"256","We are examining the potential benefits of a parallel Expressway on the M6 corridor."
"257","We will introduce car-pool lanes for cars with more than one passenger on suitable roads and explore other ways to lock in the benefit of new capacity."
"258","We will complete the introduction of Traffic Management Officers to keep traffic flowing."
"259","Because of the long-term nature of transport planning, we will seek political consensus in tackling congestion, including examining the potential of moving away from the current system of motoring taxation towards a national system of road-pricing."
"260","We will give all over-60s, and disabled people, free off-peak local bus travel and give local authorities the freedom to provide more generous schemes."
"261","We will continue to support growth in bus provision including innovation in school transport, with greater opportunity for local authorities to control their bus networks where they are demonstrating value for money and taking strong measures to tackle congestion."
"262","To facilitate improved public transport provision, we will explore giving Passenger Transport Executives greater powers over local transport."
"263","We will continue funding local authorities and voluntary groups to make cycling and walking more attractive."
"264","We are committed to reducing child deaths and serious injuries on the road by 50 per cent, and we will continue to work to reduce dangerous driving, especially drink driving and uninsured driving."
"265","We will work with industry to make travel on public transport safer and more secure."
"266","Government will continue to support technological innovation to reduce carbon emissions such as the hydrogen fuel-cell buses in London."
"267","We will explore the scope for further use of economic instruments as well as other measures to promote lower vehicle emissions."
"268","We will continue to support air travel by implementing the balanced policies set out in our aviation white paper."
"269","We are committed to using the UK's 2005 presidency of the European Union to promote the inclusion of aviation in the EU's emissions trading scheme."
"270","For shipping, our introduction of the tonnage tax has led to a trebling in size of the fleet since 1997."
"271","We want more ships to fly the British flag, to boost jobs and training, and to increase shipping and port capacity."
"273","Opportunity for all. We are determined to spread the benefits of enterprise to every community in the country."
"274","Every regional economy has different strengths, and Regional Development Agencies now play an essential role in regional economic development."
"275","Our economy has grown in every quarter under this Government."
"276","We have given local authorities a direct incentive to promote local business creation, allowing them to keep up to £1 billion over three years of increased rate revenues to spend on their own priorities."
"277","The Local Enterprise Growth Initiative will work through local author ities to remove barriers to enterprise in the most deprived areas of England."
"278","In 1997, many parts of our towns and cities were suffering from deeply entrenched and multiple disadvantage."
"279","To tackle this we established a ten-year programme, the New Deal for Communities, empowering local communities - and this is already delivering improvements in education outcomes and crime reduction."
"280","No area in our country should be excluded from the opportunity to get ahead, to benefit from improving public services, and to be secure and safe."
"281","We will maintain our commitment to tackling issues of worklessness, low skills, crime, poor environment and health in our poorest neighbourhoods."
"283","Fairness at work. Since 1997, the Labour Government has introduced new rights for people at work and new opportunities for trade unions to represent their members."
"284","We see modern, growing trade unions as an important part of our society and economy."
"285","They provide protection and advice for employees, and we welcome the positive role they have played in developing a modern model of social partnership with business representatives."
"286","The Labour Party has agreed a set of policies for the workplace (the Warwick Agreement) and we will deliver them in full."
"287","They will be good for employees and for the economy."
"288","We have introduced, for the first time, an entitlement for every employee to four weeks' paid holiday, and we propose to extend this by making it additional to bank holiday entitlement."
"290","Promoting equality at work. A strong economy draws on the talents of all."
"291","We have extended legislation to protect people from discrimination at work to cover not only gender, disability, race and ethnicity but also religion and sexual orientation and - from 2006 - age."
"292","Labour has transformed legal rights for disabled people."
"293","We will empower disabled people further by joining up services and expanding personalised budgets."
"294","We will take further action to narrow the pay and promotion gap between men and women."
"295","The Women and Work Commission will report to the Prime Minister later this year."
"296","We will implement the National Employment Panel's report on measures to promote employment and small business growth for ethnic and faith minorities."
"297","We will take forward the Strategy for Race Equality to ensure that we combat discrimination on the grounds of race and ethnicity across a range of services."
"298","The Equalities Review repor ting to the Prime Minister in 2006 will make practical recommendations on the priorities for tackling disadvantage and promoting equality of opportunity for all groups."
"300","Thriving rural areas. Since 1997, Labour has made it more difficult to close rural schools, put in £750 million to support rural post offices and introduced a 50 per cent rate relief on village shops."
"301","Through our £51 million Rural Bus Subsidy Grant we have delivered over 2,200 new bus services in rural areas this year."
"302","We set targets for the creation of affordable homes in rural areas, which we have now exceeded."
"303","We will explore how to ensure a proportion of all new housing development is made available and affordable to local residents and their families."
"304","Because of our success in achieving extensive reforms in the Common Agricultural Policy (CAP), 2005 will be the first year for decades when farmers will be free to produce for the market and not simply for subsidy."
"305","We will continue to push for further reform of the CAP in the next Parliament, starting with the sugar regime."
"306","We will continue to promote the competitiveness of the whole food sector, and assure the safety and quality of its products."
"307","We will introduce an explicit policy for schools, hospitals and government offices to consider local sourcing of fresh produce."
"308","We will continue to improve the environmental performance of agriculture, rewarding every farmer in England for environmental protection and enhancement work through our new Stewardship schemes."
"309","We will also promote biomass, bio-fuels and non-food crops."
"310","We will work to tackle diffuse water pollution through addressing impacts across water catchments without the costs falling on water customers."
"311","Under difficult circumstances, Labour is working with the fishing industry to create a sustainable long-term future for the fishing communities of the United Kingdom."
"312","We have reformed the Common Fisheries Policy and will continue to protect the marine environment and ensure fish stocks and their exploitation are set at sustainable levels."
"313","We will introduce the Animal Welfare Bill as soon as possible in the new Parliament."
"315","The choice for 2010. The Conservatives are the party of high interest rates, high inflation, mass unemployment and house repossessions."
"316","Their taxand-spend promises do not add up"
"317"," and they would cut £35 billion from public investment."
"318","With new Labour, Britain can seize the opportunities of globalisation, creating jobs and prosperity for people up and down the country."
"319","We can only do so if we build a clear sense of shared national economic purpose, not just around economic stability but also investment in infrastructure, skills, science and enterprise."
"320","The choice is to go forward to economic stability, rising prosperity and wider opportunities with new Labour."
"321","Or go back to the bad old days of Tory cuts, insecurity and instability."
"324","Chapter 2 Education: More children making the grade. Forward to personalised learning, not back to mass failure. 1997: 42nd in the World Education League 2005: Third best in the world for literacy at age ten and fastest improving for maths."
"325","2010: Every 16-year-old offered school, college, training or apprenticeship  "
"326","Education is still our number one priority."
"327","In our first term, we transformed recruitment, training and methods of teaching, with record results in primary schools."
"328","In our second term we have driven fundamental reform in secondary provision - more teachers and support staff, more money, specialist schools and the Academies programmes."
"329","Our plan now is to tailor our education system to individual pupil needs, with parents supporting teachers and support staff in further raising standards."
"330","That means music, art, sport and languages as well as English and maths in primary school"
"331"," a good secondary school for every child, with modern buildings and excellent specialist teaching"
"332"," catch-up support for all children who need it"
"333"," the guarantee of a sixth-form place, apprenticeship or further education at 16"
"334"," sufficient quality and quantity in higher education."
"335","At each stage we send a clear message - every child has a right to a good education, but no child has the right to disrupt the education of other children."
"337","The new Labour case. For generations our country has been held back by an education system that excelled for the privileged few but let down the majority."
"338","Every child can and should be able to fulfil their potential."
"339","We will achieve this by uniting our commitment to equal opportunities for all children with a reform programme which gives every child and young person, from pre-school to sixth-form or apprenticeship and beyond, the personalised package of learning and support they need."
"340","In a third term, we will entrench high expectations for every child, ensure the flexibility of provision to meet all needs and make parents true partners as we aim for the highest ever school standards."
"342","Every pupil with better teaching. There is no greater responsibility than teaching the next generation."
"343","Head teachers, teachers and support staff deserve support and respect."
"344","There are now over 28,000 more teachers and 105,000 more support staff than in 1997"
"345"," graduate teacher applications are up 70 per cent"
"346"," average salaries are up by more than 30 per cent."
"347","The remodelling of the school workforce is benefiting staff and helping to tailor provision to pupil need."
"348","We will now go further - to intensify in-service training for teachers, to widen further routes into teaching, to help more teachers and pupils get the benefit of the range of support staff now working in schools, from learning mentors to music and arts specialists."
"349","The goal is clear: ever y pupil with extra support in their weakest subjects and extra opportunities in their strongest."
"350","We want to see every pupil mastering the basics."
"351","If they are not mastered by 11, there will be extra time in the secondary curriculum to get them right: schools will be judged on how pupils do in English and maths at the ages of 11, 14 and 16."
"352","We want every pupil to be stretched, including the brightest, so we will develop extended projects at A-level, harder A-level questions to challenge the most able, and give universities the individual module marks - as well as overall grades - of A-level students."
"353","`Our plan now is to tailor our education system to individual pupil needs, with parents supporting teachers and support staff in further raising standards.'  "
"355","Every school with more money and effective leadership. Since 1997, school funding has risen by £1,000 per pupil."
"356","Education spending that was 4.7 per cent of national income in 1997 will rise to 5.5 per cent this year."
"357","We will continue to raise the share of national income devoted to education."
"358","And we will continue to recognise the additional needs of disadvantaged pupils."
"359","We will also ensure fundamental reform in the way the money is spent."
"360","Funding will be allocated on a multi-year timescale."
"361","There will be a dedicated national schools budget set by central government, with a guaranteed per pupil increase for every school."
"362","Heads and governors will be in control."
"363","Successful schools and colleges will have the independence to take decisions about how to deploy resources and develop their provision."
"364","Schools will work together to raise standards."
"365","New provision will be created where standards are too low or innovation is needed."
"366","Local authorities have a vital role in championing the parent interest and providing support services."
"367","A strong, effective governing body is essential to the success of every school and governors must be given support to help them play this role."
"368","We will allow more flexibility in the structure of governing bodies, including the ability to have smaller governing bodies, of ten members or less, to streamline management while strengthening the position of parents."
"370","Parents as partners. Our aim for the education system is to nurture the unique talents of every child."
"371","But children and schools do best with real and effective parental engagement."
"372","Parents should have the information and support they need to encourage their children, from the first reading book to the key choices they make at 14 and 16."
"373","And parents should be central to the process of assessing school performance and driving improvement, as well as their vital role in promoting good behaviour and raising the quality of school meals (see chapter 4)."
"374","All schools should have good home-school links, building on the new school and pupil profiles."
"375","Some schools are using ICT to make contact between parents and schools easier and better for both sides."
"376","We will encourage all schools to follow suit."
"377","Ofsted now actively seeks the views of parents when undertaking inspections."
"378","Ofsted will be given new powers to respond to parental complaints and where necessary to close failing schools or replace failing management."
"380","Enriching primary schools. International studies show that our ten-year-olds are the third highest achievers in literacy in the world and the fastest improving in maths."
"381","Three-quarters of 11-year-olds now reach high standards in reading, writing and maths."
"382","We will intensify our literacy and numeracy programme to help an extra 50,000 pupils achieve high standards at age 11, reaching our targets of 85 per cent of pupils succeeding at the basics."
"383","All primary school children will have access to high-quality tuition in the arts, music, sport and foreign languages."
"384","We have set aside funds for this purpose, working with head teachers to develop support programmes and modernise the school workforce."
"385","We have abolished infant class sizes of more than 30, and almost all primar y schools have gained improved facilities since 1997."
"386","We will now upgrade primary schools nationwide in a 15-year Building Schools for the Future programme, including under-fives and childcare facilities where needed."
"387","Primary schools will become the base for a massive expansion of out-of-school provision (see chapter 6)."
"388","Foundation schools operate within the local family of state schools, and are funded in the same way as others, but manage their own assets and employ their staff directly."
"389","We will allow successful primary schools, like secondary schools, to become foundation schools by a simple vote of their governing body following consultation with their parents."
"391","Every secondary school an independent specialist school. We want all secondary schools to be independent specialist schools with a strong ethos, high-quality leadership, good discipline (including school uniforms), setting by ability and high-quality facilities as the norm."
"392","The way to achieve this is not a return to the 11-plus or a free-for-all on admissions policies."
"393","It is to ensure that independent specialist schools tailor education to the needs, interests and aptitudes of each pupil within a fair admissions system."
"394","There are over 2,000 specialist schools - schools which teach the entire national curriculum and also have a centre of excellence."
"395","Their results are improving faster than those of non-specialist schools."
"396","We want every secondary school to become a specialist school and existing specialist schools will be able to take on a second specialism."
"397","Over time all specialist schools will become extended schools, with full programmes of after-school activities."
"398","Every part of the country will benefit, over fifteen years, from the Building Schools for the Future programme."
"399","This is a once in a generation programme to equip the whole country with modern secondary education facilities, open five days a week, ten hours a day."
"400","Good schools will be able to expand their size and also their influence - by taking over less successful schools."
"401","We will develop a system to create rights for successful schools to establish sixth-form provision where there is pupil and parent demand, extending quality and choice for local students."
"402","Britain has a positive tradition of independent providers within the state system, including church and other faith schools."
"403","Where new educational providers can help boost standards and opportunities in a locality we will welcome them into the state system, subject to parental demand, fair funding and fair admissions."
"404","We strongly support the new Academies movement."
"405","Seventeen of these independent non-selective schools are now open within the state system"
"406"," their results are improving sharply, and 50 more are in the pipeline."
"407","Within the existing allocation of resources our aim is that at least 200 Academies will be established by 2010 in communities where low aspirations and low performance are entrenched."
"408","We will encourage more small schools and boarding schools as ways of helping the most disadvantaged children."
"409","We will make sure schools in deprived areas receive the resources they need."
"410","To enable all young people to enjoy the opportunities previously enjoyed by the few, we are developing a nationwide week-long summer residential programme for school students."
"411","We support partnership between the state and private sectors to bridge the unhealthy historic divide between the two."
"412","In a third term we will entrench high expectations for every child, provide the flexibility of provision to meet all needs and make parents tr ue partners as we aim for the highest ever school standards."
"414","Good discipline. Every pupil has the right to learn without disruption"
"415"," no teacher should be subject to abuse or disrespect."
"416","We have given head teachers the powers needed to maintain discipline and the highest standards of conduct."
"417","Violent behaviour, including the use of knives will not be tolerated."
"418","We are also working with schools and teacher organisations to implement a zero tolerance approach to lower-level disruption."
"419","The number of places in out-of-school units has almost doubled, and the quality of provision has been enhanced."
"420","We will give head teachers within each locality direct control of the budgets for out-of-school provision, so they can expand and improve it as needed."
"421","We will encourage more dedicated provision for disruptive and excluded pupils, including by charities and voluntary groups with expertise in this area, and no school will become a dumping ground for such pupils."
"422","Parents have a duty to get their children to attend school."
"423","We have introduced parenting orders and fines and will continue to advocate truancy sweeps."
"425","Special educational needs. Children with special educational needs require appropriate resources and support from trained staff."
"426","For some this will be in mainstream schools"
"427"," for others, it will be in special schools."
"428","Parents should have access to the special education appropriate for their child."
"429","It is the role of local authorities to make decisions on the shape of local provision, in consultation with local parents."
"431","No more dropping out at 16. The historic problems of our education system at 14-plus have been an academic track that has been too narrow and a vocational offer too weak."
"432","We are determined to raise the status and quality of vocational education."
"433","Beyond the age of 14, GCSEs and A-levels will be the foundation of the system in which high-quality vocational programmes will be available to every pupil."
"434","Designed in collaboration with employers, specialised diplomas will be established in key areas of the economy, leading to apprenticeships, to further and higher education and to jobs with training."
"435","We will review progress on the development of the 14-19 curriculum in 2008."
"436","We will not let economic disadvantage stand in the way of young people staying in education beyond the age of 16."
"437","We have rolled out Educational Maintenance Allowances, providing lower income students with a £30-a-week staying-on allowance."
