"","sentence_text_new"
"4","Labour Party Manifesto 1992. It's time to get Britain working again. Winter ending. 'A cold coming we had of it' huddled together in cardboard cities, crouched over shared books in leaking classrooms, crammed into peeling waiting-rooms, ice stamped into crazy-paving round polluted streams."
"5","Winter ending: paintings, poems bud hesitantly, tentative chords behind boarded facades"
"6"," factories open like daffodils, trains flex frozen rheumatic joints, computer-screens blink on in the sudden daylight."
"7","As the last cardboard boxes are swept away beneath busy bridges, the cold blue landscape of winter suddenly alive with bright red roses."
"8","Adrian Henri."
"9","March 1992."
"12","Foreword by the Rt. Hon. Neil Kinnock. Leader of the Labour Party. This general election is a choice between a Conservative government paralysed by recession, and a Labour government determined to get on with building recovery."
"13","Gripped by the longest recession since the war, Britain needs a government with a clear sense of direction and purpose."
"14","A government with the people and the policies to get Britain working again and to achieve sustained recovery -strength with staying power.Ê Labour will be such a government."
"15","But this election is not only a choice between policies, important though both are."
"16","It is also a choice between values."
"17","At the core of our convictions is belief in individual liberty."
"18","We therefore believe: First, that for liberty to have real meaning the standards of community provision must be high and access to that provision must be wide."
"19","Second, that those rights of the individual must, like all others in a free society, belong to all men and women of every age, class and ethnic origin and be balanced by responsibilities of fair contribution and law-abiding conduct."
"20","Third, that for rights and responsibilities to be exercised fully and fairly, government in Britain as in other industrialised democracies, must work to build prosperity by properly supporting research, innovation, the improvement of skills, the infrastructure and long-term industrial development."
"21","Our vision for Britain is founded on these values."
"22","Guided by them, we will make our country more competitive, creative, and just more secure against crime, aggression and environmental danger."
"23","We want government to serve the whole nation - using its power to realise this vision."
"24","Labour will be such a government."
"25","These are our convictions and we will work to fulfil them."
"26","They are also down-to-earth aims - essential objectives in a country hit by recession, suffering run-down public services and facing the intensifying pressures of European and global economic competition."
"27","Ml of those realities require that the government provides: a stable economic environment education and training that fosters the abilities of all young people and adults a firm emphasis on productive investment in both the public and private sectors. "
"28","Labour will implement and maintain those policies."
"29","They are vital for prosperity, for consistently low inflation and for continuous improvement in economic performance and living standards."
"30","They are also fundamental to improving the quality and quantity of provision in health and social services, and to combating poverty."
"31","We have absolute commitment to a high-quality National Health Service, free at time of need and not fractured and weakened by underfunding and a commercialised contract system."
"32","We will get on with fulfilling that commitment from the moment of our election - by strengthening and modernising the NHS, by extending care in the community and by establishing the National Health Initiative to prevent illness."
"33","Our pledges to increase the income of pensioners and families with children will urgently be fulfilled."
"34","Our undertakings to stop the perpetual experiments in schools and to raise standards of investment and achievement in education will be kept in full."
"35","These policies - like those to increase house-building, improve transport and protect the environment - are not only important to the well-being of the British people now."
"36","They are vital preparations for the future."
"37","In that future, we are determined that Britain will be a leader in the New Europe, setting higher standards and not surrendering influence by opting out."
"38","We have confidence in our country and in the qualities and potential of its people."
"39","We want to nourish their artistic, scientific, sporting and other abilities."
"40","And we want to enhance their democratic power too."
"41","We shall therefore make constitutional and other changes that will give renewed vitality to our democracy."
"42","We shall empower people as citizens and as consumers of public and private services."
"43","We will strengthen equality before the law and equality of opportunity for the majority of the population -women."
"44","Neither their legal status nor their chances in education, training and employment are full or free."
"45","We will ensure that the barriers to fairness are removed."
"46","These policies, like many others, manifest our practical commitment to freedom."
"47","That purpose is not confined to the shores of our country."
"48","In an age where liberty has made great advances in the world, there is still conflict, instability and want, causing great misery and inhibiting the peace and co-operation which we want to help to build."
"49","We shall, therefore ensure that our country has the defence capacity, the strength of alliance and the peace-making commitment necessary to safeguard the United Kingdom, to participate in international negotiations for disarmament, to deter aggression and to contribute to constructing a New World Order, now feasible through the strengthened United Nations."
"50","In our relations with the new democracies of Central and Eastern Europe as well as with the poverty-stricken peoples of the South, we will work from the principle that political freedom needs the sure foundation of economic security."
"51","In this increasingly inter-dependent world there are no distant crises."
"52","The Labour government will therefore, as a matter of moral obligation and in the material interests of our country, foster the development and trade relationships necessary for the advance of economic security, political democracy and respect for human rights."
"53","The United Kingdom has been through 13 years in which unemployment has more than doubled, irreplaceable assets have been wasted, markets at home and abroad have been lost, manufacturing investment has fallen, poverty has increased, the crime rate has rocketed, and talents have been neglected."
"54","Now our country faces clear alternatives."
"55","A Conservative government would mean a repeat of the same, stale policies which brought economic insecurity, privatised and underfunded public services and increased social division."
"56","The Conservatives have no policies which would mean sustained recovery, higher health care or improved educational standards."
"57","The arrogance remains which brought us the poll tax, centralisation in Britain and isolation in Europe."
"58","If they can't get it right in 13 years, they never will."
"59","The Labour government will mean a fresh start for Britain."
"60","It will mean strong and continued emphasis on investment for economic strength."
"61","It will mean action to help families, fair taxation, incentives for enterprise and support for essential community services."
"62","It will mean greater freedom, securitv and opportunity."
"63","It will mean change for the better."
"64","It's time to make that change."
"65","It's time for Labour."
"67","Immediate action for national recovery. Britain faces a huge task of national reconstruction."
"68","From day one, the new government must start to get Britain working again."
"69","It must get the economy out of recession, it must lay foundations for the future."
"70","Recovery must be based on investment, for only investment will create lasting prosperity."
"71","Today millions of people fear losing their job, their home or their business."
"72","The new Labour government's National Recovery Programme will start to remove that fear with immediate action on investment, jobs and training."
"73","It will combat recession now and build sustained and sustainable recovery for the future."
"74","Britain's economic problems are deep-seated."
"75","We will not be able to do at once everything that we would like to do."
"76","But we will get down to business right away."
"77","And as with any properly-run business, our immediate programme will be part of a strategy for long-term success."
"79","Action for industry.  1. We will provide enhanced capital allowances to encourage companies immediately to bring forward manufacturing investment in new machinery and plant, innovation and design."
"80","This will last for a limited period."
"81","2. We will introduce an investment tax incentive tailored to the special needs of small businesses."
"82","3. We will immediately begin the phased release of receipts from the sale of council houses land and property receipts to allow local authorities to build new homes and improve old ones."
"83","More building workers in the recession-savaged construction and building supply industries will be employed and more families rehoused."
"84","Equivalent arrangements will be made in Scotland."
"85","4. We will allow British Rail to proceed with a leasing scheme of 188 new Networker trains on the North Kent line - the first step in securing private investment to help modernise Britain's railways and protect our environment."
"87","Action for jobs. 5. Housing investment will generate jobs."
"88","We will also establish a work programme combining three days a week work for the unemployed - paid at the proper rate - with two days' training and job seeking."
"89","This will benefit the community and ensure that unemployed people are offered a range of employment and training opportunities."
"90","The programme which can be quickly and easily established will allow us to start bringing down unemployment immediately."
"91","Our aim is to prevent long-term unemployment rather than just trying to cope with it after it has occurred."
"93","Action for skills and schools. 6. We will restore last year's training cuts which caused so much damage to training for young people and the unemployed."
"94","We will establish a new cash-limited 'Skills for the 90s' fund with an initial budget of £300 million, to upgrade the training of those in work."
"95","Investment will be targeted particularly at areas of skill shortages and will give people who are now unskilled the chance to acquire basic skills."
"96","7. Over the next 22 months, additional resources of at least £600 million will be available for investment in education."
"97","Amongst other projects, this will help to tackle equipment shortages and the backlog of school repairs."
"99","Action for the NHS.  Over the next 22 months, additional at least £1 billion will be available for investment in the National Health Service."
"100","This will help the NHS to make real advances in care and treatment."
"102","Action for children. 9. We will start to increase nursery education places for three and four year olds by making sure that local councils actually use the money they receive for nursery education to create new places and by switching capital funds earmarked for the City Technology College programmes."
"103","This will lead to the rapid creation of 25,000 new places."
"104","10. We will extend the exemption from tax which applies to workplace nurseries to all forms of employer assistance with childcare."
"106","Getting results. Every action we propose makes sense by itself."
"107","Together our proposals add up to a co-ordinated programme for recovery."
"108","By investing in house-building and repairs, we start to rehouse homeless people."
"109","By investing in public transport, we start to transform commuters' lives and create a cleaner environment."
"110","By investing in the NHS, we offer new security to the patients and the public."
"111","By investing in education we nourish the talents of children and lay the basis for future success."
"112","With each step we employ more workers in industries from construction and computer software to high-tech engineering printing and publishing."
"113","We enable businesses to thrive."
"114","We save taxpayers' money on benefits."
"115","We transform unemployment claimants into employed contributors."
"116","Labour's programme for national recovery will this year help bring Britain out of recession."
"117","Public investment will modernise services help business and industry and stimulate private investment."
"118","It will make you and your family better off."
"120","Building a strong economy. Labour's economic policy rests on one simple, commonsense fact."
"121","The only way for Britain to build a strong economy is to make the goods and services which people at home and abroad want to buy Britain is in a race for economic survival and success."
"122","Faced with intense competition, companies and countries can succeed only by constantly improving their performance."
"123","Every employee in every enterprise must be involved in a new partnership so that trained and talented people can use the most modern technologies to create top-quality products."
"124","But none of this will happen with a government that believes that the best thing is to do nothing."
"125","Three thousand men and women have lost their jobs on every working day since John Major became Prime Minister."
"126","Every week 900 businesses go bankrupt."
"127","Every dav 200 families lose their homes."
"128","The Conservatives have created the longest recession for 60 years."
"129","They have no idea how to get us out of it and even less idea how to stay out of it."
"130","Britain needs a Labour government which will back British industry in the way our competitors back theirs."
"132","A government which business can do business with. Modern government has a strategic role not to replace the market but to ensure that the market works properly."
"133","Other competitors in Europe and elsewhere recognise that industrial policy must be at the heart of economic policy."
"134","It is the government's responsibility to create the conditions for enterprise to thrive."
"135","Business needs sustained and balanced growth, with stable exchange rates, steady and competitive interest rates and low inflation."
"136","We will deliver them."
"137","Business must have a high level of education science and skills."
"138","Incentives for high-tech investment."
"139","Modern transport."
"140","Strong regional economies for new developments."
"141","We will deliver them."
"143","We will keep prices down. Inflation has been suppressed by recession."
"144","But it has not been cured."
"145","To curb inflation."
"146","Labour will maintain the value of the pound within the European Exchange Rate Mechanism."
"147","We will manage credit sensibly."
"148","We will stop excessive price rises in water, electricity, telephones, transport and NHS prescriptions."
"149","The only way to defeat inflation in the medium term is to raise productivity substantially."
"150","By promoting investment and improving skills we will tackle the underlying causes of inflation."
"152","We will introduce fair taxes. Attacking poverty is an essential component of Labour's programme for national recovery and prosperity."
"153","The most effective way to reduce poverty quickly is to increase child benefit and pensions and take low-paid people out of taxation."
"154","To achieve these goals, we will reform the national insurance and income tax system."
"155","We will increase child benefit to £9.95 a week for all children with the full value going to every family."
"156","This measure will benefit seven million families and is worth £127.40 a year to a family with two children."
"157","We will increase the basic retirement pension by an extra £5 a week for a single person and £8 for a married couple."
"158","All pensioners will receive the full increase which will also go to widows and others on benefits linked by statute to the basic pension level."
"159","Twelve million people will benefit."
"160","We will abolish the two per cent national insurance contribution on earnings under £54 a week - effectively a £56 annual entry fee into the national insurance system."
"161","At present employees earning less than £405 a week pay contributions on all their earnings, while above that level no contributions are paid at all."
"162","This is an unfair anomaly in our tax structure."
"163","The ceiling on contributions will therefore be abolished."
"164","We will take 740,000 taxpayers out of taxation altogether by increasing the personal allowance and wife's earned income allowance by more than inflation."
"165","Married couples will have the option of splitting the married couple's allowance between them as they choose."
"166","The basic rate of tax will remain unchanged at 25 per cent, as will the 40 per cent rate."
"167","A new top rate income tax of 50 per cent will apply to individuals with an income of at least £40,000 this year."
"168","Labour's tax and benefit changes are self-financing."
"169","They are fair."
"170","And they will make every individual employee on earnings up to at least £22,000 a year better off."
"172","We will reform decision-making. Britain urgently needs a better way of making economic decisions."
"173","Government must decide at the same time how much to spend and how to pay for spending."
"174","The Budget should decide both."
"175","Every autumn, we will make a 'State of the Nation' report on the British economy."
"176","Our national economic assessment will then allow employers, trade unions and other social partners to consider Britain's competitiveness and the competing claims on national output."
"177","These considerations will be an important influence on collective bargaining."
"178","In order to provide honest information about the state of the British economy, we will make the Central Statistical Office independent and free from political interference."
"179","We will halt the deterioration which has taken place in the pay and conditions of many public service workers - often through pay settlements which have been arbitrarily imposed upon them."
"180","We will seek fairer and more rational ways of determining public sector pay within clearly defined budget limits."
"182","We will cut unemployment. We are determined to make a swift reduction in unemployment and have explained in our National Recovery Programme just how this will be done."
"183","It includes immediate action for unemployed people, as well as direct investment - for instance, in construction - to create thousands of new jobs."
"184","Steady and sustained economic growth will generate jobs that last."
"185","Better training will help people get back to work."
"186","Unemployment must be tackled by the European Community as a whole."
"187","We will use our influence in Europe to secure the necessary policies for co-ordinated growth."
"189","We will modernise Britain's industries. It is time to rebuild Britain's industrial strength."
"190","For lasting recovery, Britain needs a modern industrial policy designed to build skills, upgrade technology, encourage industry in every region and expand exports."
"191","An Investment Decade for Britain will start with the immediate introduction of enhanced investment allowances (see page 9)."
"192","We will help Britain's high-technology industries with a 25% tax credit for additional investment in research and development."
"193","Small firms will be assisted with a new investment scheme, combining a cash-limited fund for new investments with tax incentives tailored to heir special needs."
"194","Britain's industrial future depends on transforming our inventive genius into manufacturing strength."
"195","Labour will work with industry to establish British Technology Enterprise and create Technology Trusts throughout Britain, building bridges between industries and universities and helping firms turn good ideas into commercial products."
"196","We will encourage the development of the most modern telecommunications networks."
"197","Labour's Minister for Science will develop a national strategy to promote high-quality science and technology, so that Britain can better anticipate and respond to the challenges of the future."
"198","All over the world, industries face unprecedented environmental challenges."
"199","We will support new research into environmentally-friendly technologies and launch a Great Environment Exhibition to publicise and to promote sales of the cleanest British technologies."
"201","We will strengthen our regional economies. We will establish new Regional Development Agencies in England, strengthen Scottish Enterprise and the Welsh Development Agency and modernise regional incentives."
"202","Regional agencies will become powerhouses for industrial development, encouraging investment, technology and skills."
"203","The Scottish Parliament will have a vital role in building the competitive strength of the Scottish economy."
"204","Our new Welsh Assembly will also have important economic responsibilities."
"205","Labour's National Investment Bank, operating on strictly commercial lines, will bring public and private sector together to invest in long-term regional and national infrastructure projects."
"206","Small and growing businesses will have a new deal."
"207","As well as the lowest possible interest rates, they need the backing on which their competitors can rely in France and Germany."
"208","Labour will establish a network of one-stop advice centres providing them with access to high-quality specialist assistance."
"209","We will give special attention to the establishment of small businesses by women, and members of the ethnic minority communities, who often face difficulties raising venture capital."
"210","Under the Conservatives, Britain has moved from manufacturing trade surplus to manufacturing trade deficit."
"211","The recent privatisation of the Export Credit Guarantee Department can only do further damage."
"212","Labour will create modern export services for the nation and the regions."
"214","We will invest in modern transport. Commuters and companies need fast, safe transport Labour will act to make sure they get it."
"215","It is absurd that French Railways can raise funds for new investment in the City of London, when British Rail is not allowed to do so."
"216","We will remove these restrictions."
"217","Leasing schemes will allow large-scale investments to be financed at relatively little cost to the public sector borrowing requirement."
"218","Private finance will also be mobilised for a high-speed rail network which will eventually link every region to the Channel Tunnel with proper environmental safeguards."
"220","We will improve energy supplies. Families, commerce and industry need heat, light and power at prices they, can afford."
"221","Britain is well placed with reserves of coal, oil and gas which must be husbanded in a national energy policy to balance the needs of the present with those of the future."
"222","We will encourage enhanced recovery of oil from the North Sea and avoid becoming too dependent in on imported fuel."
"223","We will meet our international obligations to reduce harmful chimney emissions."
"224","We will restore public control of the National Grid and give it new duties and powers to ensure the long-term security of electricity supplies."
"225","We will secure the long-term future of the coal industry by reducing imports, stopping the 'dash for gas' and reining back on open-casting."
"226","We will retain the Department of Energy and move its petroleum engineering directorate to Aberdeen."
"227","We will require the energy companies to invest in R&D, and encourage the development of clean-burn coal technology."
"229","We will invest in people at work. The key to a successful modern economy is a well-educated and motivated workforce."
"230","We cannot compete on the basis of low educational standards or poor working conditions."
"231","Britain's future must be high skill, high wage and high tech."
"232","Two things are needed: a training revolution to modernise people's skills, and rights for employees to fair treatment at work."
"233","We will offer unemployed people a range of employment and training opportunities."
"234","Our aim is to ensure that anyone who is unemployed for more than six months has a choice of job experience or training."
"235","We will also help the people often left out of good training opportunities, including the disabled, women returning after caring for children, and those with special educational needs."
"236","Expanded childcare will help women return to work and undertake training."
"237","A critical task is to upgrade the skills of people in work."
"238","Training and Enterprise Councils will be retained, reformed and made more broadly representative of their local communities and given stable budgets."
"239","Instead of the present series of piecemeal initiatives we will establish a coherent national training policy to meet the needs of industry and provide people with real equal opportunities at work."
"240","All employers, except for very small businesses, will be obliged to invest a minimum amount on training their workforce or make a contribution to the local or national training effort."
"241","Training will be a real partnership between government and industry, not an excuse to shift all the burden onto employers."
