"","sentence_text_new"
"233","Our plans to spread employee ownership and participation will encourage wages to be st according to the profitability of individual firms rather than to some national 'going rate'."
"234","In addition, we will encourage moves towards greater decentralisation of wage bargaining at company level and, in the longer term as national and regional government develops, in the public sector."
"236","Promoting Enterprise. Government needs to provide an immediate impetus to get the economy moving."
"237","But long-term private investment in the production of high-quality tradable goods and services is essential for long-term success."
"238","This will only be possible if we encourage a climate of investment, enterprise and partnership."
"239","We will: Reform taxation to increase investment."
"240","We will increase investment substantially in schemes such as SMART to encourage innovation in industry, particularly in small and medium-sized enterprises, especially those involved in manufacturing."
"241","We will reform corporation tax and the taxation of savings to achieve even treatment for different forms of savings."
"242","This will reduce the current tax penalties on investment in industry."
"243","Encourage a long-term approach to private investment."
"244","We will reverse the burden of proof for acquisitions away from the target company towards the predator, and require companies to ballot their shareholders on bid plans."
"245","We will reform company law to require greater disclosure of information such as expenditure on research and development."
"246","We will define the responsibilities of non-executive directors and insist that all publicly quoted companies have them on their boards."
"247","Encourage small business and the self-employed, and ensure a 'level playing field' for them in competing with their larger counterparts."
"248","This will include relieving the administrative burden on small business, legislating to make interest payable on overdue debt, and encouraging TECs, chambers of commerce and local enterprise agencies to reorganise to form a network of business-led 'one-stop shops'."
"249","We will encourage, and if necessary legislate for, banks to treat small businesses fairly by agreeing contracts for services."
"250","Encourage flexibility in working patterns, including part-time and flexi-time work, job-sharing and homeworking, adequate backup for carers of the young or old, and access to appropriate training."
"251","We will encourage a new system of tax-free child-care vouchers for parents of children under five, given by employers and usable in workplace, local authority and private nurseries and for individual qualified carers."
"252","Share success in industry."
"253","We will legislate to establish the right of every private sector employee in a substantial company to have access to a share in ownership and/or in the profits they help to create."
"254","We will encourage profit-related pay, employee share-ownership schemes and employee buy-outs."
"255","We will relaunch the Cooperative Development Agency."
"256","Build partnership in industry."
"257","We will ensure that every employee has a right to participate in decision-making in their enterprise."
"258","We will set up a new Industrial Partnership Agency to help companies and their employees find the precide forms of partnership which best suit them."
"260","Serving Customers. Many financial institutions, and particularly some of the high-street banks, have a poor record of customer service, for individuals and businesses."
"261","It is far too common to see charges applied to accounts, or interest rates changed, without customers being fully informed, and to see new types of accounts opened without existing customers being told that they could benefit from them."
"262","Banks which are responsive to their customers will be good for the economy."
"263","We will ensure that commercial borrowers are entitled to a full contract specifying the terms, conditions and duration of the services provided."
"264","We will introduce rights for customers of all financial instutions, ensuring they are fully informed when changes are made which do or might affect them."
"266","Child Care Vouchers. Britain seriously lags behind its continental neighbours in provision for child care for working parents."
"267","This not only unfairly impedes opportunity for the people concerned."
"268","It holds back the contribution to the economy of many highly skilled workers."
"269","We will encourage the introduction of a system of child care vounchers, provided by employers to parents with children under school age."
"270","They will be usable to pay for child care in a range of places - workplace, local authority or private nurseries, play groups or by individual qualified carers."
"271","The parent will chose, topping up the value if they wish."
"272","Child care vounchers will be deductible expenses for the employers and tax free for the parents."
"273","Self-employed people will be able to purchase vouchers and receive similar tax advantages."
"274","In due course the principle could be extended to cover child care for older children."
"276","Creating Long-Term Prosperity. We will change the ways in which economic policy is made and implemented, to bring greater stability and a sensible framework to economic management - ending the present 'boom, bust' approach."
"277","This requires fuller integration with the European Community."
"278","Our key changes are: Establishing an operationally independent Bank of England to become the Central Bank of the UK, to ensure disciplined economic management, to end political manipulation of the economy and to form the rock upon which a long-term anti-inflationary strategy can be built."
"279","This will also help progress towards an independent European Central Bank."
"280","Moving sterling to the narrow band of the European Exchange Rate Mechanism as sson as possible, helping stable progress towards lower interest rates."
"281","Taxes and public spending to be set to reach a 'savings target' for the nation over a period of years."
"282","We will set a target as a total of private- and public-sector savings, and adjust fiscal policy to achieve the target over the medium term."
"283","If the country does not save enough to achieve the target, we will alter taxes and public spending accordingly, to ensure adequate longt-term investment and keep the economy developing in a non-inflationary way."
"284","We will encourage individual savings by giving tax relief on all income piad into new Registered Savings Account."
"286","Reform of the annual Budget. We will publish a draft Budget four months before the final version, to promote open discussion of economic and taxation and policy."
"287","This will facilitate the integration of spending and revenue-raising, a measure we have long advocated."
"288","This will also make it easier to measure the impact of economic policy on the environment."
"289","We will establish an indpendent National Statistics Commission to collect and publish statistics and improve their quality."
"290","Working towards European economic and monetary union, including the establishment of an independent European Central Bank and a single European currency."
"291","We will renounce the Conservatives' Maastricht 'opt-out' clause, accept the timetabled approach to EMU, and renegotiate the Social Chapter with a positive British input."
"293","Changing the Economy for Good. Liberal Democrats recognise that if we are to improve Britain's disappointing economic performance we have to change the governmental system which produces it."
"294","Our proposals for electoral and constitutional reform are a prerequisite for better economic performance."
"295","Proportional representation will produce greater stability in government, ending the economic disruption caused by sudden sharp swings in government policies before and after elections."
"296","Home rule and decentralisation will ensure that economic power and prosperity is spread through Britain."
"297","Integration within Europe will create the framework for long-term economic strength."
"298","Freedom of information legislation and open government will improve competition and encourage informed debate."
"299","A written constitution will ensure that politicians can no longer ignore long-term priorities for short-term expediency and political advantage."
"301"," 2.Britain's Environment: Environmental Protection and Conservation. Liberal Democrats are determined to ensure that Britain changes its way so that it becomes a leader, not a laggard, in facing the environmental challenge."
"302","Polluters will pay and conservers will be rewarded."
"303","Taxation will be gradually shifted from the things we want more of - income, savings and value added - to the things we want less of: pollution and resource depletion."
"304","The accelerating destruction of the environment is one of the most serious challenges we face today."
"305","Its symptoms are becoming clearer every year, from global warming to holes in the ozone layer to poisoned rivers and polluted air at home."
"306","They threaten not just our ability to enjoy our towns and countryside but our health and our children's future."
"307","Liberal Democrats aim to cut pollution and clean up the local environment."
"308","We aim to build a society that does not create wealth at the expense of the environment."
"309","Our economy currently functions unsustainably, producing unacceptable levels of pollution and rates of resource depletion."
"310","We will create new incentives to follow environmentally sensitive strategies and behaviour."
"312","Protecting our heritage. Conserving and enhancing the physical environment, countryside and townscape alike, is of crucial importance to everyone's quality of life."
"313","Liberal Democrats will: Improve countryside protection policies for National Parks, heritage coasts, areas of outstanding natural beauty, and sites of special scientific interest."
"314","We will tighten controls against exploitation, we will create more National Parks and we will improve access to the countryside."
"315","Introduce Countryside Management Agreements for farmers and landowners who wish to take them up."
"316","These will be drawn up in conjunction with local planning authorities with the aim of managing the countryside to develop sustainable agriculture, safeguard plant and animal wildlife, and preserve traditional landscape features, such as woods, hedgerows and dry-stone walls."
"317","Reform land use planning so that the protection of the natural environment becomes a major feature of the planning system."
"318","We will decentralise planning decisions as much as possible, giving a key role to the local plan drawn up by the local authority."
"320","Clean up the cities. We will improve public transport, reduce traffic congestion, and encourage pedestrianisation and cycling schemes."
"321","We will encourage more parks, gardens and green spaces."
"322","We will provide more resources for councils to deal with noise complaints and make compensation for excesive commercial noise more widely available."
"323","Promote better waste management."
"324","We will provide grants for recycling schemes, introduce regulations on the use of packaging materials, and encourage local authorities to clean up litter."
"325","We will clean up beaches and coastlines by ensuring full treatment of sewage."
"327","Improve standards of animal protection. We will set up an Animal Proection Commision to enforce and recommend changes to legislation."
"328","We will phase out battery cages and unacceptable systems of factory farming, tighten controls on the export of live animals for slaughter, and establish a dog registration schem."
"329","We will prohibit experiments involving pain or distress for non-medical and non-veterinary purposes, promote alternatives to the use of animals in research and education, and ensure that laws against badger-baiting and dog-fighting are enforced."
"330","On hunting with hounds, Liberal Democrats as a party have declared their opposition, but recognise, like the Conservative and Labour parties, that legislation is a matter of conscience for each individual MP."
"331","We aim to build a society that does not create wealth at the expense of the environment."
"332","We will create new incentives to follow environmentally sensitive strategies and behaviour."
"333","We will issue factories and power stations with licences setting a ceiling on permitted emissions of pollutants."
"335","Air Pollution Index. Air pollution threatens the health of millions of people - particularly children, elderly people and anyone with a respiratory problem such as asthma."
"336","Government monitoring stations measure levels of pollutants such as nitrogen oxides or low-level ozone but fail to publicise them widely."
"337","When levels exceed World Health Organisation guidelines, the result is described as 'good' - in other countries it would be called 'poor'."
"338","We will increase the number of monitoring stations, ensuring that all major urban areas are covered."
"339","We will publish a regular air pollution index and encourage newspapers and TV and radio weather forecasts to use it."
"340","This will increase public consciousness of the pollution issue and prove of real benefit to the health of vulnerable people."
"342","Controlling Pollution. We will need market mechanisms, where feasible, to reduce pollution by ensuring that environmental costs and benefits are fed into the economy."
"343","Direct controls will still be needed in some cases."
"344","We will: Set targets for cutting pollution."
"345","These include a 30% reduction in carbon dioxide emissions from the UK by the year 2005"
"346"," our energy policy is greated to this target."
"347","We will ban the use of CFCs and halons by 1994."
"348","Introduce a system of tradable emission licenses."
"349","We will issue factories and power stations with licences setting a ceiling on permitted emissions of pollutants such as sulphur dioxide."
"350","These will be tradable: those who are most efficient at reducing pollution would have surplus licences which they could then sell either to those less efficient, or back to government."
"351","The targets for emissions - and therefore number of licences available - will be reduced year by year, leading to a steady fall in pollution."
"352","Create a new Department of Natural Resources will sole responsibility for environmental protection, leaving the Department of the Environment to cover local government and housing."
"353","We will set up an independent and powerful Environmental Protection Agency to work with the new European Environment Agency."
"354","Put forward plans for a powerful United Nations Environmental Programme to lead global efforts to protect the environment, operating within the framework of an 'Earth Charter'."
"355","We wish to see a world market in tradable emissions licences for carbon dioxide and other pollutants."
"356","This would not only provide incentives to cut pollution but also act as a channel for transferring resources to developing countries."
"358","Conserving Energy. Withoutout an effective energy policy, government canot have an effective environmental policy."
"359","Britain's national energy strategy must be set within an overall European framework, with the aim of reducing pollution, improving energy efficiency and boosting the use of renewables."
"360","We will: Support a Community-wide Energy Tax on all energy sources."
"361","This will be related to levels of carbon dioxide emitted and will provide a strong incentive for saving energy and investing in cleaner sources."
"362","Extra revenue raised through the tax will be fed back into the economy by reducing other taxes such as VAT and by protecting those least able to adapt to the higher price of energy."
"363","Invest in energy conservation and efficiency."
"364","We will set new energy efficiency standards for homes, offices and factories, and for products such as light bulbs, fridges and cookiers."
"365","We will give grants for home insulation and the installation of solar panels, and introduce energy audits of buildings."
"366","We will encourage combined heat and power and district heating schemes."
"367","Double government spending on renewable energy research."
"368","We will establish a Renewable Energy Office to promote research, development, and application, in particular of wave power, hot rocks geothermal energy, passive solar design of buildings, small-scale hydropower schemes and wind energy."
"369","We will complete the study on the construction of a Severn Barrage."
"370","Start to phase out nuclear fission power stations, which are prohibitively expensive and potentially hazardous."
"371","We aim to complete the phase-out at the latest by the year 2020 (and earlier if feasible), and we will not proceed further with the construction of the Sizewell B PWR."
"372","We will continue nuclear research, but at a lower cost."
"373","Reprocessing spent nuclear fuel rods increases the volume of waste and should be undertaken only when necessary for safety reasons."
"375","Water District Discount. According to the Government, water bills will rise by 50% within the next few years."
"376","For many households (in, for example, Wales), water bills are now higher than bills for all local government services put together."
"377","Since 1989 nearly a million summonses have been issued to people who could not pay their water bills."
"378","At present water companies have a Bult Supply Discount for commercial customers - a 'wholesale price' for their water."
"379","Liberal Democrats will alter the licensing conditions for water companies to extend this to groups of domestic consumers who live on large estates and in sheltered housing complexes."
"380","This District Discount will keep down bills for elderly people and many low-income inner-city residents living on large estates."
"382","Making Transport Clean and Efficient. By expanding the provision and quality of public transport and reducing society's dependence on the private car, we will improve travel efficiency and protect the environment."
"383","We will achieve this by: Investment in public transport, increasing its frequency of services, speed and safety, and reducing its cost to the individual - especially in isolated rural areas where the need is greatest."
"384","We will encourage new schemes, using light railways and trams in cities."
"385","We will require local authorities to define minimum standards of accessibility in their areas and draw up transport plans which meet them."
"386","Immediate improvements in the rail network, allowing more movement of goods and passengers by rail and less environmental damage."
"387","We will construct a high-speed link from the Channel Tunnel to connect with the major rail routes to the North and West, and extend electrification throughout the country."
"388","We oppose the privatisation of British Rail, but will allow private operators access to the rail network, while giving BR the freedom to raise investment capital on the open market."
"390","A reduction in fuel consumption. All political parties accept that long-term increases in petrol prices are not only environmentally necessary but aunavoidable."
"391","We will phase these in gradually by applying our Energy Tax to petrol, while at the same time graduating Vehicle Excise Duty and Car Tax according to fuel efficiency - so that the most efficient vehicles pay least."
"392","These price increases will not be brought in unless and untli compensation schemes for individuals and rural communities which have no alternative to the use of cars are ready to be introduced."
"393","We will scrap the remaining tax breaks for company cars and apply tougher limits to permitted emissions."
"394","Assisting people in rural areas by making concessionary fares on local public transport widely available."
"395","We will encourage the use of village minibuses, 'post and passenger' buses and taxi services."
"396","People who have no alternatives to private cars will be helped by our plans to graduate Vehicle Excise Duty and by specific target measures to help isolated communities."
"398","Action against traffic congestion in urban areas. We will encourage local authorities to introduce peak-hour bans on cars, traffic calming measures, car-sharing schemes and further pedestrianisation."
"399","We will introduce a variety of road-pricing schemes, in which motorists pay a premium to use highly congested roads at busy times of the day."
"401","New priorities for road building. We will approve major motorway or trunk road investments only where it can be demonstrated that alternative transport provision cannot meet the needs at lower economic and environmental cost."
"402","Essentially new roads and improvements will still proceed, but the creation of a 'level playing field' in decision-making between rail and road will ensure some switch of passenger and freight transport to the railways."
"403","The expansion of airports outside the South East, while at the same time freezing further development at Heathrow, Gatwick and Stansted."
"405","Reversing the decline in the Merchant Fleet. For economic and defence reasons, we will boost British shipping and promote recruitment and training for the Merchant Navy."
"407","Environmental planning policies. We will introduce planning policies which will encourage the building of homes near workplaces, leisure facilities, shops and other services."
"408","Where this is not possible, public transport routes must be easily accessible."
"409","We will encourage the use of information technology to decentralise work."
"411","Building a Sustainable Economy. Liberal Democrats aim to build an economy which is not only competitive and enterprising but also environmentally sustainable, leaving future generations a wealth inheritance - of knowledge, technology, capital and environmental assets - at least as great as that inherited by the current generation."
"412","Our proposals are: A better method of measuring economic progress."
"413","The conventional target of growth in GDP is apoor indicator of progress."
"414","We will modify GDP by incorporating measurements of pollution and resource depletion to create a figure for sustainable national income."
"415","We will also use indicators of social and personal quality of life such as changes to life expectancy, literacy rates and educational attainments to give a better measure of progress."
"416","The Prime Minister will present an annual report on changes in these indicators to Parliament."
"417","A system of environmental incentives and penalties."
"418","We will make available, grants and subsidies for environmentally friendly activities, such as home insulation, and to help individuals and industry adjust to our new stricter standards for pollution control. "
"419","We will penalise activities which harm the environment or deplete stocks of raw materials through taxation, so that prices reflect the damage they do."
"420","Our new Energy Tax is this manifesto's key proposal in this area."
"421","The revenue raised will be used to reduce other taxes such as VAT."
"422","Enable consumers to identify and choose sustainable products."
"423","We will introduce new product labels, showing information such as energy consumption during use and the environmental impact of the production process."
"424","We will introduce strict standards of life expectancy for consumer durables and encourage deposit-refund schemes."
"425","We will improve recycling and waste-disposal systems."
"426","We will encourage environmental audits for companies, showing the environmental impact of their activities."
"428","Reviving Rural Communities. Our policy for the coutnryside aims both to protect Britain's natural environment and to recreate success in one of Britain's greatest industries, agriculture."
"429","The farming industry is passing through a period of profound change"
"430"," most farmers recognise that the industry must achieve a better balance with the market and the environment."
"431","We will help this transition by: Working for fundamental reform of the Common Agricultural Policy."
"432","We want to ease the adjustment from the present price support mechanism towards market prices and direct support aimed at assisting the farming industry in transition and at environmental and social goals."
"433","These will be funded by savings made out of the present intervention mechanisms of the CAP."
"434","New incentive payments for environmental objectives, in particular for extensifying food production (using land less intensively), and reduced-input and organic farming."
"435","Countryside Management Agreements, described above, will be a key feature in this shift of CAP resources from price support to environmental goals."
"436","Reformed systems of direct support, aimed in particular at helping family farms and crofts."
"437","Introducing renewable limited-term tenancies for agricultural land, encouraging new entrants to farming."
"438","We will encourage local councils to continue to provide smallholdings and to introduce part-time holdings for new entrants."
"440","Expanding Forestry. We support the long-term aim of doubling the area of the UK under forestry, but this must include a higher proportion of broad-leafed hardwoods."
"441","We oppose the privatisation of the Forestry Commission."
"442","We will create more community forests near large towns."
"444","Encouraging fishing and fish farming. We will improve the Government's decommissioning proposals and appraise, with the industry, effective technical conservation measures."
