"","sentence_text_new"
"438","We believe that everyone up to the age of 19 should be learning, so we will expand sixth-form, college and apprenticeship places, and ensure that all 16to 19-year-olds in employment get access to training."
"439","We believe that every 16- to 19-year-old should have dedicated supervision and support, including in the further education sector."
"440","We will support sixth-form colleges and expect FE colleges to have dedicated centres for 16- to 19-year-olds."
"441","Further education is vital to vocational lifelong learning."
"442","Achieving a transformation of FE colleges requires both our increased investment and serious reform."
"443","Every FE college will develop a centre for vocational excellence, and we will establish new skills academies led by leading entrepreneurs and employers from the relevant skill sectors."
"444","Sir Andrew Foster's review will help shape the reform process."
"446","Children's Trusts. Ofsted reports show that local government is continuing to improve the vital services on which schools and families rely."
"447","Education and social services should collaborate to help youngsters, especially the most vulnerable, achieve their potential."
"448","Local government should be the champion of parents and high-quality provision, including special needs education, school transport, and other support services."
"449","We are reforming local education authorities to form Children's Trusts to provide seamless support to children and families and work in partnership with the private and voluntary sectors."
"451","World-class higher education, open to all. Universities are critical to Britain's future prosperity."
"452","We need a bigger, better higher education system."
"453","We are investing £1 billion more in the science base, and increasing public spending on higher education by 34 per cent in real terms."
"454","But graduates and employers must also play their part."
"455","Our funding reforms will generate £1 billion of extra funds by 2010"
"456"," the abolition of up-front fees and the creation of grants will help poorer students."
"457","A quarter of the income from the new student finance system will go to bursaries for students from poorer families."
"458","The maximum annual fee paid by students will not rise above £3,000 (uprated annually for inflation) during the next Parliament."
"459","As school standards rise we maintain our aim for 50 per cent of young people to go on to higher education by 2010."
"460","Two-year foundation degrees in vocational disciplines have a key part to play."
"461","PhD students are vital to universities and the nation's research base."
"462","The number of PhD students in the UK has risen by nearly 10,000 since 1997, and we are carrying through a 30 per cent increase in average PhD stipends to make doctoral research still more attractive to high-flyers."
"463","We will incentivise all universities to raise more charitable and private funding for student bursaries and endowments."
"465","The choice for 2010. Under their last government the Conservatives spent more on unemployment and debt interest than on education."
"466","Their priority now is to take at least £1 billion from state schools to subsidise private education for the privileged few."
"467","In addition they would allow a free-for-all in school admissions - including an extension of selection - for five- and 11-year-olds, cap the number of pupils who can succeed at GCSE and A-level, and reduce places in higher education."
"468","The choice for 2010 is forward with new Labour: pupils with quality and opportunity through the system from three to 18"
"469"," parents with the confidence that where there is no improvement there will be intervention"
"470"," teachers knowing that quality will be supported and rewarded"
"471"," and employers with a system that gets the basics right and provides the skills that industry needs."
"472","Or back with the Tories to an education system designed to look after the few but fail the many."
"475","Chapter 3 Crime and security: Safe communities, secure borders. Forward to neighbourhood policing, not back to rising crime. 1979-1997: Recorded crime had almost doubled."
"476","2005: Almost 13,000 more police officers 2010: A neighbourhood policing team in every community."
"477","Today, there is less chance of being a victim of crime than for more than 20 years."
"478","But our security is threatened by major organised crime"
"479"," volume crimes such as burglary and car theft, often linked to drug abuse"
"480"," fear of violent crime"
"481"," and anti-social behaviour."
"482","Each needs a very different approach."
"483","We are giving the police and local councils the power to tackle anti-social behaviour"
"484"," we will develop neighbourhood policing for every community and crack down on drug dealing and hard drug use to reduce volume crime"
"485"," we are modernising our asylum and immigration system"
"486"," and we will take the necessary measures to protect our country from international terrorism."
"488","The new Labour case. The modern world offers freedoms and opportunities unheralded a generation ago."
"489","But with new freedoms come new fears and threats to our security."
"490","Our progressive case is that to counter these threats we need strong communities built on mutual respect and the rule of law."
"491","We prize the liberty of the individual"
"492"," but that means protecting the law-abiding majority from the minority who abuse the system."
"493","We believe in being tough on crime and its causes so we will expand drugs testing and treatment, and tackle the conditions - from lack of youth provision to irresponsible drinking - that foster crime and anti-social behaviour."
"494","In a third term we will make the contract of rights and responsibilities an enduring foundation of community life."
"496","A neighbourhood policing team for every community. Overall crime as measured by the authoritative British Crime Survey is down 30 per cent - the equivalent of almost five million fewer crimes a year."
"497","Record numbers of police - almost 13,000 more than in 1997 - working with 4,600 new Community Support Officers (CSOs), local councils, and the Crown Prosecution Service deserve the credit."
"498","But local people want a more visible police presence and a role in setting local police priorities."
"499","So our pledge is a neighbourhood policing team for every community."
"500","We will carry on funding the police service to enable it to continue to employ historically high numbers of police officers."
"501","Hard-working police officers should be supported by professional and trained support staff."
"502","So a new £340 million a year fund will take CSO numbers up to 24,000 - to work alongside the equivalent of an additional 12,000 police officers freed up for frontline duties."
"503","And we will work with representatives of police officers and other police staff to develop a modern career framework for the whole police team."
"504","Not all problems need a 999 response, so a single phone number staffed by police, local councils and other local services will be available across the country to deal with anti-social behaviour and other non-emergency problems."
"506","Empowering communities against anti-social behavior. People want communities where the decent law-abiding majority are in charge."
"507","The experience of almost 4,000 Anti-Social Behaviour Orders, nearly 66,000 Penalty Notices for Disorder, and the closure of over 150 crack houses shows that communities can fight back against crime."
"508","We are ready to go further."
"509","Parish Council wardens, like those working for local authorities, will be given the power to issue Penalty Notices for Disorder for noise, graffiti and throwing fireworks."
"510","Victims of anti-social behaviour will be able to give evidence anonymously."
"511","Local people will be able to take on `neighbours from hell' by triggering action by councils and the police."
"512","We have reformed housing and planning legislation to ensure that councils plan for the needs of genuine Gypsies and travellers."
"513","But with rights must go responsibilities so we have provided tough new powers for councils and the police to tackle the problem of unauthorised sites."
"514","We are giving the police and local councils the power to tackle anti-social behaviour"
"515","we will develop neighbourhood policing for ever y community "
"516","Excessive alcohol consumption fuels anti-social behaviour and violence."
"517","The new Licensing Act will make it easier for the police and councils to deal with pubs and clubs that cause problems."
"518","Local councils and police will be able to designate Alcohol Disorder Zones to help pay for extra policing around city centre pubs and clubs, with new powers to immediately shut down premises selling alcohol to underage drinkers, and bans from town and city centres for persistent offenders."
"519","Police will be able to exclude yobs from town centres for 24 hours when they issue a Penalty Notice for Disorder."
"520","We will continue to overhaul our youth justice system and improve Young Offender Institutions."
"521","We will make more use of intensive community programmes, including electronic tagging and tracking to deal with the most persistent young offenders, and will increase the number of parents of young offenders getting help with their children's behaviour."
"522","We will increase, by at least a half, programmes targeted at young people most at risk of offending and will expand drug-treatment services for young people."
"524","Cutting crime through cutting drug dependency. Communities know that crime reduction depends on drug reduction."
"525","There are now 54 per cent more drug users in treatment and new powers for the police to close crack houses and get drug dealers off our streets."
"526","We will introduce compulsory drug testing at arrest for all proper ty and drugs offenders, beginning in high-crime areas, with compulsor y treatment assessment for those who test positive."
"527","Offenders under probation supervision will be randomly drug tested to mirror what already happens to offenders in custody."
"528","From 2006, the Serious Organised Crime Agency will bring together over 4,000 specialist staff to tackle terrorism, drug dealers, people traffickers and other national and international organized criminals."
"529","And in consultation with local police authorities and chief constables we will re-structure police resources in order to develop strong leadership, streamline all police support ser vices, and focus upon national and regional organised crime."
"530","We believe in being tough on crime and its causes so we will expand drugs testing and treatment, and tackle the conditions -from lack of youth provision to irresponsible drinking- that foster crime and anti-social behaviour."
"532","Reducing the use of guns and knives. Dangerous weapons fuel violence."
"533","We have banned all handguns, introduced five-year minimum sentences for those caught with an unlawful firearm and raised the age limit for owning an air gun."
"534","Now we will go further."
"535","We will introduce a Violent Crime Reduction Bill to restrict the sale of replica guns, raise the age limit for buying knives to 18 and tighten the law on air guns."
"536","Head teachers will have legal rights to search pupils for knives or guns."
"537","At-risk pubs and clubs will be required to search for them and we will introduce tougher sentences for carrying replica guns, for those involved in serious knife crimes and for those convicted of assaulting workers serving the public."
"539","Punishing criminals, reducing offending. As court sentences have got tougher, we have built over 16,000 more prison places than there were in 1997."
"540","The most high-risk violent  offenders will now be detained in custody indefinitely and our 2003 Criminal Justice Act confirmed that life sentences must mean life for the most heinous murders."
"541","Where significant new evidence comes to light we have abolished the `double jeopardy' rule so that serious criminals who have been unjustly acquitted can be tried again."
"542","And we will introduce much tougher penalties for those who cause death by careless driving or who kill while driving without a licence or while disqualified."
"543","We will tackle reoffending."
"544","By 2007 every offender will be supervised after release"
"545"," we will increase the use of electronic tagging"
"546"," and we will test the use of compulsory lie detector tests to monitor convicted sex offenders."
"547","Our new National Offender Management Service will ensure that every offender is individually case-managed from beginning to end of their sentence, both in and out of custody - with increased effort targeted on drugs treatment, education and basic skills training to reduce reoffending."
"548","Voluntary organisations and the private sector will be offered greater opportunities to deliver offender services and we will give local people a greater say in shaping community punishment."
"550","Making sure crime does not pay. Those who commit crimes should not profit from them."
"551","Already we have introduced laws that enable the courts to confiscate the assets and property of drug dealers and other major criminals."
"552","We will enable the police and prosecuting authorities to keep at least half of all the criminal assets they seize to fund local crime-fighting priorities."
"553","And we will develop new proposals to ensure that criminals are not able to profit from publishing books about their crimes."
"554","In addition we will support magistrates effectively in fighting crime and improve the enforcement of court decisions - including the payment of fines."
"555","Where a defendant fails to turn up for court without good excuse,the presumption should be that the trial and sentencing should go ahead anyway."
"556","We will overhaul laws on fraud and the way that fraud trials are conducted to update them for the 21st century and make them quicker and more effective."
"557","Overall crime as measured by the authoritative British Crime Survey is down 30 per cent - the equivalent of almost five million fewer crimes a year."
"559","Backing the victim. The legal system must dispense justice to the victim as well as the accused."
"560","We have invested to create a modern, self-confident prosecution service."
"561","With new powers and new technology to bring more offenders to justice more speedily and effectively."
"562","We will improve the way the courts work for victims, witnesses and jurors by: "
"563"," Building a nationwide network of witness and victim support units that provide practical help."
"564"," Expanding specialist courts to deal with domestic violence and specialist advocates to support the victims of such crime and of other serious crimes like murder and rape."
"565","We will extend the use of restorative justice schemes and Community Justice Centres to address the needs of victims, resolve disputes and help offenders to make recompense to victims for their crimes."
"566","Legal aid will be reformed to better help the vulnerable."
"567","We will ensure independent regulation of the legal profession, and greater competition in the legal services market to ensure people get value for money."
"568","We will tackle the compensation culture - resisting invalid claims, but upholding people's rights."
"569","Following consultation on the draft Bill we have published, we will legislate for a new offence of corporate manslaughter."
"571","Migration: The facts. Over seven million people entered the UK from outside the EU in 2003: of whom 180,000 came here to work and over 300,000 to study, with the rest coming here as business visitors and tourists."
"572","People from overseas spent almost £12 billion in the UK, and overseas students alone are worth £5 billion a year to our economy."
"573","At a time when we have over 600,000 vacancies in the UK job market, skilled migrants are contributing 10-15 per cent of our economy's overall growth."
"574","Since 1997, the time taken to process an initial asylum application has been reduced from 20 months to two months in over 80 per cent of cases."
"575","The number of asylum applications has been cut by two-thirds since 2002."
"576","The backlog of claims has been cut from over 50,000 at the end of 1996 to just over 10,000."
"577","There are 550 UK Immigration Officers posted in France and Belgium to check passports of people boarding boats and trains, and Airline Liaison Officers and overseas entry clearance staff are helping to stop 1,000 people a day improperly entering the UK."
"578","We prize the liberty of the individual"
"579"," but that means protecting the law-abiding majority from the minority who abuse the system."
"581","Building a strong and diverse country. For centuries Britain has been a home for people from the rest of Europe and further afield."
"582","Immigration has been good for Britain."
"583","We want to keep it that way."
"584","Our philosophy is simple: if you are ready to work hard and there is work for you to do, then you are welcome here."
"585","We need controls that work and a crackdown on abuse to ensure that we have a robust and fair immigration system fit for the 21st century that is in the interests of Britain."
"587","A points system for immigration. We need skilled workers."
"588","So we will establish a points system for those seeking to migrate here."
"589","More skills mean more points and more chance of being allowed to come here."
"590","We will ensure that only skilled workers are allowed to settle long-term in the UK, with English language tests for everyone who wants to stay permanently and an end to chain migration."
"591","Where there has been evidence of abuse from particular countries, the immigration service will be able to ask for financial bonds to guarantee that migrants return home."
"592","We will continue to improve the quality and speed of immigration and asylum decisions."
"593","Appeal rights for non-family immigration cases will be removed and we will introduce civil penalties on employers of up to £2,000 for each illegal immigrant they employ."
"595","Strong and secure borders. While the Tories would halve investment in our immigration services, we would invest in the latest technology to keep our borders strong and secure."
"596","By 2008, those needing a visa to enter the UK will be fingerprinted."
"597","We will issue ID cards to all visitors planning to stay for more than three months."
"598","Over the next five years we will implement a new electronic borders system that will track visitors entering or leaving the UK."
"599","Across the world there is a drive to increase the security of identity documents and we cannot be left behind."
"600","From next year we are introducing biometric `ePassports'."
"601","It makes sense to provide citizens with an equally secure identity card to protect them at home from identity theft and clamp down on illegal working and fraudulent use of public ser vices."
"602","We will introduce ID cards, including biometric data like fingerprints, backed up by a national register and rolling out initially on a voluntary basis as people renew their passports."
"604","Fair rules. We can and should honour our obligations to victims of persecution without allowing abuse of the asylum system."
"605","We will:  Fast-track all unfounded asylum seekers with electronic tagging where necessar y and more use of detention as we expand the number of detention places available."
"606"," Remove more failed applicants."
"607","We have more than doubled the number of failed asylum seekers we remove from the UK compared to 1996."
"608","By finger printing every visa applicant and prosecuting those who deliberately destroy their documents we will speed up the time taken to redocument and remove people and will take action against those countries that refuse to cooperate."
"609","By the end of 2005, our aim is for removals of failed asylum seekers to exceed new unfounded claims."
"611","Tough action to combat international terrorism. We know that there are people already in the country and who seek to enter the United Kingdom who want to attack our way of life."
"612","Our liberties are prized but so is our security."
"613","Police and other law enforcement agencies now have the powers they need to ban terrorist organisations, to clampdown on their fundraising and to hold suspects for extended questioning while charges are brought."
"614","Over 700 arrests have been made since 2001."
"615","Wherever possible, suspects should be prosecuted through the courts in the normal way."
"616","So we will introduce new laws to help catch and convict those involved in helping to plan terrorist activity or who glorify or condone acts of terror."
"617","But we also need to disrupt and prevent terrorist activity."
"618","New control orders will enable police and security agencies to keep track on those they suspect of planning terrorist outrages including bans on who they can contact or meet, electronic tagging and curfew orders, and for those who present the highest risk, a requirement to stay permanently at home."
"619","We will continue to improve coordination between enforcement agencies and cooperation with other countries so that every effort is made to defeat the terrorists."
"621","The choice for 2010. Labour's goals for 2010 are clear."
"622","Overall crime down, the number of offenders brought to justice up, with a neighbourhood policing team in every community to crack down on crime and disorder and a modern criminal justice system fit for the 21st centur y."
"623","And to reduce threats from overseas: secure borders backed up by ID cards and a crackdown on abuse of our immigration system."
"624","The Conservative threat is equally clear."
"625","Savage cuts to our border controls, `fantasy island' asylum policies and a return to the days of broken promises on police numbers and crime investment."
"626","We will introduce ID cards, including biometric data like fingerprints, backed up by a national register and rolling out initially on a voluntary basis as people renew their passports."
"629","Chapter 4 Our NHS: Free to all, personal to each. Forward to personalised healthcare for all of us, not back to two-tier healthcare. 1997: 12-hour waits in Accident and Emergency, and waiting more than 18 months for operations."
"630","2005: Less than four hours in A&E for 97 per cent of patients."
"631","Virtually no one waiting more than nine months for an operation."
"632","2008: No one waiting more than 18 weeks from referral to treatment."
"633","No hidden waits."
"634","Free choice of hospital."
"635","The NHS is being restored to good health: more doctors, more nurses, better facilities."
"636","Waiting times are coming down and the survival rates for the biggest killers are improving."
"637","The revolution in quantity of care must be matched by a revolution in quality of care."
"638","With equal access for all and no charges for operations."
"639","That means new types of health provision, more say for patients in how, where and when they are treated, and tackling ill-health at source."
"641","The new Labour case. Healthcare is too precious to be left to chance, too central to life chances to be left to your wealth."
"642","Access to treatment should be based on your clinical need not on your ability to pay."
"643","This means defeating those who would dismantle the NHS."
"644","But it also means fundamentally reforming the NHS to meet new challenges - a more demanding citizenr y with higher expectations, major advances in science and medical technology, changes in the composition and needs of the population."
"645","We promised to revive the NHS"
"646"," we have."
"647","In our third term we will make the NHS safe for a generation."
"648","So our aim is an NHS free to all of us and personal to each of us."
"649","We will deliver through high national standards backed by sustained investment, by using new providers where they add capacity or promote innovation, and most importantly by giving more power to patients over their own treatment and over their own health."
"651","New investment. NHS spending has doubled since 1997, and will triple by 2008"
"652"," already we have an extra 27,000 doctors in post or in training and 79,000 extra nurses"
"653"," over 100 new hospital building projects under way"
"654"," 500,000 more operations a year."
"655","We are proud of the dedication and commitment of NHS staff."
"656","We have widened the responsibilities of nurses and pharmacists, paramedics and porters, creating health services more convenient for patients."
"657","Together with our organisational reforms, the investment is paying off."
"658","The maximum time that people waited for operations in 1997 was well over 18 months."
"659","Now virtually no one waits longer than nine months, and this year it will fall further to six months."
"660","For a heart operation or for cataract removal no one is waiting longer than three months"
"661"," 97 per cent of people wait less than four hours in Accident and Emergency before treatment, admission or discharge."
"662","And speedier treatment saves lives."
"663","Death rates from heart disease are down by 27 per cent since 1996"
"664"," from cancer by 12 per cent."
"665","We will do even better."
"666","For too long waiting times have only counted the time after diagnosis."
"667","We will be the first Government to include all waiting times in this calculation, including waiting for outpatient appointments and for test results."
"668","There will be no hidden waits."
"669","So: "
