"","sentence_text_new"
"4","The Labour Party manifesto 2005. Britain forward not back. Preface Tony Blair. New Labour's 2005 manifesto applies the unchanging values of our party to the new priorities of the British people."
"5","It is a plan to improve the lives of hardworking families and prepare our country for success in a fast-changing world."
"6","Our case rests on one idea more than any other - that it is the duty of government to provide opportunity and security for all in a changing world."
"7","Every chapter relates back to that goal: breaking down the barriers that stop people fulfilling their talent, extending opportunity to every corner of the United Kingdom, building communities strong and safe for those who play by the rules."
"8","On the firm foundations we have laid since 1997, our programme will embed a new progressive consensus in our country."
"9","This preface is my personal message."
"10","Eight years ago, I offered new leadership - fresh, idealistic, energetic, but untested."
"11","You voted for change and gave me the chance to serve."
"12","In our first term we banished the demons of ten per cent interest rates, mass unemployment, wages of £1.50 an hour, and outside toilets in our schools."
"13","We put Labour values into action."
"14","And we banished Labour demons too: we showed we could run the economy well, cut crime, and stand up for Britain abroad."
"15","We proved our competence."
"16","Four years ago, I said we needed to continue the modernisation of our economy, coupled with investment and reform to achieve change in public services."
"17","At the end of this second term we have delivered an unprecedented period of stability and growth, we have increased investment and we have embarked on a radical programme of reform to put the people themselves in the driving seat of our public services."
"18","We have made difficult decisions - about health policy, student finance, and secondary school reform."
"19","In the process we have proved our resilience."
"20","Now we go to the people not only having delivered on our promises, but also setting new and more ambitious goals for our public services and our country."
"22","But Britain can be better still. I know the change is possible."
"23","Not just because I have studied the sta-tistics, but because I have seen it with my own eyes, across the length  and breadth of the United Kingdom."
"24","I have spoken to NHS staff in Coventry, Edinburgh and Swansea, who tell me how  their new hospital and the new funding is letting them improve  care for their patients."
"25","I have heard teachers in Bexley, Middlesbrough and Sheffield tell me  how they no longer have to work in crumbling classrooms without books and computers - and pupils show me, with pride, round their sparkling new school."
"26","I have met youngsters in Blackpool and London whose lives have been transformed by the New Deal - once written off, they are now full of confidence and ambition."
"27","I've been to communities in Southampton and Darlington where the Sure Start programme is helping overcome disadvantage and seen for myself the remarkable revival of our great cities."
"28","I have met aid workers in Africa who tell me how this country is improving the lives of the poorest on our planet."
"29","These are not the fantasy of politicians."
"30","They are the stories of real life in our country and abroad."
"31","Not for everyone."
"32","Not everywhere."
"33","But for enough people and in enough places for us to know it is not a fluke."
"34","Personal prosperity and the good society"
"35"," the fruit of partnership between the British people and a government on their side."
"37"," Now we have to decide whether to go forward or back. I know the change is possible."
"38","Not just because I have studied the statistics, but because I have seen it with my own eyes, across the length and breadth of the United Kingdom."
"39","I have spoken to NHS staff in Coventry, Edinburgh and Swansea, who tell me how their new hospital and the new funding is letting them improve care for their patients."
"40","I have heard teachers in Bexley, Middlesbrough and Sheffield tell me how they no longer have to work in crumbling classrooms without 6 Britain is on the right track. "
"41","We will not change direction."
"42","Neither will we rest on our laurels."
"43","Our third-term opportunity is to build on the progress we have made."
"44","That progress, first as a party then in government began with the insight that the only way to advance decent progressive values was to develop a new policy agenda."
"45","Our understanding of the world and the great changes underway in our society led us to reject the false choices of the past."
"46","This is the foundation stone of new Labour."
"47","I believe that in our third term we can embed a new progressive consensus."
"48","One that reflects the mission of our movement, and the hopes and values of our people."
"49","And as much as the pursuit of this consensus represents an unprecedented opportunity for progressive politics, so it will be bitterly opposed by those who seek to take us back to the divisions of the past."
"50","In our third term we will forge an even stronger bond between the goals of economic progress and social justice."
"51","No going back to fiscal irresponsibility."
"52","No going back to a Conservative government that says mass unemployment is a price worth paying."
"53","Going forward instead to an opportunity economy, spreading prosperity through high employment and welfare reform, spreading opportunity through widening access to university and training, spreading ownership through the Child Trust Fund and expanding homeownership."
"54","In our third term we will make public services safe for a generation."
"55","No going back to one-size-fits-all monolithic services."
"56","No going back to the Tory years of cuts and privatisation."
"57","Going forward instead to services free to all, personal to each: breaking once and for all the dropout culture in education and the waiting-list culture in health, by raising investment and driving innovation through diversity of provision and power in the hands of the patient, the parent and the citizen."
"58","In our third term we will cement a new social contract with rights matched by responsibilities."
"59","No going back to `no such thing as society'."
"60","Going forward instead to power and resources in the hands of the law-abiding majority."
"61","A government committed both to abolishing child poverty and to putting the values of individual responsibility and duty at the very heart of policy."
"62","In our third term we will show that our national interest can only be pursued by engaging with the world's great challenges."
"63","No going back to a Britain marginalised and weak."
"64","Going forward to a stronger country in a safer, fairer world."
"65","Leading on Africa, leading on the environment, at the heart of Europe, working together to tackle terror and spread peace and justice."
"66","We do not duck the tough choices - from independence for the Bank of England to the tax rise we made for the NHS, to the war in Iraq."
"67","We made decisions because we believed them right - not because they were destined to be popular."
"68","But we refuse to accept false choices."
"69","The British people never wanted to choose between wealth creation and social justice."
"70","They never wanted to choose between national security and overseas aid."
"71","They never wanted to choose between equal rights and protection from crime."
"72","These are the false choices that landed us with economic decline and social division."
"73","The British people have the capacity to make this a great country."
"74","Our ideals are undimmed: extend opportunity to all, demand responsibility from all, secure justice for all."
"75","Our policies are refreshed: never has a governing party proposed a more wide-ranging programme of change for the country."
"76","Our vision is clear: a country more equal in its opportunities, more secure in its communities, more confident in its future."
"77","It is our social contract: we help you, you help yourself"
"78"," you benefit and the country benefits."
"79","So now, I fight my last election as Leader of my party and Prime Minister of our country."
"80","My call is a passionate one: let's together make irreversible the positive changes that are happening in our country."
"81","Let's make the values of social justice and a fair deal for all the governing ideal of our country not just for some time but for all time."
"82","People freed from barriers of class, building a better future for themselves and for the country."
"83","Self-interest and national interest together."
"86","Prosperity for all. New Labour's record: The contract delivered. Our country is changing for the better, because we fulfilled the promises of our 1997 and 2001 manifestos."
"87","Here is what has changed."
"88","Britain now has a stable, growing economy with the lowest inflation since the 1960s."
"89","Since 1997, two million more people are in work, and the UK has the lowest unemployment for 30 years."
"90","Tax credits and the minimum wage are ensuring that work pays for everyone."
"91","Because of this we are saving £5 billion a year on the costs of unemployment - that's £84 for every citizen in Britain - money that is being invested in frontline services such as schools and hospitals."
"92","There are over one million more homeowners, saving on average nearly £4,000 a year, thanks to the lowest mortgage rates for 40 years."
"93","Since 1997, average incomes have increased by 19 per cent and the income of a typical family has increased by 17 per cent, with living standards rising in double digits for every part of the income spectrum."
"94","There are 300,000 more businesses, providing jobs and increased prosperity."
"95","There are two million fewer children and nearly two million fewer pensioners living in absolute poverty."
"97"," World-class public services. Investment in public services is up - an extra £1,000 per pupil per year in real terms since 1997, and spending on the NHS has more than doubled to £69 billion."
"98","There are over 28,000 more teachers and 105,000 extra teaching assistants and support staff."
"99","The National Health Service now has 79,000 more nurses and over 27,000 more doctors."
"100","And public servants - from nurses to police officers - are better rewarded for their work."
"101","Our ten-year-old pupils are ranked third best in the world in literacy and are the fastest improving in numeracy."
"102","Since the introduction of free entry, visits to our national museums and galleries have risen by 75 per cent."
"103","Deaths from heart disease are down by 27 per cent and cancer deaths are down by 12 per cent."
"105","Strong and safe communities. Crime has fallen by 30 per cent overall, with almost five million fewer crimes a year than in 1997."
"106","There are record numbers of police, nearly 13,000 more, assisted by 4,600 new Community Support Officers."
"107","New powers to tackle anti-social behaviour have been introduced, with nearly 4,000 Anti-Social Behaviour Orders issued so far and nearly 66,000 fixed penalty notices."
"108","We have halved the time from arrest to sentencing for persistent young offenders."
"109","More than 80 per cent of initial decisions on asylum claims are now processed in two months."
"111","A modern welfare state. Thanks to our New Deal, long-term youth unemployment has been virtually eradicated, with over half a million young people helped into work."
"112","By October 2005, families with children will be on average £1,400 a year better off as a result of our tax and benefit measures compared to 1997."
"113","Thanks to our reforms pensioner households are on average £1,500 a year better off, rising to £2,000 for the poorest third."
"114","Maternity leave has increased to 26 weeks and maternity pay has almost doubled."
"115","There are 1.2 million more older people in employment."
"116","The employment rate for people aged between 50 and pension age has increased by over five percentage points to 70 per cent."
"118","Britain strong in the world. Britain's interests are at the heart of an enlarged European Union, with economic reform putting jobs first."
"119","Our international aid budget for the world's poorest countries has more than doubled."
"120","We have successfully pressed for the restarting of world trade talks which will focus on the needs of developing countries."
"121","Our strong, effective and responsive armed forces are ensuring the defence of Britain's interests."
"122","We introduced greenhouse-gas trading to cut pollution - the first country to do so - reducing emissions by 9.8 million tonnes in the first two years."
"123","Labour's economic record is unprecedented - the highest employment ever, longest period of uninterrupted growth in modern history, lowest sustained interest and inflation rates for a generation."
"124","Our economic policies will build on the platform of stability and growth in three ways: entrenching a lowdebt/high-employment economy which generates investment in public services"
"125"," supporting enterprise and wealth creation by making Britain the best place to do business"
"126"," and helping ever y part of Britain and every person in Britain to contribute to and gain from the strength of our economy."
"127","And as we work globally to tackle climate change we recognise the challenge and the opportunity of achieving sustainable development at home."
"130","Chapter 1 Economy: Rising prosperity in an opportunity society. Forward to increased prosperity, not back to boom and bust. 1979-1997: Interest rates average over ten per cent."
"131","1997-2005: Britain, the fourth largest economy in the world, with the longest ever period of continuous growth."
"132","2010: Full employment in every region and nation."
"134","The new Labour case. Our economic record has finally laid to rest the view that Labour could not be trusted with the economy."
"135","We are winning the argument that economic dynamism and social justice must go hand in hand."
"136","In the future the countries that do best will be those with a shared purpose about the long-term changes and investments they need to make - and have the determination to equip their people for that future."
"137","So, we approach new challenges with a progressive strategy for growth."
"138","In our third term we will build new ladders of social mobility and advancement on the firm foundations of stability, investment and growth."
"140","Low debt and high employment. In the last eight years we have pioneered a British way to economic stability."
"141","Our economy has grown in every quarter with this Government."
"142","Interest rates have averaged 5.3 per cent since 1997, saving mortgage payers on average nearly £4,000 per year compared to the Tory years."
"143","Only with Labour, which constructed this framework, will this continue."
"144","We will maintain our inflation target at two per cent."
"145","We will continue to meet our fiscal rules: over the economic cycle, we will borrow only to invest, and keep net debt at a stable and prudent level."
"147","Public spending and taxation. The longest period of uninterrupted economic growth in modern times has enabled the Government to deliver the longest period of sustained investment in public services for a generation."
"148","Social security bills for unemployment have been halved since 1997, saving £5 billion a year, and we are also saving £4 billion a year on debt interest payments."
"149","Over the ten-year period 1997-98 to 2007-08, real-terms investment per year in education will have risen by 4.8 per cent and in health by 6.5 per cent."
"150","We are winning the argument that economic dynamism and social justice must go hand in hand."
"151","Every pound we invest goes further because of our drive for efficiency and reform."
"152","Labour will complete the implementation of Sir Peter Gershon's recommendations to improve public-service efficiency and root out waste, liberating over £21 billion for investment in frontline services."
"153","Labour believes tax policy should continue to be governed by the health of the public finances, the requirement for public investment and the needs of families, business and the environment."
"154","We will not raise the basic or top rates of income tax in the next Parliament."
"155","We renew our pledge not to extend VAT to food, children's clothes, books, newspapers and public transport fares."
"156","We will continue to make targeted tax cuts for families and to support work."
"157","As a result of personal tax and benefit measures introduced since 1997, by October 2005 families with children will be on average £1,400 a year better off in real terms."
"158","Living standards in Britain have been rising, on average, by 2.5 per cent per year since 1997 - a total increase of nearly 20 per cent."
"159","We want a tax regime that supports British business."
"160","That is why we have cut corporation tax to its lowest ever level, introduced the best regime of capital gains tax in any industrialised country, and introduced a new Research and Development tax credit."
"162","Full employment. Our goal is employment opportunity for all, the modern definition of full employment."
"163","Britain has more people in work than ever before, with the highest employment rate in the G7."
"164","Our long-term aim is to raise the employment rate to 80 per cent."
"165","And, as we move more people from welfare to work, the savings on unemployment benefits will go towards investing more in education."
"166","We will make work pay."
"167","With Labour's tax credits a family with two children pays no net tax until their earnings reach £21,000."
"168","We will implement the recommendations of the Low Pay Commission to raise the minimum wage to £5.05 from October 2005 and £5.35 from October 2006."
"169","The New Deals and the creation of JobCentre Plus have made a major contribution to cutting unemployment."
"170","The active welfare state created since 1997 is working."
"171","The Tories trebled the number on incapacity benefits."
"172","We will help people who can work into rehabilitation and eventually into employment, recognising the practical assistance to disabled people of the Access to Work scheme."
"173","We will build on the successful Pathways to Work programme and reform Incapacity Benefit, with the main elements of the new benefit regime in place from 2008."
"174","The majority of claimants with more manageable conditions will be required to engage in both work-focused interviews and in activity to help them prepare for a return to work."
"175","Those with the most severe conditions will also be encouraged to engage in activity and should receive more money than now."
"176","We will continue to welcome new independent and voluntary sector partners to provide job-seeking services."
"178","Supporting enterprise. Government does not create wealth but it must support the wealth creators."
"179","That is why our priorities are the national infrastructure of skills, science, regulation and planning, and transport."
"180","The economy of the future will be based on knowledge, innovation and creativity."
"181","That applies both to manufacturing and services."
"182","In a fast changing global economy, government cannot postpone or prevent change."
"183","The modern role for government - the case for a modern employment and skills policy - is to equip people to succeed, to be on their side, helping them become more skilled, adaptable and flexible for the job ahead rather than the old Tory way of walking away leaving people unaided to face change."
"184","Successful manufacturing industries are vital to our future prosperity."
"185","The Labour Government backs manufacturing: from launch investment for Airbus A380 Super Jumbo to the successful Manufacturing Advisory Service helping 13,000 of our smaller manufacturing businesses in its first year."
"186","In a third term we will continue to do so."
"187","Public procurement is a big opportunity for business in Britain and the source of many jobs."
"188","We will promote a public procurement strategy that safeguards UK jobs and skills, under EU rules, to ensure that British industry can compete fairly with the rest of Europe."
"189","Britain has some of the strongest capital markets in the world."
"190","We are determined they - and our financial services industry - should prosper."
"191","We will ensure that companies have the right framework of corporate governance and relationships with the institutions that invest our pension funds and savings in them."
"192","In our third term we will build new ladders of social mobility and advancement on the firm foundations of stability, investment and growth."
"194","Skills at work. Our reforms to 14-19 education (see chapter 2) will raise the quality and quantity of apprenticeships and vocational education."
"195","We are now putting in place a comprehensive and ambitious strategy to help everyone get on at work: "
"196"," All adults to get free access to basic skills in literacy, language and numeracy."
"197"," A new national programme, working with employers, to ensure that employees who did not reach GCSE standard (level 2) at school will get time off for free training up to level 2."
"198"," A new partnership between government and employers to fund workplace training at level 3 (technician level) "
"199"," A genuinely employer-driven training system - in every sector there will be a Sector Skills Council determining the training strategy and a leading edge Skills Academy."
"200"," A nationwide system of advice - bringing together support on skills, jobs and careers - helping people to get on at work."
"201"," A strong partnership with trade unions to boost workplace training including a new TUC Academy and continued support for Union Learning Reps."
"203","Supporting science. The alliance of scientific research and business creativity is key to our continued prosperity."
"204","Looking ahead, we are committed to a ten-year strategy on science and innovation that will continue to invest in our science and industrial base at least in line with trend GDP."
"205","Our ambition now is to raise the UK's total private and public sector investment in research and development, as a proportion of national income, from its current 1.9 per cent to 2.5 per cent by 2014."
"206","Our pharmaceutical and biotechnology industries are world leaders."
"207","We have created one of the world's best environments for stem-cell research."
"208","We have now passed legislation to protect our researchers from the activities of animal rights extremists."
"209","Across a range of environmental issues - from soil erosion to the depletion of marine resources, from water scarcity to air pollution - it is clear now not just that economic activity is their cause but that these problems in themselves threaten future economic activity and growth."
"210","We will continue to work with the environmental goods and services sector - which is already worth £25 billion to the economy to promote new green technologies and industries in the UK and internationally, and use the purchasing power of government to support environmental improvement."
"212","Competition, planning and regulation. Competition is a driving force for innovation."
"213","Our competition regime has been toughened with independent competition bodies and stronger penalties."
"214","To the benefit of business and household consumers we are liberalising the postal services market, while protecting the universal service at a uniform tariff."
"215","As we said in our policy document Britain is Working, we have given the Royal Mail greater commercial freedom and have no plans to privatise it."
"216","Our ambition is to see a publicly owned Royal Mail fully restored to good health, providing customers with an excellent service and its employees with rewarding employment."
"217","We will review the impact on the Royal Mail of market liberalisation, which is being progressively introduced under the Postal Services Act 2000 and which allows alternative carriers to the Royal Mail to offer postal services."
"218","We have reformed our energy markets to make them open and competitive."
"219","And we are a leading force in the campaign to make Europe's energy markets the same."
"220","Our wider energy policy has created a framework that places the challenge of climate change - as well as the need to achieve security of supply - at the heart of our energy policy."
"221","We have a major programme to promote renewable energy, as part of a strategy of having a mix of energy sources from nuclear power stations to clean coal to micro-generators."
"222","We will only regulate where necessary and will set exacting targets for reducing the costs of administering regulations."
"223","We will rationalise business inspections."
"224","The merger of the Inland Revenue and Customs and Excise will cut the administrative costs of tax compliance for small businesses."
"225","We will take further action in Europe to ensure that EU regulations are proportionate and better designed."
"226","We strongly support the creation of an EU single market in services to match the single market in goods - and want an effective directive to provide real benefits to consumers and new opportunities to British business."
"227","We will protect our employment standards."
"228","In developing the directive we will want to avoid any undermining of our regulatory framework."
"229","We will continue to work to protect the rights of consumers, bringing forward proposals to strengthen and streamline consumer advocacy."
