"","sentence_text_new"
"758","We will require local authorities and housing associations to ensure equal opportunities in housing allocation."
"759","We will expand access to mother-tongue teaching, for both adults and children, where this takes place through self-help and community groups."
"760","Free immigration laws from racial discrimination."
"761","We will ensure that immigration policy is non-discriminatory in its application."
"762","We will reform current immigration laws so as to enable genuine family reunions."
"763","We will restore benefit rights to asylum seekers and ensure that asylum claims are dealt with swiftly."
"764","Increase ethnic minorities' confidence in the police."
"765","We will encourage the recruitment of ethnic minorities into the police force and require action to be taken against discrimination within the force."
"766","We will tackle any discriminatory use of police powers, such as stop and search, and enhance police action to deal with racial attacks."
"767","We will encourage the use of aggravated sentencing for racially motivated crimes."
"769","Lesbians and gay men. In a free and tolerant society, discrimination on any grounds is unacceptable."
"770","Diversity is a source of strength."
"771","We will: Ensure equality before the law for lesbians and gay men through our new Human Rights Commission and the Bill of Rights."
"772","We will create a common age of consent regardless of gender or sexual orientation."
"773","Stop discrimination."
"774","We will outlaw incitement to hatred and discrimination in housing and employment, including the armed forces, on grounds of sexual orientation."
"775","We will repeal 'section 28' of the 1988 Local Government Act."
"776","We will reform the law, ensure that the police and local authorities deal more effectively with homophobic attacks, and encourage police forces to be more representative of the communities they serve."
"778","Which party has the vision to build the kind of world I want to live in? Our aim: To recast Britain's foreign policy and enable this country to play a leading role in shaping Europe and strengthening international institutions."
"779","The problem: For too long British foreign policy has looked backwards to its imperial past."
"780","Britain's interests have been damaged by an attitude to Europe that has been, at best, ambivalent and, at worst, hostile."
"781","This attitude has also cost Britain opportunities for influence and advantage."
"782","Our commitment: Liberal Democrats will ensure that Britain plays a leading role in shaping Europe, democratising its institutions and strengthening its role as a framework for prosperity, peace and security."
"783","Britain, with its world experience, expert armed forces and permanent membership of the UN Security Council, has a unique role to play in reforming international institutions for the next century."
"784","Our priorities are to: Make the European Union (EU) work more effectively and democratise its institutions."
"785","Widen Europe to include the new democracies of central and eastern Europe."
"786","Create a strong framework for Britain's defence and security through NATO and European co-operation."
"787","Give Britain a leading role in reforming and strengthening the UN and other international institutions."
"788","Promote an enforceable framework for international law, human rights and the protection of the environment."
"790","Positive leadership in Europe. Britain's interests can only best be pursued through constructive participation in an enlarged European Union."
"791","Our vision is of a European Union that is decentralised, democratic and diverse."
"792","A strong and united Europe, but one that respects cultural traditions and national and regional identities."
"793","In seeking to reform the EU, our priorities are to: Give the British people a say."
"794","Reform that fundamentally changes Britain's place in Europe should only proceed if it has the explicit support of Britain's people."
"795","If there is any substantial change in Britain's relationship with the EU, the British people must give their consent through a referendum."
"796","Make EU institutions more democratic and accountable."
"797","We will give the House of Commons a more effective role in scrutinising European policy."
"798","We also want the Council of Ministers and the EC Commission to be more accountable to the elected European Parliament."
"799","We will introduce a fair and proportional voting system for British MEPs in time for the 1999 European Parliament elections."
"800","Make EU decision-making more efficient and effective."
"801","Europe cannot effectively enlarge without improving its decision-making."
"802","We therefore favour the wider application of majority voting."
"803","But we will keep the veto on all issues relating to the constitution, budgetary matters and regulations on pay and social security."
"804","We support the use of the double majority', especially on matters such as foreign and security policy. "
"805","Each member state must retain the unfettered right to make its own decisions on the commitment of its national troops."
"807","Pursuing Britain's interests in Europe. Britain has much to gain from EU membership."
"808","This will take new leadership, a new approach and a renewed sense of national confidence."
"809","Our aims in Europe are to: Enhance economic prosperity, by promoting the freedom of movement of people, goods, services and money throughout the EU and by completing the European Single Market, particularly in areas of financial services, pensions and air travel."
"810","Participate in a successful single currency."
"811","Being part of a successful single currency will bring low inflation and low interest rates."
"812","Staying out will result in less investment and a loss of influence."
"813","However, three conditions must be met before Britain can join."
"814","First, the single currency must be firmly founded on the Maastricht criteria."
"815","Second, Britain must meet those criteria."
"816","Third, the British people must have agreed to it in a referendum."
"817","Strengthen the European framework for peace and security."
"818","Britain's security and national interests are best pursued in partnership with its European neighbours."
"819","We will work to strengthen European Common Foreign and Security policy to enable greater scope for united European action."
"820","Individual member states must be free to decide whether or not their national forces will take part in any particular action."
"821","Fight crime and protect citizens' rights through more effective co-operation between EU states' police and customs forces with greater democratic accountability."
"822","We will work to improve European co-operation against cross-border criminal activity and allow free movement for Britain's people throughout Europe."
"823","The administration of border controls should remain with individual member nations until they can be confident that the EU's external borders are secure."
"824","Reform the Common Agricultural Policy, converting it into a system of direct payments to support economic, social and environmental goals in rural communities."
"825","Reform fisheries policies, scrapping the Common Fisheries Policy and replacing it with a new Europe-wide fisheries policy based on the regional management of fish stocks."
"826","We will take urgent action to end quota-hopping and begin the phased abolition of industrial fishing."
"828","Strong defence in an uncertain world. The first decades of the next century are likely to be turbulent and unstable everywhere, including within and around Europe."
"829","Britain must maintain an effective security capability."
"830","This will best be achieved through NATO and European co-operation, and this country must continue to play a full part in both."
"831","We will: Maintain a strong defence at home and enable the UK to play a leading role in keeping international peace."
"832","We will maintain Britain's overall defence capability at its current level, whilst ensuring UK forces meet current needs and are appropriate to potential threats."
"833","Retain Britain's basic nuclear capability through the Trident submarine force until such time as international multilateral nuclear disarmament can be achieved."
"834","We will restrict the number of nuclear warheads on Trident to the same number as previously deployed on Polaris."
"835","Resist the proliferation of weapons of mass destruction."
"836","We will press for the conclusion of a verifiable Comprehensive Test Ban Treaty."
"837","We will ensure that Britain plays an active part in talks to reduce the holdings of strategic nuclear weapons."
"838","Support the principle of common security."
"839","We support the extension of the security guarantees, from which western Europe has benefited, to the new democracies of central and eastern Europe."
"840","We support NATO and its enlargement."
"842","Working for peace, security and sustainability. In an increasingly inter-dependent world, the security of a medium sized nation like Britain is best preserved within a framework of international law that is effective and enforceable."
"844","Reforming the United Nations. Playing a leading role in strengthening and reforming the United Nations should be a central aspect of Britain's foreign policy over the next decade."
"845","We will work to: Strengthen the UN's peacekeeping capability so that it can take earlier and more effective action to prevent or suppress conflict."
"846","This should include establishing fast track machinery for negotiations"
"847","permanent, on-call, peacekeeping forces made up from high-calibre troops provided by member states"
"848","the reinstatement of a Military Staff Committee"
"849","the establishment of a UN Staff College to train officers"
"850","and improvements to the UN's command control, communication and intelligence capabilities."
"851","Support the establishment of an International Criminal Court to deal with genocide and war crimes."
"853","Protecting the global environment. Pollution and environmental degradation do not respect national borders."
"854","Countries must work together if the world's environment is to be protected."
"855","We will: Take a lead in international environmental negotiations."
"856","We will press for tough and legally binding international targets for greenhouse gas emissions and other pollutants."
"857","Develop a global system of environmental protection."
"858","We will work for the creation of a global environmental organisation."
"859","We will promote an environmental equivalent of the Geneva Convention, to outlaw gross acts of environmental destruction in times of war.  "
"861","Tackling world poverty. The elimination of global famine, pestilence and poverty is not only a moral challenge, it is also essential for the world's long-term stability and peace."
"862","We will: Increase Britain's contribution to overseas aid."
"863","We will set out a timetable for sustained progress towards achieving the UN target for overseas development aid of 0.7 per cent of GNP within the next 10 years."
"864","Promote a timetable for debt relief to the poorest states including a programme for cancelling debt and the creation of new and additional resources for debt relief."
"865","Target Britain's bilateral aid where it is most needed."
"866","We will focus Britain's bilateral aid on the least developed countries and end the practice of tying aid."
"867","Require states that receive UK development assistance to respect the fundamental human rights of their people and suspend UK programmes where these standards are breached."
"869","Controlling arms sales. The global arms trade fuels conflicts, hinders prosperity and robs the world's poor of resources."
"870","Its growth must be diminished."
"871","We will: End the sale of British arms, war material, and 'dual use' technologies to regimes which abuse human rights, and strictly control arms sales to regions of tension or potential conflict."
"872","Seek a new international regime to control the arms trade."
"873","We will support tighter EU-wide restrictions on transfers of military technology to non-democratic regimes and press for the establishment of a mandatory UN register, in which all arms sales and transfers must be listed."
"874","Ban landmines."
"875","We will place an immediate and total ban on the production, stockpiling and export of anti-personnel landmines and work towards a global ban on Iandmine production."
"877","Free and fair trade. Free and fair trade benefits all."
"878","The GATT Uruguay Round has successfully lowered barriers to international trade, but further reforms are needed."
"879","We will seek action to: Enhance free trade by further reducing tariff and non-tariff barriers, especially against the poorest countries."
"880","Improve global labour standards by permitting countries to discriminate against goods produced by nations that maintain practices such as child, slave and forced labour. "
"881","We will support the work of the International Labour Organisation in raising labour standards throughout the world."
"882","Advance environmental objectives."
"883","We support the addition of an environmental sustainability clause to the GATT setting out agreed principles of environmental policy against which trade measures can be judged."
"884","Reduce trans-national corporations' ability to abuse market power, through the development of a framework for global competition policy."
"886","The Liberal Democrats and your tax. A copy of our Annual Tax Contract will be delivered to each UK household following the Budget each year."
"887","Some of the information which would be included is provided on the next page."
"888","This Annual Tax Contract will be in keeping with our four Tax Pledges:  1) No taxation without explanation."
"889","Central Government should inform taxpayers of the ways in which their money is raised and spent, just as local councils now do."
"890","2) No promises unless the bill is attached."
"891","People have the right to know the Government's priorities and how much they will cost."
"892","When we make significant changes in our tax and spending priorities we will tell people where the money has come from."
"893","We will ask the National Audit Office to make sure that additional expenditure earmarked for specific projects is spent accordingly."
"894","3) No more tax without tackling waste."
"895","Each year we will set out the measures which we plan to implement in order to reduce wasteful expenditure and deliver best value for money to taxpayers."
"896","We will never raise taxes without first scrutinising Government expenditure for waste."
"897","4) Fair tax for all."
"898","Tax bands, rates and reliefs should ensure that everyone contributes according to their ability to pay and that the tax burden is fairly shared."
"899","We will aim to take more of those on low incomes out of tax completely."
"900","We will clamp down on tax avoidance and evasion."
"901","We will provide a mechanism for people to give their views on tax and spending priorities."
"903","Costing our commitment. We have issued alongside this manifesto a Costings Supplement to show in detail how our proposals will be financed."
"904","We will raise the basic rate of income tax by one penny in the pound - from 23p to 24p - to help finance our £2bn per year programme of Education investment."
"905","We will increase the amount of income which people can receive before they start to pay income tax by £200 per year to £4,245."
"906","This tax cut will be paid for by introducing a new rate of income tax of 50%, payable on taxable income of over £100,000 per year."
"907","Half a million people will be freed from income tax altogether."
"908","We will put 5p on a packet of cigarettes and use the money to restore free eye and dental checks for all and freeze prescription charges."
"910","How the proposals in this manifesto would alter your tax and the Government's spending. Liberal Democrats would increase Government spending on: "
"911","Education +£2,050m. "
"912","Health +£565m. "
"913","Pensions +£265m."
"914","Liberal Democrats would decrease Government spending on: "
"915","Private consultants -£120m. "
"916","Publicity -£50m. "
"917","Empty properties -£25m. "
"919","Main income tax changes. Around 70% of Adults will pay lower or unchanged income tax under our proposals."
"920","Around half of all income taxpayers would be better off or no worse off under our income tax proposals."
"921","Excluding those earning over £100,000 per year, the average income taxpayer will pay only around 45p extra per week in income tax under our plans."
"922","In this manifesto, we have set out a practical, forward-looking programme to modernise Britain."
"923","Its central theme is the widening of opportunities."
"924","And its aim is to make Britain a nation of self-reliant individuals, living in strong communities, backed by an enabling government."
"925","We do not duck the choices that have to be faced in this election."
"926","And we do not pretend that they are easy - or free."
"927","High-quality education has to be paid for."
"928","As do decent public services and a more secure society."
"929","You cannot, in the present climate, have these and tax cuts as well."
"930","You have to choose."
"931","We ask you to do so."
"932","Your vote can make a real difference in turning our country away from short-term politics towards a more constructive long-term approach."
"933","And with your support we believe we can make a difference too."
"934","Every vote we receive is a vote for better education, the modern isation of our politics, a cleaner environment, a better health service and more crime free communities."
"935","Every vote we get and every seat we win will ensure that in the next Parliament, Britain, can at last face, up to the challenge, as we enter the next millennium. "
