"","sentence_text_new"
"1230","by raising the Minimum Income Guarantee to £100 each week (£154 for couples) in 2003 "
"1231","by tackling discrimination against over-50s in health care and in the workplace "
"1232","by boosting police numbers and cutting overall crime, and crimes like burglary that affect senior citizens the most "
"1233","Photo caption: Security in retirement state pensions to rise."
"1235","Carers. Not only are the large majority of people who require care older, but also the majority of carers are older people."
"1236","Labour will tackle the problems faced by people requiring care and the problems of carers themselves."
"1237","The national carers strategy is the first step, with information, support and care for carers: Labour will spend £500 million over the next three years providing financial support for 300,000 carers through the benefits system, and £255 million for social care services for carers."
"1238","More is being done for carers through income support"
"1239","carers will be better able to combine work and care"
"1240","and 75,000 more carers each year are now able to take a break from their caring responsibilities."
"1241","We are proud that, with Labour, care by qualified nurses will be made free to all, wherever it is received."
"1242","One hundred and fifty thousand more older people will receive rehabilitation and convalescence through growing investment in the NHS and social services that the Tories refuse to match."
"1243","We want to see carers given access to the cash and services appropriate to their service to their relatives and the community."
"1244","The Carers and Disabled Children's Act gives carers a right to an independent assessment of their needs."
"1245","We will examine the development of a fund to help local authorities produce tailored care packages to back up the results of these assessments."
"1247","Social inclusion. Social exclusion, affecting around ten per cent of the population, living in fewer than 1,000 of the most deprived wards in Britain, damages lives and wrecks communities."
"1248","Before 1997, social exclusion was ignored."
"1249","Now we have a new approach improving the quality of mainstream services, preventing people falling between the cracks, and reintegrating them into society if things go wrong."
"1250","We have targeted five priorities:"
"1252","Homelessness. The number of people living on the streets is down by one third since 1997."
"1253","Labour's target is to cut rough sleeping to two-thirds of its 1998 level by 2002."
"1254","Beyond then, we will maintain the drive to keep the number as low as possible."
"1256","Teenage pregnancy rates are falling. Yet Britain has the highest rates in Europe."
"1257","Labour's strategy tackles the causes of teenage pregnancy, provides mothers under 18 with access to supervised housing if they cannot live at home, and ensures that, if they do have children, teenagers get access to training, education or work."
"1258","By 2004 we are pledged to reduce teenage pregnancy by 15 per cent."
"1260","Truancy and exclusion. Labour has a target of reducing truancy and exclusion by a third by 2002."
"1261","The police are conducting truancy sweeps"
"1262","parents are now subject to fines of up to £2,500"
"1263","funds are being targeted towards pupils at risk."
"1265","16- to 18-year-olds. Nearly ten per cent of 16- to 18-year-olds are not in education, training or work."
"1266","The new Connexions service will bridge the gap, providing a single adviser to ensure all young people receive clear advice on the transition to work."
"1268","Neighbourhood renewal. Over the next three years Labour is pledged to back reform, with £900 million of investment in deprived neighbourhoods."
"1269","We want local people to lead renewal a coalition of public, private and voluntary organisations specifying priorities, engaging local effort."
"1270","Local Strategic Partnerships, which we have introduced to help coordinate public service improvement, will be properly inclusive of local people, involving them in decision-making."
"1271","They will be backed by specific funds to engage the local community."
"1272","Nearly £100 million has been set aside for business start-ups, and we will create a new tax credit for community investment to create £1 billion of investment in disadvantaged areas."
"1274","A populair welfare state. Labour's objective is to get the right benefit to the right people at the right time."
"1275","We want those entitled to benefits to take up their rights to claim them."
"1276","Fraud undermines confidence in the welfare system, so we are committed to reduce it."
"1277","We have been prepared to be tough - preventing fraud by tightening gateways, sharpening sanctions on fraudsters, and now with 'two-strikes-and-you're-out'."
"1278","We have saved £1 billion in fraud and error over the course of the Parliament by tightening up the way we administer income support."
"1279","The introduction of Automated Credit Transfer will save a further £100 million per year."
"1280","Labour is committed to clear targets for fraud reduction for each benefit, including a commitment to halve the rate of fraud and error in income support and Job Seeker's Allowance by 2006, and to incorporate fraud prevention into the design of new policies on benefits and tax credits."
"1281","We are also committed to data sharing between government agencies and action to reduce to a minimum the number of 'spare' national insurance numbers that are a gateway to fraud."
"1282","Our welfare state is underpinned by clear values - we help you to help yourself, we invest in children, we support our pensioners, we insist that no community be written off, and we minimise fraud and error."
"1283","Our reforms will build a strong and inclusive society."
"1286"," 4 Strong and safe communities. Our ten-year goals. Halve the burglary rate and double the chance of a persistent offender being caught and punished, as we modernise the criminal justice system."
"1287","Reformed local government with higher-quality services, as we decentralise power."
"1289","Our next steps. An extra 6,000 police recruits raising police numbers to their highest ever level"
"1290","Double the amount of assets seized from drug traffickers and other major criminals "
"1291","Increased sentences plus education and drug treatment for persistent offenders."
"1292","A bill of rights for victims."
"1293","New freedoms with new targets for local government."
"1294","We all know the sort of Britain we want to live in - a Britain where we can walk the streets  safely and know our children are safe."
"1295","We have a ten-year vision: a new social contract where everyone has a stake based on equal rights, where they pay their dues by exercising responsibility in return, and where local communities shape their own futures."
"1296","Overall crime is down ten per cent in Labour Britain, recorded crime down seven per cent, and police numbers are now rising."
"1297","Our strategy is clear and consistent - tough on crime and tough on the causes of crime."
"1298","Our ten-year goal of reducing crime depends on reform of the criminal justice system at every level, from police to courts to prison - to put crime reduction centre stage."
"1299","And, because crime is changing, crime fighting has to change too - to tackle repeat offending, drug-related crime and organised crime."
"1300","We are investing to raise police numbers to their highest level ever."
"1301","Offenders must know they will be supervised in or out of prison until they can prove they have gone straight."
"1302","Safe communities reclaim their streets"
"1303","then they can shape their own affairs."
"1304","In the 19th century, local politics was the motor for economic and social change."
"1305","Our purpose is simple: to create a Britain that is democratic, decentralised and diverse, with decisions always taken as close to the people as is consistent with efficiency and equity."
"1306","Our ten-year goal is a new settlement with local government - over finance, structures and services."
"1309","Responsibility from all. Winning the battle against crime. Recorded crime doubled under the Conservatives: burglary went up 105 per cent, car crime 110 per cent, violent crime 182 per cent."
"1310","The number of offenders caught, convicted and punished fell."
"1311","The criminal justice system, especially for young offenders, was in disarray."
"1312","Anti-social behaviour was unchecked."
"1313","And investment was falling."
"1314","The British Crime Survey shows crime down ten per cent in Labour's first two and a half years, including a four per cent drop in violent crime."
"1315","Recorded crime is down seven per cent from 1997, domestic burglary down 28 per cent, car crime down 20 per cent."
"1316","Investment in crime fighting is up."
"1317","We have reversed the declining trend in police numbers, reformed youth justice, and supported every community to prevent crime and anti-social behaviour."
"1318","We have reduced by seven weeks the time from arrest to sentence for persistent young offenders, and are on track to meet our pledge to halve the time by May 2002."
"1319","But we are not satisfied."
"1320","Drug-related crime is a menace."
"1321","Recorded violent crime has risen, partly because more domestic and racial violence is being reported."
"1322","And new crimes are being committed - fraud through the internet, human trafficking."
"1323","The only way to reduce crime is by being tough on crime and tough on its causes."
"1324","Government can help families and communities prevent crime."
"1325","But when people do commit crimes, we need an effective criminal justice system able to catch, punish and rehabilitate people."
"1327","Supporting the police. The foundation is our police force."
"1328","Police numbers started falling in 1993."
"1329","Our investment in 2000- 01 increased the number of recruits by an extra 3,000, boosting the number of officers in training by 77 per cent over the previous year."
"1330","Now Labour pledges a further 6,000 extra recruits."
"1331","Labour's pledge is that over the next three years annual funding for the police will rise by £1.6 billion, to £9.3 billion."
"1332","We also need to create a more effective police service."
"1333","Basic command units are the heart of modern policing, and local commanders and senior detectives should be properly trained and rewarded."
"1334","Strong leadership, modern equipment and specialist training and expertise are all essential."
"1335","We will bring in new arrangements for the development and appointment of chief officers."
"1336","We will introduce a new national core curriculum for officers at every level."
"1337","We will ensure that specialist detective expertise is built up using outside experts where necessary."
"1338","Labour will ensure more people see more police in the community."
"1339","We will discuss with the police how those on the frontline might be rewarded for their skills, experience and commitment."
"1340","We will promote co-operation across force boundaries for common services like training."
"1341","We are also committed to a new independent police complaints commission."
"1343","Persistent offending. About 100,000 persistent offenders, mostly young men, commit about half of all serious crimes."
"1344","We need a new approach to catch, convict, punish and rehabilitate more of them: Youth offending teams will track up to 2,500 of the most persistent young offenders 24 hours a day, seven days a week."
"1345","Every active offender will be on the DNA database by 2004."
"1346","Persistent offending should lead to increased punishment."
"1347","We will end the failed policy of repeat financial penalties"
"1348","where offending continues, firmer measures will be taken."
"1349","We will invest over £200 million over three years to reduce reoffending by those in custody."
"1350","Sentences will combine time in prison and in the community, with proper supervision after release for ex-prisoners."
"1351","In time, all offenders will have their own plan for return to lawful life, star ting in custody with drug treatment or literacy training."
"1352","New Review Courts will ensure that offenders who breach the conditions of their sentence will get extra community service, more intensive supervision or custody."
"1353","Those who break their bail can expect to go straight into custody for the remainder of their remand period."
"1354","To deal with the most dangerous offenders of all - those with a dangerous severe personality disorder - we will pass new legislation and create over 300 more high-security prison and hospital places."
"1355","Our proposals are based on a simple principle: stay straight or you will stay supervised or go back inside."
"1356","The continued modernisation of the probation, parole and prison services, so every offender gets punishment designed to minimise reoffending, will carr y this forward."
"1357","We will build on our youth justice reforms to improve the standard of custodial accommodation and offending programmes for 18- to 20-year-old offenders."
"1359","Crime in the community. Broken windows, graffiti and litter all send a signal about lawlessness."
"1360","Labour supports fines for anti-social behaviour and new powers to tackle unruly behaviour and kerb crawlers."
"1361","Every local authority should have an anti-social behaviour unit."
"1362","We will tackle alcohol-related disorder, with an overhaul of licensing laws, greater flexibility over opening times, and tougher controls on rogue landlords."
"1363","We will also streamline the system for removal of untaxed and abandoned cars."
"1364","Crime fighting now starts in every community thanks to new statutory Crime and Disorder Partnerships."
"1365","Our Safe Communities Fund will target hundreds of neighbourhoods with the highest crime rates with extra crime-fighting investment."
"1366","Domestic violence accounts for at least a quarter of all violent crime, so Labour is committed to expanding the safe hostel network."
"1367","Crime prevention requires that those most at risk of falling into a life of crime - children excluded from school, teenagers leaving care - are given real help and opportunity."
"1368","That includes drugs education for every child at primary and secondary school, and youth inclusion schemes in high-crime areas."
"1369","We will also take measures to tackle the problem of child pornography on the internet."
"1371","Drugs. One of the biggest contemporary drivers of crime is drugs."
"1372","Access to effective treatment is essential."
"1373","Prisoners are already subject to compulsory testing and offered treatment where necessary, which has led to a 50 per cent cut in the number testing positive."
"1374","Drug Testing and Treatment Orders ensure people punished in the community stay drug-free."
"1375","We are pledged to raise spending on drug treatment by 70 per cent by 2004."
"1376","We will roll out drug testing to cover offenders at every stage of the system."
"1377","People in prison for drug-related offences will have to kick the habit before they are free from supervision on the outside."
"1378","Drug dealers will be required to register with the police after leaving prison."
"1379","We will simplify the law on extradition to target organised crime including drug traffickers."
"1380","The Criminal Assets Recovery Agency will target their ill-gotten gains."
"1381","We will follow the money trail, through bureaux de change to offshore accounts, to convict them, and remove their money and passports."
"1382","Our ambition is to mobilise every neighbourhood against drugs."
"1383","We will therefore ensure that crime-fighting partnerships, covering every locality, get over £200 million over the next three years to fight crime and drugs."
"1385","A modern criminal justice system. The UK's legal traditions are precious."
"1386","But too much of our criminal law and the organisation of the courts are stuck in the past."
"1387","Our ambition is to re-equip the criminal justice system to deliver justice for all - the victims, the public and the defendant, with a short-term target of 100,000 more crimes ending in a criminal brought to justice."
"1388","Our White Paper Criminal Justice: The Way Ahead set out our initial views on reform."
"1389","The Auld enquiry will also make major recommendations."
"1391","Prosecution. Despite an increase of 25 per cent since 1997, we have too few prosecutors."
"1392","By 2004, Labour pledges 300 new prosecutors, including specialists in areas like serious and organised crime, paid on a level playing field with the defence."
"1393","We will modernise and consolidate the whole criminal law system to promote public confidence and to speed up criminal proceedings."
"1394","Law reform is necessary to make provisions against corporate manslaughter."
"1396","Courts. The current system, split between magistrates and crown courts, needs reform."
"1397","A unified system, including lower or intermediate tiers of court, offers simplicity and flexibility."
"1398","Lay magistrates as well as professional judges have their place in the system."
"1399","We will remove the widely abused right of defendants alone to dictate whether or not they should be tried in crown court."
"1400","For specialist cases such as those involving domestic violence or fraud, there is a strong case for specialist courts and specialist judges."
"1401","We will also develop late sitting, seven-day- a-week courts in high-crime areas to ensure there is no delay in getting people through the criminal justice system."
"1402","We have established a Judicial Commissioner to scrutinise the appointments process, and will take forward reform on the basis of experience."
"1404","Rules of evidence. Our rules of evidence fail to trust the good sense of judges and jurors."
"1405","Recent case law has extended the admissibility of evidence of previous conduct."
"1406","If there is any remaining doubt, we will consider legislation to reinforce the judgment."
"1407","Pending the findings of the Auld report, we see a strong case for a new presumption that would allow evidence of previous convictions where relevant."
"1408","Currently only the prosecution must disclose all expert evidence and names of all witnesses."
"1409","In the light of the Auld report, we will consider whether the defence should do so too."
"1410","In addition, witnesses should be able to refer to their original statements in the witness box, as well as offer evidence by video-link."
"1412","Representation. We have created the Community Legal Service and will extend it to 90 per cent of the population by April 2002."
"1413","We will continue to pursue the principle of best value for the benefit of the taxpayer and criminal defendants in the Criminal Defence Service."
"1414","We will examine reforms of the tribunal system in the light of the Leggatt Review."
"1415","We will subject restrictive practices in the legal professions to the closest scrutiny to ensure both the professions and the courts serve the wider public interest."
"1417","Victims have rights. In 1997, victims were the forgotten people in legal battles."
"1418","That has begun to change."
"1419","We have more than doubled the funding for Victim Support, taken powers to protect vulnerable witnesses in court, and prevented personal cross-examination by the defendant of rape victims."
"1420","We now propose further action."
"1421","First, victims will be given the legal right to present their views on the impact of the crime to the court and other criminal justice agencies before sentencing decisions."
"1422","Second, prosecutors will be able to challenge defence pleas in mitigation of the crime."
"1423","Third, we will legislate for a Victims' Bill of Rights to give support, protection, and rights to information and compensation to victims."
"1425","Our diverse nation. Labour believes that Britain can be a model of a multicultural, multi-racial society."
"1426","We have made major legal change"
"1427","now is the time to build the inclusive society in tune with British values."
"1428","Our commitment to protection for every citizen is expressed in the 1998 Human Rights Act."
"1429","It ensures that British citizens are able to enforce rights in our own courts."
"1430","Other legal change was necessary too."
"1431","The Race Relations (Amendment) Act learns the legal lessons from the shocking death of Stephen Lawrence and places a positive duty on all public bodies to promote equal opportunity."
"1432","We abhor racism and shall continue to implement the recommendations of the Macpherson report, including the reform of the 'double jeopardy' law for murder."
"1433","The repeal of Section 28 of the 1988 Local Government Act was grossly misrepresented as an attempt to use teaching to promote particular lifestyles."
"1434","We will ensure that such teaching continues to be prohibited, based on the provisions of the Learning and Skills Act, while removing discrimination on grounds of sexual orientation."
"1435","The UK now has the most comprehensive anti-discrimination legislation in Europe."
"1436","But an inclusive, tolerant, open society, where people rise on their merits, depends on culture and action as well as law."
"1437","We now need to reduce the barriers - to services, opportunities, institutions - that still hold people back."
"1438","This applies in the public and private sectors."
"1439","There are too few black and Asian staff in key public services and, in almost all organisations, far too few in middle and senior grades."
"1440","This is why we now have targets for the diversity of central government and other public services."
"1441","Voluntary and community organisations are key to Labour's vision for Britain."
"1442","From large national charities to local community groups and faith-based institutions, these sectors are a vital and diverse part of national life."
"1443","We have changed the tax rules to encourage individuals and businesses to give to charity, supported initiatives to increase volunteering, involved voluntary and community groups in the design and delivery of key government programmes like Sure Start, and helped charities build up their capacity to do their job even better."
"1444","Labour will build on its Compact with the voluntary sector, as we develop more far-reaching partnerships for the delivery of services and the renewal of our communities."
"1445","We will also build on our financial incentives for volunteering, by developing an effective infrastructure to support voluntary work in every community in Britain."
"1446","We welcome the contribution of churches and other faith-based organisations as partners of local and central government in community renewal."
"1447","We will use a successor to the Lambeth Group to look at government's interface with faith communities."
"1449","Immigration. People from abroad make a positive contribution to British society."
"1450","As our economy changes and expands, so our rules on immigration need to reflect the need to meet skills shortages."
"1451","The primary purpose rule, which split families and did nothing to stop abuse, has been ended."
"1452","A right of appeal for family visitors has been introduced."
"1453","immigration rules will remain clear, firm and fair, and help ensure that those who come and work here continue to make a major contribution to our economic and social life."
"1455","Asylum. It is right that people fleeing persecution are able to make a new life as hard-working citizens in a new country."
"1456","Britain has a long record of providing a home for such people, and it is important that we maintain this position."
"1457","But asylum should not be an alternative route to immigration."
"1458","The UK is ninth per head of population among European nations for asylum applications."
"1459","The key is to hear cases swiftly as well as fairly."
"1460","By cutting the decision time and increasing the processing of claims to over 10,000 a month, Labour has reduced the backlog we inherited."
"1461","We have tightened controls against traffickers, and introduced a civil penalty for lorr y drivers who bring in illegal immigrants."
"1462","A national support system has been introduced to relieve pressure on local authorities."
"1463","Asylum seekers and their dependants whose claims are rejected will be removed from Britain with the aim of more than 30,000 in 2003-04."
"1464","We will also help those granted refugee status to integrate into the local community, supporting them so they can come off benefits and into work."
"1465","We support tough penalties for those who engage in the barbaric trade of human trafficking."
"1466","We will bring for ward proposals to ensure a common interpretation of the 1951 Convention across the EU and to improve the international response to regional crises."
"1468","Political renewal. Change comes from the bottom up as much as the top down."
"1469","For the last 50 years, governments have failed to respect this basic truth."
"1470","Local authorities are responsible for the effective delivery of over £90 billion of public services a year."
"1471","The staff and councillors who work for the community often have the hardest jobs and their expertise is a real resource when it comes to achieving reform."
"1472","The best of local government is an inspiring example of what government can achieve."
"1473","Labour's ambition is a partnership of mutual respect and mutual responsibility."
"1474","We want to combine additional rights and resources with responsibility and reform, working with councillors and officers to develop the structures, services and finance to help local communities."
