"","sentence_text_new"
"656","Creating a comprehensive disability income scheme to give peope with disabilities real financial freedom."
"657","We will increase Invalidity Benefit by 15%, extend mobility allowance and base payments on medical records rather than National Insurance contributions."
"658","In the longer term we aim to reimburse individuals in full for the additional costs of their disability."
"659","Creating a Carer's Benefit for the many individuals who forgo normal earnings to look after elderly or disabled relatives."
"660","We will convert Invalid Care Allowance into a Carer's Benefit, increasing its value by an immediate 15%, indexing its future level to earnings and altering the entitlement rules to enable that people will still be eliglble even if the caring starts after the carer reaches pensionable age."
"661","Further improvements in benefits."
"662","We will, over the lifetime of a Parliament, phase out the differential in child benefit between the first child and subsequent children"
"663"," reintroduce death and maternity grants"
"664"," increase the family premium for income support and family credit, and reform the system of cold-weather payments."
"665","Unifying income tax and employees' National Insurance contributions so that the two taxes are collected and administered together and paid on the same income, whether from earnings, investments, capital gains or perks."
"666","Making the investment needed to end the recession, using the money borrowed by Conservatives to pay for their pre-election tax cuts."
"667","We will also raise the basic rate of income tax by one penny in the pound to pay for the improvements essential to education."
"668","Our new tax rates will be as follows: About 80% of tax payers will pay 26% income tax plus 9% from National Insurance (a combined rate of 35%)."
"669","On earnings above GBP 33,000, a combined rate of 42% will apply."
"670","On earnings above GBP 50,000 a combined rate of 50% will be paid."
"671","Pensioners and ordinary savers will not pay the 9% National Insurance element on their incomes."
"672","Special provisions will also ensure that those on modest incomes most of which comes from investments, such as people who have been made redundant, do not pay this 9%, on their savings."
"674","A Citizen's Pension. At present many people do not receive the full basic state pension."
"675","If they have not paid enough tax because they have not earned enough during their working lives, people have to rely on means-tested benefits when they retire."
"676","Women in particular are badly affected, because they tend to have the lowest paid jobs and to spend several years looking after children."
"677","Liberal Democrats believe that a pension should be a right for everyone."
"678","We will ensure that the basic state pension is paid as of right and end means testing for our poorest senior citizens."
"679","We will introduce Housing Cost Relief, weighted towards those in need and available to house buyers and renters."
"680","People holding mortgages will have the choice of moving to housing cost relief or continuing to receive mortgage interest tax relief."
"682","Widening Horizons: Investing in the Arts. The arts benefit in two ways."
"683","First, access to the arts is intrinsic to a high quality of life."
"684","Second, the cultural sector - the arts, crafts, design, and audiovisual industries - make as great a net contribution to the economy as does the oil industry."
"685","We will: Create a new Ministry of Arts and Communications headed by a minister in the Cabinet."
"686","Liberal Democrats will raise investment in the arts to the EC average over five years."
"687","Reform and decentralise arts funding and organisation."
"688","We will decentralise many of the responsibilities of the Arts Council, increasing the roles of Regional Arts Boards and local authorities."
"689","Strengthen links between the arts and education."
"690","We will enhance practical arts teaching and library provisino in schools and extend the provision of adult education for the arts and crafts."
"691","We will restore funding for public libraries to 1980 levels."
"692","We will abolish museum charges for school parties."
"693","Transfer responsibility for broadcasting to the new Ministry."
"694","The BBC is a major patron of the arts, and broadcasting and to guarantee political independence."
"695","These interests will also be reflected in the impending review of the BBC's Charter, and our plans for cable television."
"696","Encourage participation within Europe - including in particular cooperation in the film industry, inprotecting and enhancing our common heritage and in expanding opportunities for young artists of all kinds."
"698","Encouraging a Fit, Active and Healthy Society. Sport is important for the economic, social and health benefits which it can bring and for its ability to enhance community identity."
"699","Liberal Democrats will: Create a UK Sports Commission to provide a voice for participants, spectators, and administrators."
"700","State Sports Councils will continue to receive their core funds from government but the Commission will raise and distribute additional resources for the promotion of the participation and excellence."
"701","Encourage sport across the community."
"702","We will encourage school to invest in sports facilities and open them up to sports clubs and share facilities and coaching resources with local schools."
"703","We will encourage local authorities to transform football grounds into multi-sport venues."
"704","Encourage individual and corporate sponsorship, review the role of the Foundation for Arts and Sport and reconsider the Conservatives' hasty proposal for a national lottery."
"705","Maintain Britain's leading role in the fight against drug abuse in sport, ensuring adequate funding for testing programmes and education campaigns directed at participants."
"706","Enhance safety in the provision of sports grounds."
"707","We will put the safety of spectators first in any legislation and make standards mandatory."
"708","We will take into account the size of grounds when setting safety standards."
"709","We will raise revenue for investment in safety by increasing levies on football pools and betting."
"710","We will require local authorities to include sports spectators on ground safety committees."
"712","Guaranteeing Equal Opportunities. A forward-looking society places an equal value on the contribution of all its citizens - and benefits from the participation of all."
"713","Yet in today's Britain many groups of individuals are systematically discriminated against by a society which fails to recognise their right to equality of opportunity."
"714","Liberal Democrats will: Fight discrimination by incorporating the European Convention on Human Rights into UK law and then extending it into a full UK Bill of Rights."
"715","This will reinforce existing protection in British courts against discrimination on the grounds of sex, race, age, disability, religion or secual orientation."
"716","We will set up a Commission on Human Rights to assist individuals to take legal action in cases of discrimination or other breaches of the rights guaranteed in the Convention."
"717","Strengthen the rights of women."
"718","We will guarantee equal pay for work of equal value"
"719"," require public authorities and private contractors holding public contracts to be equal-opportunity employers and improve child-care support and facilities."
"720","Proportional representation for elections and modernising Parliamentary procedures will help to end the discrimination against women on elected bodies and in government at European, national and local levels."
"721","Extend the opportunities of young people."
"722","We will entrench young people's rights of representation on organisations which affect their lives and well-being such as college governing bodies."
"723","We will place a statutory obligation on local authorities to provide a comprehensive youth service in partnership with the voluntary sector, and we will invest in leisure and recreation facilities."
"724","Young people will have the right to confidential medical advice and treatment."
"725","Make old age a time of opportunity."
"726","We will introduce a flexible 'decade of retirement' for men and women, in which people may choose to retire and take a state pension at any time between ages 60 and 70 (the value of the pension increasing with the age of retirement)."
"727","We will increase choice for elderly and retired people by encouraging openings in voluntary and part-time work, and widening the availability of education, the arts and recreational facilities."
"728","Protect the rights of ethnic minorities."
"729","We will reinforce legislation to ensure equal opportunities for all, in housing, employment, education and training, especially in inner-city areas."
"730","PR will greatly increase the possibilities of participation in the political process."
"731","We will repeal the 1981 Nationality Act, reform immigration legislation to make it free from racial discrimination and restore the right of entry to British passport holders."
"732","We will push for the extension of EC race discrimination legislation and ensure that the rights of black and Asian British citizens are respected throughout the EC."
"733","We will encourage changes to the education system which place a positive value on a pluralist, diverse and multicultural society."
"734","Guarantee equal rights for gay men and lesbians through changes to criminal law, anti-discrimination legislation and police practices."
"735","We will repeal Section 28 of the 1988 Local Government Act."
"736","We will create a common age of consent regardless of gender or secual orientation."
"737","Work with people with disabilities and their organisations to draw up a charter of rights for people with disabilities."
"738","We will implement the 1986 Disabled Persons Act in full, giving priority to the development of advocacy schemes."
"739","We will fight discrimination by incorporating the European Convention on Human Rights into UK law and then extending it into a full UK Bill of Rights."
"741","5.Britain's Partners: European Partnership for the New Century. Liberal Democrats will take decisive steps towards a fully integrated, federal and democratic European Community."
"742","We believe that by sharing sovereignty and pooling power, Britain and its partners will be better able to achieve commoon goals for the economy, the environment, society and secuiryt than by acting alone."
"743","Our aim is to create a citizens' Europe in which power lies as close to the citizen as possible."
"745","Making Britain's European Presidency Work. Very few of the proposals that we have set out in the preceding sections will be successful unless Britain is prepared to work in partnership within the Community."
"746","Following Maastricht, yet again Britain risks being left behind while the rest of Europe moves on."
"747","Liberal Democrats want Britain to play a full role in creating a dynamic and democratic Europe."
"748","We will use Britain's six-month tenure of the Presidency of the Community's Council of Ministers to make a start on the real tasks that lie ahead: building a prosperous and integrated economy"
"749"," correcting the democratic deficit, making Europe work for its citizens, not its institutions"
"750"," widening the Community's membership"
"751"," and helping to create a peaceful and stable new world order."
"752","We cannot expect Britain to influence the direction the Community takes in the next decade unless it is a full and enthusiastic member."
"753","Our vision of the new Europe is of a federal community, where power is exercised at the lowest level consistent with good government."
"754","For us, federalism means decentralisation: passing powers down more than passing them up."
"755","The creation of Scottish, Welsh and English regional Parliaments therefore goes hand in hand with the promotion of more European cooperation and partnership, ensuring access to power for individuals and their communities right across Europe."
"757","Building a Citizen's Europe. January 1993 will bring the single market."
"758","Economic and monetary union will follow by the end of the decade."
"759","Yet the Community is still too much an organisation for businessmen and bureaucrats instead of citizens and communities."
"760","We want to mould Europe's future in the interests of Europe's people."
"761","Our priorities are: Economic and monetary union including the establishment of an independent European Central Bank and a single European currency."
"762","We will renounce the Conservatives' 'opt-out' clause and accept the timetalbe for EMU."
"763","Cooperation in research and innovation."
"764","We will encourage further collaboration within the EC on major scientific projects and the development of new technologies such as telecommunications, information technology and environmentally sustainable innovations."
"766","Action on the environment. Our environmental goals cannot be successfully achieved unless action is taken across the Community."
"767","The proposed European Environmental Agency must be established, a European energy policy drawn up and environmental subsidies and penalties applied Community-wide."
"768","An active regional and social policy."
"769","The single market and economic and monetary union will expose regions and firms to greater competition."
"770","This will be beneficial in the long run, but the EC must assist in the transitional period."
"771","We will renounce Britain's social chapter 'opt-out' and argue for a more flexible framework of social policy across the Community."
"772","The EC should set down minimum standards of health and safety and employee rights, leaving national governments and enterprises to decide how to meet them, subject ultimately to the judgement of the courts."
"773","Fundamental reform of the Common Agricultural Policy."
"774","We will ease the transition from the present wasteful and inefficient price support mechanism to market prices and direct support for farmers' incomes to achieve environmental and social goals, to be funded by savings made from the present intervention payment system."
"776","Creating a New Democracy in Europe. The Communitiy's structure gives far too much weight to the Council of Ministers at the expense of the European Parliament, and, most importantly, of the individual citizen."
"777","Further moves to European union, and enlargement, must depend on the institutions of the EC becoming truly democratic."
"778","We will: Set out the rights of the European citizen."
"779","We will work for a clear definition of the rights of the European citizen, and insist that these are common to all Community nationals."
"780","This must include common voting rights at local, national and European levels."
"781","Increase the democratic powers of the European Parliament."
"782","We will ensure that the Parliament becomes an effective partner with the Council in law-making, exercising in full the power of 'co-decision'."
"783","Introduce fair votes for the 1994 British elections to the European Parliament."
"784","The British citizen must no longer be denied the fair voting systems enjoyed by the citizens of every other European country."
"785","Make the Commission more accountable."
"786","The Parliament must have the power to confirm or deny the Council's nominee as President of the Commission, and then to approve or not the President's choice of Commissioners - and subsequently to sack them if necessary."
"787","We welcome the provisions of the Maastricht Treaty as a first step."
"788","Increase democracy and accountability in the Council of Ministers."
"789","We will argue to extend majority voting in the Council to cover all areas of Community policy other than constitutional and crucial security matters."
"790","When passing laws, the Council should meet in public."
"791","Improve national scrutiny of Ministers' actions in Europe."
"792","We will create a new Europe Committee of the House of Commons, and give our reformed House of Lords a special role in scrutinising developments in the Community."
"793","Prepare for Community enlargement, welcoming EFTA members and, when they are ready, the new deomcracies of Central and Eastern Europe."
"794","A Community with more members requires reformed and dynamic institutions."
"795","Further moves to European Union, and enlargement, must depend on the institutions of the European Community becoming truly democratic."
"797","Sharing Security.  Working for Peace."
"798","The Gulf War and its aftermath have shown the crucial need for stronger and more effective world institutions capable of upholding international law and enforcing respect for human rights."
"799","Britain must ensure that the Community plays a pivotal role in the construction of a new security order in Europe, following the democratisation of Eastern and Central Europe."
"800","New initiatives for disarmament and for sharing security burdens will enable further reductions in levels of armaments to be made without endangering security."
"801","On the global stage, a stronger United Nations will be needed to underpin cooperation in tackling the world's problems."
"802","We will: Develop common European Community foreign and security policies."
"803","This will include a common approach to defence procurement and the gradual integration of Community members' armed forces under a joint military command."
"804","The burden of collective security in Western Europe should be shared more equally"
"805"," we will press for contributions from all nations to the costs of joint forces such as NATO's proposed Rapid Reaction Force - of which Britain will provide almost half."
"806","Promote democracy and reform in Eastern and Central Europe by coordinating generious economic assistance to countries introducing democracy, guaranteeing human rights and reforming their economies."
"807","Assist the peaceful evolution of the Commonwealth of Independent States, the former USSR."
"808","We will help not just with food and financial aid and technical assistance, but also with the provisino of military resources to shift food and supplies, and with scientific assistance to dismantle nuclear weapons."
"809","Develop a pan-European security framework."
"810","We will encourage the Conference on Security and Cooperation in Europe to develop monitoring, verification and mediation duties within the continent."
"811","We will press for NATO to guarantee the borders of Poland, Czechoslovakia and Hungary and to enter into talks with other governments in the region for similar guarantees."
"812","Instigate a comprehensive review of UK defence policy which will be dictated by a rigorous analysis of defence needs rather than by fixed monetary targets."
"813","The Review will cover the continuing need for contributions to collective security, the value of Britain's remaining extra-European commitments, and the potential for increasing our contribution to UN peacekeeping missions."
"814","Given the present hopeful international situation, we believe that further reductions in levels of armaments will be able to be made without in any way endangering security."
"815","Since the review will set out the framework for defence policy for years to come, we will halt any defence cut, and any order for a new weapons system, which might prejudice its outcome."
"816","Establish an Arms Conversion Agency to help arms manufacturers to diversify and convert out of the defence field, funded by savings made in the defence budget."
"817","Out proposed regional developments agencies will also provide help to areas particularly affected."
"818","We will reduce spending on military research and development, and shift the resources into the civilian sector."
"819","Maintain a minimum nuclear deterrent."
"820","We believe that the UK needs to retain its independent nuclear deterrent, but that the escalation of firepower represented by the scale of the Trident replacement for Polaris is unnecessary and unhelpful."
"821","We will ensure that the total number of warheads on the four-boat Trident system is limited to no more than that currently deployed on the Polaris system, and our Defence Review will also examine the possibilities of future European cooperatino in the provision of a deterrent force."
"822","We reject the Government's proposed replacement of British free-fall nuclear bombs with air-to-surface missiles."
"823","Proposed new disarmament initiatives covering all categories of conventional and nuclear weapons."
"824","These will aim to eliminate non-strategic nuclear weapons from Europe, and to reduce the strategic weapons possessed by the US, the former Soviet Union, Britain, France and China - a vital step towards the day when individual nations' possession of nuclear deterrents ceases to be necessary."
"825","Act against the arms trade."
"826","Together with our Community partners, we will establish a register of all international arms sales, eventually to become a UN register."
"827","We will place a total embargo on arms sales to regimes which violate human rights, and work for further global agreements among suppliers to control arms sales and technology transfer."
"828","We will close the Defence Export Services Organisation and ensure that overseas said is not linked in any way to arms purchases."
"829","Make the United Nationsl more effective."
"830","The UN Security Council should take a proactive role in peace-keeping before confrontation develops into conflict."
"831","We will work with our Community partners to ensure that funds are available for maintaining peace and security."
"832","The UN Military Staff Committee should be reinstated and a permanent peacekeeping force established, with member states contributing contingents on an annual basis."
"833","Because of the need to assign British forces to this and to European policing and disaster roles (on top of their present commitments), more general purpose infantry battalions will be required than the number currently planned by the Conservative Government."
"835","Developing Global Prosperity. A secure, democratic and peaceful world can never be created while so much of the globe remains so desperately poor."
"836","Britain must play its part in developing prosperity, protecting the world environment, eradicating poverty, famine and disease, and promoting human rights and international cooperation."
"837","This will include: Increasing overseas aid to reach the UN target of 0.7% of GNP over five years."
"838","We will increase aid especially to democratic countries carrying out policies which benefit the poorest, are environmentally sustainable and respect human rights."
"839","We will raise the proportion of aid given as grants instead of loans and place greater emphasis on supporting small-scale, community-based, labour-intensive projects."
"840","We will promote closer European cooperation, to make the best use of national and Community aid, and avoid wasteful duplication."
"841","We will rejoin UNESCO."
"842","Ending the commercialisation of aid which the current Government has practised and which substantially reduces its value to the world's poorest."
"843","We will reduce the proportion of UK aid tied to the purchase of UK goods and services and ensure that help to British exports is solely a function of the Department of Trade and Industry, rather than the ODA."
"844","Encouraging environmentally sustainable development."
"845","This includes the transfer of appropriate technology, the development of sustainable agriculture and forestry, sustainable use policies for the tropical rain forests and and projects to prevent desertification, and the promotion of energy conservation and renewable energy schemes."
"846","We will provide technical help to develop methods of resource accounting and environmental and ensure that measures of sustainability are incorporated in decisions on development projects and programmes."
"847","Urgent action to tackle the growth in the world's population."
"848","Having doubled in the past fifty years to five billion, the world's population is expected to increase by a further one billion in the 1990s alone."
"849","We will give priority to support for family-planning programmes, education and employment opportunities for women, and basic provisino for old age."
"850","Reform of the world trading and financial systems."
"851","We see the successful conclusion of the Uruguay round of the GATT world trade talks as an urgent priority."
"852","Global prosperity also requires the reversal of the net flow of resources from the global South."
"853","We will press the EC to coordinate international action to resolve the debt crisis, including reducing government-to-government debt, introducint regulatory and tax regimes to encourage commercial banks to reduce or write off debt, extending eligibility to IMF and World Bank loans, and encouraging, where appropriate, debt for development and debt for environment swaps."
"854","We will press for the progressive reduction of all tariff and non-tariff trade barriers, and in particular the removal of unfair trading barriers against developing countries."
"856","6.Britain's Democracy: Electoral and Constitutional Reform. Liberal Democrats, alone in British politics, recognise that unless we change Britain's system of government, we cannot change Britain's future."
"857","Without constitutional reform, we will not achieve our other objectives."
"858","We believe in citizenship, not subjecthood - in the ability of all individuals to exercise power over the institutions that govern their lives."
