"","sentence_text_new"
"242","We will transform the Careers Service to make careers advice available to everyone, young or old, employed or unemployed."
"243","Britain cannot get the best performance from our employees by giving them the worst treatment."
"244","There will be a fair framework of law for both employers and unions."
"245","There will be no return to the trade union legislation of the 1970s."
"246","Ballots before strikes and for union elections will stay."
"247","There will be no mass or flying pickets."
"248","But our individual employees are entitled to be treated at least as fairly as their colleagues in Europe."
"249","We will opt in to the Social Chapter of the new European Treaty and introduce employment standards common in successful economies, including the best health and safety legislation."
"250","The existing protection provided for people engaged in especially hazardous work will be retained."
"251","Women and men must be able to care for their family as well as earn a living."
"252","We will give all employees equal rights and status under the law, whether they are full-time or part-time, permanent or temporary."
"253","We aim to guarantee every woman in employment the right to 14 weeks' maternity leave on full pay, and to give fathers paternity leave, bringing Britain into line with the better provision elsewhere in the European Community."
"254","Employees will have new rights to be consulted and informed about decisions which affect them, as well as the right to union membership and representation."
"255","We will restore union rights at GCHQ."
"256","Anti-discrimination law will be strengthened and we will consider as part of that law outlawing discrimination in employment on the grounds of age."
"257","Britain's Wages Councils set minimum wages for about 2.5 million people."
"258","But there is no minimum wage for all employees."
"259","We will end the scandal of poverty pay and bring Britain into line with the rest of Europe by introducing a statutory minimum wage of £3.4O an hour."
"260","This is a major but long overdue reform which will benefit around four million low-paid people, 80 per cent of whom are women."
"261","We will consult widely to ensure smooth implementation."
"263","We will promote a stake for employees. Employees should have the opportunity to own collectively a significant stake in the company for which they work, through a democratic Employee Share Ownership Plan (ESOP) or a co-operative."
"264","We will strengthen support for such schemes and consult about the possibility of creating a new tax incentive to encourage companies to establish or extend an ESOP or set up a co-operative."
"265","Recent pension fund scandals have shown how right Labour has been to call for stronger legal protection."
"266","We will reform the law so that pension funds belong to their members, not to employers."
"267","Half of the pension trustees will be employees, with an independent chairman, and pensioners will be represented."
"269","Modernising the National Health Service. This election will decide the future of the NHS."
"270","Indeed, it will decide whether or not we continue to have a NHS of the kind that the British people want."
"271","The Conservatives would continue to commercialise and privatise the NHS until it is run as just another business."
"272","With Labour, it will be modernised and restored as a high-quality public service, accountable to the community."
"273","Labour will stop the privatisation of the NHS and return opted-out hospitals and other services to the local NHS."
"274","We will halt the commercial market which is creating a two-tier health service."
"276","Our commitment to the NHS. For a decade, the Conservatives have persistently underfunded the health service."
"277","It may well take at least the lifetime of a Parliament to put things right, but Labour will start immediately."
"278","Instead of cutting income tax, we will make additional resources of at least £1 billion available for investment in the NHS over the next 22 months."
"279","Each year thereafter, we will continue to tackle underfunding."
"280","Unlike the Conservatives, we will not impose any new health charges."
"281","Labour will recognise the additional claims on the NHS from the growing number of very elderly people and the development of medical technology and knowledge."
"282","We will retain the pay review bodies."
"283","We will not cheat health authorities by agreeing pay awards which are not fully funded and leaving managers to bridge the gap by cutting patient care."
"284","We will invest in the modernisation of our hospitals and tackle the backlog of repairs and maintenance."
"285","We will also launch a new programme to invest £60 million in the modernisation of Britain's cancer services, using the resources we will save by scrapping the Conservatives' tax handout on private medical insurance."
"286","Within our overall budget, we will tackle the shortage of intensive care beds with a special programme providing an additional £25 million to expand this life-saving service."
"288","A healthy Britain. Labour will launch a National Health Initiative to promote physical and mental health from birth to old age."
"289","This initiative will be led by the Department of Health and Community Care and by a new Cabinet committee that will cut through departmental boundaries."
"290","We will set new targets to cut the inequalities in health between social classes and ethnic groups."
"291","Our Health Initiative will set targets for better health, backed by effective action."
"292","We will, for instance: "
"293","strengthen screening by restoring the free eye test"
"294","cut cancer by banning tobacco advertising"
"295","encourage healthy diets by introducing clearer food labeling"
"296","promote health at work by creating a modern occupational health service within the NHS."
"297","GPs have a vital role to play in health promotion."
"298","We will increase the time they have for each patient by reversing the financial pressures to take on too many patients."
"299","We will make sure every community has access to dentists, with the resources to provide full NHS cover we will and restore the free dental check."
"300","By improving family planning services, we will reduce unwanted pregnancies and help achieve our target of cutting the number of abortions by at least a quarter."
"301","We will ensure that access to abortion is equally available in every region."
"303","A modern NHS. We will create a modern, efficient NHS with incentives to improve performance - but without the queue-jumping and waste created by a market in health care."
"304","We will provide more services through local health centres and other community settings."
"305","We will give GPs the power to insist on improvements in service to all the patients in a neighbourhood."
"306","We will give the outcome of treatment the same importance as the throughput of treatment."
"307","Our new Health Quality Commission will monitor the quality of care and raise standards."
"308","The continuing care of very elderly and chronically sick patients will be a higher priority."
"309","We will halt the reduction in NHS services for long-term care and community health services which support elderly and disabled patients at home To achieve this change of direction, we will negotiate Performance Agreements with each health authority and back them with an Incentive Fund to reward authorities which perform well."
"310","These agreements will set local targets which reflect local priorities, for instance, to cut waiting lists or switch mental health services into the community."
"311","Hospital to managers, who will be accountable for meeting their targets, will otherwise be given maximum freedom of decision making."
"312","We will create new community health authorities, representative of local people, which bring together both GP services and hospital care."
"314","A first-class service to patients. In Labour's health service, power will belong to patients, not accountants."
"315","We will restore the right of patients to be treated in the hospital of their choice."
"316","Women will have the right to be seen by a woman GP and we will encourage the development of well women clinics."
"317","Ethnic minorities will have the right to obtain the diet required by their religious beliefs."
"318","We will set four new standards for a better service to: cut cancelled operations"
"319","improve cleanliness in hospitals"
"320","make it easier to phone for an ambulance"
"321","increase early admissions from waiting lists."
"322","As part of our commitment to a quality service to patients, we will end compulsory competitive tendering for hospital support services, which has driven down standards of cleanliness and catering."
"323","We will invest £25 million from within our overall budget to purchase several hundred more new, fully-equipped ambulances."
"325","A community service. Labour will expand the services which elderly people and their carers need for long-term support in the community, such as home helps, care assistants and community services."
"326","Our Department of Health and Community Care, with a new Minister of State for Community Care, will develop a high-quality programme of community care which responds to what users want."
"327","We will introduce a new earmarked grant for community care which will support the work of Labour councils in providing care for people at home, and oblige Conservative councils to use the grant to improve those services."
"328","We will end the pressure on councils to privatise their residential homes by providing funding for local authorities equivalent to the benefits paid to private homes."
"329","We will insist that the first call on income from the sale of mental health hospitals is the provision of better accommodation and services in the community for mental health users and people with learning disabilities."
"330","We will end the neglect that has allowed some former patients to end up sleeping rough and led to others being placed on remand."
"331","Labour will ensure that these services are in place before patients who will benefit from life in the community are transferred out of long-term hospital care."
"333","Raising standards in our schools. Good education is the best investment in Britain's future."
"334","All girls and boys, from every background, must be able to discover their talents and fulfil their potential."
"335","We want every child to get qualifications that count."
"336","We need safe, disciplined schools, where professional teachers work closely with parents."
"337","Learning must become a lifetime opportunity, with new chances to update skills at work."
"338","That is our vision of a well-educated Britain."
"339","But, under the Conservatives, Britain today invests a smaller share of our national wealth in education than in 1979."
"340","More and more parents are now being forced to pay for essentials in a system which should be free."
"341","Labour will modernise Britain's schools."
"342","Over the next 22 months, additional resources of at least £600 million will be made available for investment in education."
"343","We will then continue steadily to increase the share of Britain's national wealth invested in education."
"345","We will offer nursery education to three and four year olds. By the end of the decade, all three and four year o1ds will have the opportunity of nursery education if their parents so wish."
"346","Within six months, every local education authority will have to set targets for steadily increasing nursery and childcare services."
"347","Childhood Partnerships between councils, parents, schools, local businesses and community groups will help extend a wide range of childcare and nursery education services."
"348","The immediate investment in childcare described earlier (see page 10) is only the beginning."
"349","Our Ministry for Women will have central role in helping to develop a nationwide childcare strategy, including out-of-school and holiday provision as well as care for younger children."
"351","We will raise standards in our schools. By investing in better teaching, smaller classes and modern books and equipment we will raise education standards."
"352","Teachers will be guaranteed a proper salary and career structure."
"353","A General Teaching Council for England and Wales will help them achieve the highest professional standards."
"354","Higher quality training will be followed by proper support for newly-qualified teachers."
"355","A national in-service training programme will ensure that all teachers are fully qualified in the subject they are teaching."
"356","Within 12 months, we will end the scandal of primary school classes of over 40 children."
"357","We will then establish and steadily reduce maximum limits on class sizes, until no primary school child is taught in a class of more than 30."
"358","To make sure that children are reading by the age of seven, we will create a national Reading Standards Programme, with a national Reading Recovery Programme to help those in difficult."
"359","£20 million will be invested in reading recovery in the first year."
"360","National tests must provide the information needed to help pupils, and to judge schools' effectiveness, without wasting good teaching time."
"361","Children with special needs or special abilities will receive the extra attention they deserve."
"362","Nine out of ten secondary school children are in comprehensive schools."
"363","We will end selection at 11 where it still exists."
"364","We will introduce a fairer system for all school reorganisations, with independent public enquiries."
"365","We will phase out the Assisted Places scheme (without affecting pupils currently on a place, or offered one from September 1992) and redirect the savings to meet wider educational needs."
"366","Because the national curriculum cannot be properly taught without new textbooks, we will earmark funds for class and library books."
"367","Every child needs a good grounding in science and technology."
"368","We will introduce a programme to improve equipment and laboratories."
"369","We will start to tackle the backlog of school repairs."
"370","For instance, we will invest £30 million to ensure that within 12 months, no child has to use an outside lavatory."
"372","Guaranteed standards. Conservative plans to privatise the schools' inspectorate will be scrapped Our Education Standards Commission, together with her Majesty's Inspectors, will monitor the performance of every school."
"373","If a school is under-performing, the commission, which will be answerable to Parliament, will have the powers to ensure that it is brought up to standard."
"374","National Awards, similar to the Queen's Award for Industry, will encourage excellence in schools."
"375","We will reform the Conservatives' scheme for the local management of schools."
"376","All schools will be free to manage their day-to-day budgets, with local education authorities given a new strategic role."
"377","Opted-out schools will be freed from central government control and brought together with City Technology Colleges into the mainstream of the local school system."
"379","New rights for parents. We will reform the Conservatives' scheme for the local management of schools."
"380","All schools will be free to manage their day-to-day budgets, with local education authorities given a new strategic role."
"381","Opted-out schools will be freed from central government control and brought together with City Technology Colleges into the mainstream of the local school system."
"382","Home-school contracts will tell parents exactly what the school undertakes to deliver and what their responsibilities are."
"383","If they are dissatisfied with the school or education authority, they will be able to call in the Education Standards Commission and get action taken."
"384","We wish to see the key role of church and other voluntary-aided schools secured and available equally and on the same criteria to all religions."
"386","We will modernise the curriculum. Labour will modernise the national curriculum and apply it in all schools."
"387","From the age of 14, pupils will study five essential subjects."
"388","English, mathematics, science, a modern language and technology."
"389","In schools teaching in Welsh, the study of Welsh will be included."
"390","Every pupil will also be offered a wide range of academic, technical and other options."
"391","Taking account of the views of parents, enployers, teachers, pupils and the commendations of the Higginson Report, we will establish a five-subject A level and bring it together with technical qualifications into our new Advanced Certificate."
"392","Open to art-time and full-time students of any age, it will include 'credits' which can be transferred between different institutions."
"393","We will consult widely about the detailed structure of this new qualification, and finalise proposals quickly."
"394","Young people must have real opportunities to widen their experience and skills."
"395","Sixteen year olds not in full-time education will be entitled to a new traineeship lasting for up to two years, with an option of a further two years."
"396","Every young person in employment will be guaranteed the right to Learn While You Earn."
"398","Labour's education targets. We have set ourselves four education targets."
"399","They are the basis for our strategy and the benchmark against which progress will be judged."
"400","First, a nursery education for all three and four year olds whose parents wish by the year 2000."
"401","Second, within five years, we want four out of five 16 to 18 year olds to be able to achieve at least five GCSEs at grades A, B or C, or their equivalent."
"402","Third, by the end of the decade, we want half of Britain's 16 to 19 year olds to be able to qualify at the new Advanced Certificate levels or the equivalent in BTEC and other post-16 opportunities for study."
"403","Fourth, within 20 years, we will double the number of students in higher education, with at least one in three young adults participating by the year 2000."
"404","The student loan scheme deters many bright youngsters from poor families."
"405","We will replace it with a fairer system of student grants and targeted help for housing and vacation hardship."
"406","We will take effective steps to safeguard standards throughout higher education. "
"407","We will stop the Conservatives' adult education cuts and encourage local authorities to develop adult and community education and access courses, particularly for mature students."
"408","People over 50 who missed earlier opportunities will be able to apply for a 'Return to Learn' grant towards further or higher education."
"410","The best future for families and communities. Britain's families deserve the support which families receive in other European countries."
"411","We will create a new sense of community and social cohesion."
"413","We will make families better off. As we explained earlier (see page 12), we will increase child benefit for seven million families."
"414","Higher pensions and related benefits will benefit another 12 million people."
"415","We will reform the tax and national insurance system, and take 740,000 low-paid people out of tax."
"416","After the first year's extra increases we will restore the link between increases in the basic pension and prices or earnings, whichever is higher."
"417","Britain's national insurance system is far more efficient than private insurance."
"418","We will open it up to new groups such as low-paid and part-time workers."
"419","Labour will end the Conservatives' freeze on benefits for widowed mothers and other lone parents."
"420","We will encourage parents on income support to claim maintenance by allowing them to keep part of it before benefit is cut."
"421","We will restore nutritional guidelines for school meals and reverse the cuts in free school meals as soon as possible."
"422","We will reform benefits for people with disabilities and make it easier for those available for work to take employment."
"423","As resources allow, we will improve and extend invalid care allowance."
"424","Labour will develop a flexible decade of retirement between the ages of 60 and 70, 50 that men and women can choose to retire on a full pension or continue in work without discrimination."
"425","Our new National Pensions Plan, building on the State Earnings Related Pension Scheme, will offer people now in work a pension based on their 20 best years' earnings."
"426","Those who are self-employed will also be able to join."
"427","Occupational and personal pension schemes will have to guarantee a minimum pension before they can contract out, and guarantee equal treatment for men and women."
"428","We will reform means-tested benefits, replace the Social Fund, and restore benefit rights to 16 and 17 year olds as soon as possible."
"429","To relieve anxiety about funeral costs, we will introduce a funeral payment of £600, available on request."
"430","The costs will in most cases be recovered from the deceased's estate, although small estates will be disregarded."
"432","We will abolish the poll tax. Labour will abolish the poll tax immediately."
"433","We will replace it with our Fair Rates system, related to people's ability to pay."
"434","We reject the Conservatives' unfair banding and discount system, which would create a property poll tax."
"435","We will modernise the valuation system to ensure that properties are fairly assessed."
"436","Abolition of the minimum 20 per cent contribution - which will be of particular help to young people - will be followed by an improved rebate system, with special help to retired people on low incomes living alone."
"437","Business rates will become a local tax again, with rate rebates for small firms."
"439","People need decent homes. Labour will establish mortgage rescue schemes throughout the country, enabling home buyers to remain as tenants or part-owners."
"440","Mortgage interest tax relief will continue at the present rate."
"441","We will seek new arrangements to enable first-time buyers to concentrate relief in the early years."
"442","Housing log books and an end to gazumping will also help home buyers."
"443","We will also ensure that home-buyers receive proper advice about the potential cost of their mortgages in future years."
"444","Councils and housing associations will be allowed to lease or buy empty homes in order to provide accommodation for homeless people."
"445","Homes left empty without good r reason by any public authority will be e transferred to a better social landlord."
"446","We will restore housing benefit to people under 18 and provide more refuges for women escaping domestic violence."
"447","Labour will keep the right to buy."
"448","We will increase the number of homes for rent by establishing a Housing Bank to facilitate the balanced use of councils' capital receipts and offer investment capital at attractive rates of interest."
"449","Tenants will be offered the option to 'part rent, part buy'."
"450","Steps will be taken to improve sub-standard housing."
"451","Council tenants will be guaranteed real rights over their homes."
"452","Councils will set rents at a reasonable level, reflecting income levels in the different regions and localities."
"453","We will eliminate racial discrimination in housing allocation and improve safety on estates."
"454","In the private sector there is a need both for homes at market rents and those where rents are regulated and housing benefit payable."
"455","We will consult fully before introducing reforms and will not legislate retrospectively."
"456","All tenants must be protected against noise, nuisance, harassment and shoddy service."
"457","Leaseholders will have new rights, either to extend their lease, or collectively buy the freehold of their property from non-resident freeholders."
"459","We will protect people against crime. Crime in Britain has more than doubled since 1979."
"460","Over five million crimes were recorded last year, but the real total is certainly higher."
"461","Labour will insist that local councils work with the police to improve crime prevention by: modernising vulnerable estates"
"462","improving street lighting"
"463","demolishing derelict buildings"
"464","fencing off waste-land."
"465","Planning applications will be examined against crime prevention criteria."
"466","The sale of replica guns will be banned."
"467","Elected police authorities will use the extra resources available for the war against crime to ensure that more police officers are visible on the beat, backed up by the modern technology which is essential to crime prevention and detection."
"468","We will implement the recommendations of he Woolf Report to improve prison conditions."
"469","Prison must offer training for employment, not for crime."
"470","We will promote ion-custodial sentences for non-violent rimes and take steps to eradicate the discrimination in sentencing policy which particularly affects women and ethnic minority offenders. "
"472","People have a right to first-class services. We will develop customer contracts for local services, along the lines pioneered by Labour authorities."
"473","Local communities will help design services to meet their needs, with voluntary groups playing a key role in delivering services."
"474","Our new Quality Commission, incorporating the work of the Audit Commission, will ensure councils provide high-quality, value-for-money services, with clear avenues for complaint and redress."
"475","We will not tolerate shoddy service, inefficiency or waste."
