"","sentence_text_new"
"3","1992 LIBERAL DEMOCRAT GENERAL ELECTION MANIFESTO. CHANGING BRITAIN FOR GOOD. Be warned: this manifesto may not be what you expect."
"4","This manifesto does not promise good times just around the corner."
"5","It does not avoid difficult questions out of fear of unpopularity."
"6","It simply tells the truth, the truth about what Liberal Democrats believe has to be done in order for Britain to succeed."
"7","If you want Britain to stay the same then you probably won't like this manifesto."
"8","But if you want real change, if you long for a better future for yourself, your family, your community and your country, then read on."
"9","Britain has a clear choice at this election."
"10","We can stay much as we are, in the same old muddle, with difficult decisions postponed."
"11","Our failure to adjust to the modern world will then become every more serious."
"12","We will lag further behind in creating and sharing wealth."
"13","More and more people will lose their jobs and homes."
"14","Our environment will go on deteriorating."
"15","Our public services, already second rate, will become even worse."
"16","We shall fail to get the best out of the European Community, because our leaders will continue to be afraid to tell us that shared success in the Community means sharing sovereignty too."
"17","Our system of politics will continue to foster confrontation and short-term thinking, and exclude ordinary citizens from the business of government."
"18","This manifesto offers a different choice for Britain."
"19","Liberal Democrats do not believe that our country's under-performance has to be accepted."
"20","Another forty years of failed government is not inevitable."
"21","Britain has many advantages: a wealth of natural resources"
"22"," a long history of engagement with the rest of the world"
"23"," a mature and inventive people who value tolerance and freedom."
"24","But Britain will only succeed when its political leaders start treating voters as informed citizens with shared concerns, not as ignorant consumers to be manipulated."
"25","Now is the time for change."
"26","That is why in this manifesto we set out a clear analysis of Britain's problems and our proposals for putting them right."
"27","Above all, Liberal Democrats will trust our fellow citizens with the truth."
"28","So this manifesto is different from others you may read."
"29","We are not afraid to say what needs to be said."
"30","We are not afraid to do what needs to be done."
"31","And we are clear that if we want to make a modern Britain, we must first change Britain."
"33","What Liberal Democrats stand for. Liberal Democrats put people first."
"34","We aim to create a society in which all men and women can realise their full potential and shape their own successes."
"35","We believe that if we could liberate this wealth of talent we would transform our economy and create a shared society of which we should all br proud."
"36","Liberal Democrats know that this cannot be achieved without fundamental reform."
"37","We must change our political system to give the citizen more power and the government less"
"38"," our economic system to confer power on consumers and to provide employees with a share in the wealth they create"
"39"," our public services to guarantee choice and dignity to each of us"
"40"," and our education system to equip us better for the modern world."
"41","Liberal Democrats recognise the importance of the things we own in private but we also know the value of what we hold in common."
"42","We believe that people are at their best as members of communities, where they care about each other and for those less fortunate than themselves."
"43","So our policies are designed to strengthen communities, tackle crime and poverty, build up the common wealth and improve the shared quality of life."
"44","In the economic sphere we know that the free market is the best guarantee of responsiveness to choice and change."
"45","But we believe the market should be our servant not our master."
"46","So we see the role of government as crucial in making the market work properly, by creating the conditions for success, promoting competition, breaking up monopolies and spreading information."
"47","And government has to be ready to make the investments which private enterprise will not, whether in transport, education or public works."
"48","Liberal Democrats know that we have a duty, not only to each other but to the generations which follow us, to protect the environment."
"49","We believe that this is best achieved not by making people poorer or less free but by building true environmental costs into the market so as to reward those who conserve and penalise those who pollute."
"50","Liberal Democrats are uncompromisingly internationalist."
"51","We know that there is a limit to what Britain can achieve alone and we are committed to building in the wider world the sort of society we strive for at home, founded on mutual cooperation, political liberty and shared prosperity."
"52","We have long been committed Europeans, believing that Britain can only be secure, successful and environmentally safe if we play our full part in building a more united and democratic Europe."
"53","Globally, Liberal Democrats will work to strengthen international cooperation."
"54","We reject outdated notions of national sovereignty, believing that they now stand in the way of common action to deal with the scourges of disease and hunger, the deterioration of the Earth's environment and the continuing dangers of the post-Cold War world."
"55","We believe that all government, whether local, national, or increasingly European, should be bound by the rights of the individual and should be fully accountable."
"56","Because Liberal Democrats alone understand that we shall not change Britain's future unless and until we change Britain's electoral system, we are committed to electoral and constitutional reform."
"57","We shall not rest until the government of Britain fully belongs to the citizens it is there to serve."
"59","Britain's balance sheet. In drawing up this manifesto, we have begun from where Britain is today."
"60","Like any good auditor, we have been realistic about national achievements and failures, about opportunities and problems."
"61","The result is a balance sheet which shows our country's strengths and weaknesses."
"62","Despite some points of promise and potential, Britain's balance sheet shows how much still needs to be done."
"63","The following pages reveal the extent to which, in the economy, in the environment, in education, and in local services, successive British governments have failed to realise the opportunities of the past decades."
"64","Although there are bright sports, the general picture is one of relative decline in relation to other advanced democracies."
"65","Forty years of failure are the result not only of misjudged policies from both Conservative and Labour Governments."
"66","Even more crucially, they are the product of an outdated political system which has consistently sacrificed the long term to the short term and abandoned principles for expediency."
"69","The Economic Balance Sheet. Positives. In some ways, British industry is thriving."
"70","In 1991, UK exports climbed to a record level of GBP 103,804 million."
"71","Industrial relations have improved markedly since the 1970s."
"72","Trade unions have become more responsible and democratic."
"73","Days lost through strikes fell from more than 29 million in 1979 to under a million in the year to October 1991."
"74","The excessively high income-tax rates inherited from the last Labour Government have been brought down - from a top rate of 83% in 1979 to 40% in 1992."
"76","Negatives. Unemployment has been the most obvious cost of the current recession."
"77","The latest figures show 2,604,100 out of work."
"78","The number unemployed for more than six months has doubled in the past year."
"79","The recession is biting deeply into industry."
"80","Business bankruptcies have jumped from 28,935 in 1990 to 47,777 in 1991."
"81","High interest rates are throttling the chances of economic recovery."
"82","British three-month rates stood at 10.7% in February, compared to 9.5% in Germany, 5.3% in Japan and 4.3% in the US."
"83","Britain is failing to invest for the long term."
"84","Investment in manufacturing industry fell from GBP 3.1 billion in the first quarter of 1990 to GBP 2.5 billion in the last quarter of 1991."
"85","This failure to invest for the long term can be een also in innovation, the development of new ideas and products."
"86","In 1984-1988 only 3.4% of patents granted in the US to other national went to Britons (3.7% in 1979-83)."
"87","By comparison, France had grown from 3.3% to 3.4%, and Japan managed 18.8% (against 12.9% in the earlier period)."
"88","Britain's record of economic growth is very poor."
"89","The UK economy contracted by 2.2% in 1991 - the biggest annual fall since the 1930s - while Italy's grew by 1.3% and German's by 1.9%. "
"90","Conservative management of the economy has stoked the biggest credit boom in Britain's history."
"91","Average personal debt as a proportion of disposable household income mushroomed from 57% in 1980 to 114% in 1990."
"92","Conservative taxation policies may have reduced high marginal income-tax rates, but it was the rich who benefited, not the country as a whole."
"93","From the beginning to the end of the 1980s, take-home pay rose by 41.4% for those on 1.5 times the national average, by 37% for those on the national average, and by only 32% for those on half the average."
"96","The Environmental Balance Sheet. Positives. Britain has a massive advantage in natural resources that gives it the potential to be at the forefront of renewable energy generation."
"97","Government estimates show that up to 45% of electricity demand could be met from wind power."
"98","Government action can significantly affect standards of environmental protection."
"99","The market share of unleaded petrol rose from 1.1% to 43.0% between August 1998 and November 1991, due to widening tax differentials."
"100","Britain has a positive record on protecting its countryside."
"101","More of our land is protected in National Parks than any other EC member, and one more has recently been announced, in the New Forest."
"103","Negatives. In too many ways Britain unfortunately deserves its nickname of The Dirty Man of Europe."
"104","Carbon dioxide emissions - the main source of global warming - increased in the UK from 525 million tonnes in 1986 to 530 million in 1989."
"105","The UK produces more sulphur dioxide, the main cause of acid rain, than any other EC member, but is only now beginning to install pollution-control devices to power stations."
"106","Germany started in 1984."
"107","Prosecutions for water pollution more than doubled between 1981 and 1988, while an additional 40 beaches were found not to be complying with EC standards in 1990 - making a total of 20% of all British beaches."
"108","The Government has failed to invest in the development of renewable energy sources - despite the fact that they avoid the pollution problems associated with coal, oil and gas."
"109","Currently, just over GBP 20 million is spent annually on renewable energy research and development, compared to more than GBP 200 million a year on nuclear power."
"110","Even worse, the Government has cut the budget of the Energy Efficiency Office, while investment in energy conservation would save money and reduce pollution."
"111","The 1990-91 level of funding, a meagre GBP 23 million, is lower than it was four years before."
"112","Pollution from road transport has risen from 884 million tonnes of nitrogen oxides in 1980 to 1,298 million tonnes in 1989."
"113","At the same time, the proportion of freight carried on the railways between 1980 and 1990 dropped from 9% to 7%, while the proportion using road transport rose to 83%."
"114","Rail transport is placed at a disadvantage in Britain."
"115","Levele of government support for the railways fell throughout the 1980s, from GBP 1262 million in 1980-1981 to GBP 462 million in 1990-91."
"118","The Educational Balance Sheet. Positives. In some ways educational standards are improving."
"119","The number of teachers in nursery and primary education grew from 176,228 in 1986 to 193,516 in 1991."
"120","Similarly, pupil-teacher ratios fell from 18.2 in 1980-81 to 16.9 in 1990-91."
"121","Some of the Government's changes have been for the better."
"122","The idea of Local Management of Schools has, in some places, produced school management of imagination and quality."
"124","Negatives. Overall, government funding of education is inadequate."
"125","The proportion of Britain's gross domestic product devoted to education fell from 5.6% in 1981-82 to 5.0% in 1990-91."
"126","The number of secondary school teachers fell from 224,618 in 1986 to 198,030 in 1991."
"127","There has been a serious decline in the number of people qualifying as teachers, down from 25,000 in 1980 to 18,500 in 1988."
"128","The Government is planning further cuts in teacher-training facilities."
"129","British children lose out in critical areas of education."
"130","The proportion of children in pre-compulsory education in 1987-1988 was a mere 3.6%, compared to 13.5% in Germany, 17.0% in Belgium and 18.4% in France."
"131","Compared to our competitors, not enough of our young people stay on to post-compulsory education."
"132","The proportion of 16-18 year olds in full-time education or training was 35% in Britain in 1988, compared to 47% in Germany, 66% in France and 79% in the USA."
"133","Investment in scientific research and development has fallen from 0.35% to 0.28% of GDP (while in Germany it stands at 0.40%), not only affecting our higher education system but creating a knock-on effect throughout the British economy."
"136","The Social Balance Sheet. Positives. Overall, British standards of health are improving."
"137","Life expectancy for men rose from 70.8 years in 1981 to 73.2 years in 1991, and for women from 76.8 to 78.8 years."
"138","Home ownership in Britain rose from 55.8% of households in 1981 to 67.3% in 1991."
"139","The size of the police establishment has increased by 15% since 1978-79."
"140","Expenditure on the policy rose by 55% in real terms over the same period, and policy pay showed a 29% real rise."
"141","While the NHS hospital sector's purchasing power grew by 15.6% between 1980-81 and 1990-91, expenditure requirements (due to demographic change and the rising cost of medical technology) in fact increased by 21.3%."
"142","The total number of people waiting for NHS treatment in the UK rose to more than one million in March 1990, 25% of inpatients wait for longer than a year for treatment."
"143","The number of sign tests has fallen by 21% since the introduction of charges in 1988."
"144","The Government has withdrawn funding for new house building, and refused to allow councils to spend the receipts they have gained from new home owners."
"145","As a result, the amount of local authority housing built has fallen from more than 65,300 homes in 1979 to a mere 8,600 in 1990."
"146","The number of people accepted by local authorities as homeless rose from 70,000 in 1979 to almost 170,000 in 1990 - and this does not include the single homeless."
"147","With the massive expansion of mortgage lending and the subsequent use of interest rates to bring down inflation, the number of mortgages over 12 months in arrears rose from 59,690 in June 1991 to 91,740 by the end of the year."
"148","The number of properties repossessed rose by 74% over the 1990 figure to 75,540 in 1991."
"149","Outcomes have failed disastrously to match the input of additional resources to law and order."
"150","Recorded rate of notified crime have increased year on year by 5.5% on average, and by a massive 16% in 1990-91."
"151","At the same time, crime clear-up rates have declined by 32%."
"152","Britain has proportionately the largest prison population of any Community country - and we also have more prisoners serving life sentences than the rest of the EC combined."
"154","Policies for the new century. It is clear from our analysis of Britain's balance sheet that Britain needs change."
"155","Here are our first steps, the key measures which we believe must be taken straight away if we are to break the cycle of Britain's decline, unlock the full scope of Britain's potential and pave the way to future success."
"157","The first steps. Britain's political institutions need thorough-going reform: stable and representative government, elected Parliaments in Scotland and Wales, decentralisation of power to the English regions and to local government, freedom of information and a Bill of Rights."
"158","As the essential measure to secure and entrench lasting reform we will introduce fair votes by proportional representation for Parliamentary elections."
"159","In the middle of the recession, the economy needs new impetus not a tax cut."
"160","We will immediately introduce an emergency programme of investment in the infrastructure and in public works in order to get companies and people back to work, thus reducing unemployment by 600,000 over the next two years."
"161","Lower inflation and a stable climate for industry to plan and prosper will lead to long-term prosperity."
"162","We will give the Bank of England independent responsibility for monetary policy, with a requirement to promote price stability."
"163","We will put the pound into the narrow band of the Exchange Rate Mechanism."
"164","Environmental priorities must be built into all economic decision-making, ensuring that economic success goes hand in hand with environmental responsibility."
"165","We will introduce new environmental incentives."
"166","The skllls and capabilities of the British people must be adequate to meet the challenges of the new century."
"167","We will increase investment in education by GBP 2 billion, funding this by an increase of 1p on income tax."
"168","Older people deserve greater security."
"169","We will protect private pensions, and increase the basic state pension, making it payable as of right without means testing."
"170","Britain's future must be safeguarded by active membership of the European Community which is united and democratic and in which decisions are taken as close to the people as possible."
"171","We will take decisive steps towards the economic, monetary and political union of a democratic Europe."
"172","Only when these key steps have been taken will government and individual alike be able to plan for the long term, instead of focusing on the short term and the next election."
"173","The balance of this manifesto sets out the Liberal Democrat vision of the future: our long-term programme for government."
"174","The detailed costing and revenue-raising effects of our proposals are contained in a separate supplement."
"176","1.Britain's Prosperity: Public Investment  Private Enterprise."
"177","Liberal Democrats aim to encourage a competitive and enterprising economy which is environmentally sustainable, founded on partnership and advanced skills and closely integrated with Europe."
"178","What the economy needs is a new impetus."
"179","The Government's proposed tax cut will not achive this."
"180","Only new investment will provide the kick-start needed to escape from recession and reduce the waste of talent and energy which results from unemployment."
"181","But Liberal Democrats also recognise Britain's long-term needs."
"182","We are committed to a free market, to free trade and to the creation of a competitive and enterprising economy."
"183","We do not believe it is government's job to run business - people do that much better."
"184","We see government's role as enabling firms and entrepreneurs to have the best possible chance."
"185","That means encouraging competition, investing in skills, involving employees in the success of their companies, nurturing small businesses, playing a positive part in the construction of the new European economy and, above all, bringing greater stability to national economic management."
"186","Our long-term aim is to shift the burden of taxation away from the things the country needs more of - income, savings and value added - and on to the things we want less of, such as pollution and resource depletion."
"188","Turning Britain Round. The current recession is undermining Britain's competitiveness and future success."
"189","Unemployment and business closures lead to a wastage of talent and a loss of resources."
"190","At the same time, essential investment in our country's future, in infrastructure, in education and training and in innovation, is being neglected."
"191","Liberal Democrats will introduct an emergency programme of investment to end the slump."
"192","We will immediately put in hand a major programme of public capital investment, funded by reversing the Tory tax cut together with a prudent increase in borrowing."
"193","This, combined with a freeze in business rates and new investment in education to increase the nation's skills, will kick-start recovery and create jobs."
"194","We will: Attack unemployment by creating new employment opportunities."
"195","Our emergency programme should reduce unemployement by at least 600,000 over two years."
"196","We will increase spending on public transport, housing, hospitals and schools, on energy efficiency and conservation projects and on education and training - all sensible investments for the country's future."
"197","We will aim to guarantee everyone out of work for six months or more a place on either a high quality training programme or on a work programme with a strong element of training."
"198","Invest in infrastructure."
"199","We will provide support for transport infrastructure, including a dedicated high-speed rail link from the Channel Tunnel to connect with the major routes to the North and West of Britain, and the extension of electrification throughout the country."
"200","We will encourage the expansion of airports outside the South East."
"201","Freeze business rates this year, thus effectively reducing them in real terms, a larger reduction than that promised by the Government."
"202","Create a training incentive for firms through the introduction of a levy equal to 2% of payroll, from which they would deduct their expenditure on training."
"203","We will require employers to release their employees aged under 19 for a minimum of two days a week futher education and/or training for nationally recognised qualifications."
"204","We will establish a fully integrated system of skills training, leading to recognised qualifications for a broad range of skills."
"205","We will increase 'access' courses for mature students and retraining for women returners and those in mid-career."
"206","We will fund crash courses in the main areas of skill shortage, aimed in particular at the long-term unemployed."
"207","Invest in local economies."
"208","We will set up and fund new regional development and local enterprise agencies."
"209","We will encourage TECs to become strong, locally based, employer-led organisations providing business services, acting as an effective voice for business at local leve, and overseeing training of those in employment."
"210","We will encourage decentralisation of banks and other financial institutions."
"211","We will end the present Government's policy of clawing back from local authorities, amounts equivalent to those they receive from the European Community's regional development fund."
"212","Invest in research, innovation and design."
"213","We will increase immediately the government science budget to 0.35% of GDP and raise it steadily thereafter."
"214","We will establish regional technology transfer centres to bring together the resources of industry, colleges, and government labs."
"215","We will encourage industry to invest in innovation and to improve the provision of seedcorn capital."
"216","We will reverse cuts in design consultancy schemes and provide additional funding for the Design Council."
"218","Making Britain Competitive. A climate of enterprise and competition is vital if British industry and products are to compete effectively in overseas markets."
"219","Yet the current Government has concentrated instead on converting public into private monopolies."
"220","We will: Stimulate competition."
"221","We will take tough action against monopolies, mergers and financial raids."
"222","The Monopolies and Mergers Commission will be combined with the Office of Fair Trading and made independent of government, increasing its effectiveness."
"223","We will introduce a Restrictive Practices Act to penalise anti-competitive behaviour and end price-fixing by cartels."
"224","We will encourage greater competition in the banking sector."
"225","Break up monopolies."
"226","We will break up the monopoly providers of services such as British Telecom and British Gas."
"227","We will permit access by private operators to the British Rail track network."
"228","We will liberalise the coal industry by transferring ownership of coal reserves to the Crown (in line with other minerals), and issuing licences to operate pits to other groups, as well as British Coal."
"229","Promote consumer rights."
"230","We will take the lead within the EC to ensure that all products come with accurate, full and simple product and service information."
"231","We will give consumer watchdogs, including the regulators and trading standards departments, greater powers, and improve redress for inadequate goods and services."
"232","Encourage decentralised wage bargaining."
