"","sentence_text_new"
"685","We will provide whatever resources are needed for effective defence for our country, providing the necessary level of forces with the appropriate equipment and weapons."
"686","Unlike the Tories, we recognise that disarmament negotiations and technological change can bring about problems for our defence industries."
"687","Nearly 100,000 lobs have already been lost during the past two years and 123,000 more are in danger."
"688","Selling more arms to poor countries is not an acceptable or effective way of maintaining Britain's defence industries."
"689","We will stop sales to countries which might use them for internal repression or international aggression."
"690","The Labour government will set up a Defence Diversification Agency to assist workers, communities and companies affected by change."
"691","The agency will ensure that resources made available by reductions in defence spending - reductions already planned by the Conservative government - are used in the first instance for rebuilding and investing in our manufacturing base."
"692","From the fruits of this investment can stem finance for health and the social services."
"694","It's a new chance for a new Europe. The Labour government will promote Britain out of the European second division into which our country has been relegated by the Tories."
"695","Our first chance will be the United Kingdom's six-months' presidency of the Community, starting on 1 July."
"696","We shall use that presidency to end the Tories' opt-out from the Social Chapter, so that the British people can benefit from European safeguards."
"697","We will also use our presidency to help ensure that poorer countries are not disadvantaged as a result of the Single Market."
"698","We shall play an active part in negotiations on Economic and Monetary Union."
"699","We shall fight for Britain's interests, working for Europe-wide policies to fight unemployment and to enhance regional and structural industrial policy."
"700","The elected finance ministers of the different countries must become the effective political counterpart to the central bank whose headquarters should be in Britain."
"701","As part of the evolving role of the regions of Europe, we will establish a Scottish representative office in Brussels and seek appropriate representation for the Scottish Parliament in European institutions."
"702","We shall seek fundamental changes in the wasteful Common Agricultural Policy."
"703","Savings can help finance other Community projects."
"704","We shall make the widening of the Community a priority, and shall advocate speedy admission for Austria, Sweden, Finland and Cyprus, whose membership applications have been or are about to be lodged."
"705","We shall seek to create conditions in which, at the appropriate time, the new democracies of Central and Eastern Europe can join the Community."
"707","It's a new chance for human rights. Labour will set up a Human Rights Division in the Foreign and Commonwealth Office, and require all Britain's diplomatic posts abroad to appoint an officer to monitor human rights."
"708","There will be an annual report to Parliament."
"709","Decisions on economic aid and arms sales will be linked to human rights records."
"711","It's a new chance to win friends abroad. Labour will end Tory government meddling in the valuable work of the British Council."
"712","Within carefully controlled costings, Labour will consider new scope for the BBC World Service, praised by listeners such as Terry Waite and Mikhail Gorbachev, and for the BBC's World Service Television Service."
"714","It's a new chance to fight world hunger and poverty. Under the Tories, Britain's aid budget has been cut to its lowest ever."
"715","The Labour government will aim to meet the United Nations aid target of 0.7 per cent of GNP within five years - the lifetime of a full Parliament."
"716","Labour will establish a separate Department of State for International development, whose Minister will be in the Cabinet."
"717","Tackling poverty will be the top priority of our aid programme."
"718","We will make aid more effective, work more closely with non-governmental agencies, put women at the heart of our programme and, in co-ordination with other donors, reduce the share of tied aid."
"719","Labour will promote environmentally sustainable development and encourage new approaches to reduce Third World debt."
"720","We will restore funding for development education in the UK."
"721","We will promote greater and fairer trade for poor countries, to enable their economies to grow and diversify."
"722","UN and European Community action to help the world's poor must become more effective."
"723","Labour will take Britain back into UNESCO."
"724","The Labour government will work within the G7 and the European Community to win support for a New Marshall Plan to assist the former communist countries of Central and Eastern Europe and of the ex-Soviet Union."
"725","Instability in those countries, caused by shortages and discontent, could be as great a threat to world peace as the armed communism that has now disappeared."
"727","It's a new chance for Britain in the Commonwealth. The Tories have regarded the Commonwealth as a wearisome obligation."
"728","Labour believes that this unique inter-racial and inter-hemispheric organization can play a central role in fighting racism, hunger and human rights violations."
"729","We shall play an active part in the Commonwealth and join the South Africa Committee of Foreign Ministers which the Tories have boycotted."
"731","It's a new chance to safeguard the environment. The Tories have been laggardly and reluctant in international moves to protect our planet's environment."
"732","Labour will set the pace in pressing for international action to safeguard the ozone layer, to combat acid rain, to tackle the problem of global warming, to face up to the environmental needs of the poorest people of the world."
"733","We will scrap the Tory government's opt-out on European Community environmental protection measures and deadlines."
"734","Labour will adamantly oppose any attempts to permit commercial exploitation of the virgin continent of Antarctica.  "
