"","sentence_text_new"
"506","Shift money from unnecessary bureaucracy into patient care."
"507","We will move from annual to at least three yearly contracts between Health Authorities and Trusts, and shift the money saved into front-line patient care."
"508","We will replace time consuming local pay bargaining with a new national pay structure and a single NHS-wide Pay Review Body that covers all pay, from the cleaner to the chief executive."
"510","Building on the best of the NHS. The NHS needs to be strengthened and improved."
"511","We will: Cut waiting lists."
"512","We will cut waiting times between diagnosis and treatment to a maximum of 6 months over 3 years."
"513","Improve the quality of care and raise morale."
"514","We will recruit and train more professional staff."
"515","Our carefully costed plans would, for instance, pay for the equivalent of 10,000 more nurses or 5,000 more doctors."
"516","We will ban the use of gagging clauses in employment contracts which prevent professional staff from speaking out against unsafe standards."
"517","Tackle the crisis in NHS dental care."
"518","We will require local authorities to ensure that the public has access to NHS dentistry in all areas."
"520","Promoting good health. Britain has a health service that concentrates too much on curing illness rather than preventing it."
"521","A healthier nation and a more cost-effective NHS depend on shifting the emphasis towards prevention, tackling the root causes of ill health (e.g.poverty and homelessness) and making people more responsible for their own health."
"522","We will: Make prevention a priority."
"523","We will immediately abolish charges for eye and dental check-ups and freeze prescription charges as the first steps in a radical shift of policy that emphasises the prevention of illness rather than treatment."
"524","Encourage people to take more responsibility for their own health."
"525","We will improve health education and promote healthy living."
"526","We will ban tobacco advertising and promotion and increase the duty on tobacco products."
"527","We will make the Health Education Authority truly independent and free to criticise government policy."
"528","Ensure that food is healthy and safe."
"529","We will create an independent and powerful Food Commission, separate from MAFF, and responsible to Parliament for food quality and safety."
"530","Put health promotion at the heart of government policy."
"531","We will require all government departments to assess the impact of their policies on health."
"532","Each year there will be an independent report, to be published and debated in Parliament, on the state of the nation's health."
"534","Bringing health services closer to people. The local institutions of the NHS must become more accountable to those they serve and more responsive to patients' needs."
"535","We will: Enable citizens to play a part in setting health policies in their area."
"536","We will build on current pilot schemes to bring together Health Authorities and Social Services Departments, within the framework of elected local authorities."
"537","Give local people a stronger voice on NHS Trusts."
"538","We will end the right of the Secretary of State for Health to appoint members of NHS Trusts, Authorities and Boards."
"539","We will require at least half the membership of Trusts to be drawn from the population they serve."
"540","We will open up meetings of NHS Trust boards to the public and press, and give local people, staff and professionals speaking rights."
"541","We will guarantee direct representation from the staff of each Trust."
"542","We will give Community Health Councils improved rights to consultation and greater access to information and meetings."
"543","Give the public more say in setting priorities within the NHS."
"544","Difficult choices about priorities must be faced, they cannot be left to bureaucrats and health professionals alone."
"545","We will develop new ways of involving the public in setting health service priorities."
"547","Giving patients more choice. Patients should have more choice over their type of treatment, who delivers it and when."
"548","We will: Enhance the rights of patients."
"549","We will strengthen the Patients' Charter and include rights to treatment within a specified time, a choice of GP, information about the options for treatment, guaranteed access to health records and better redress."
"550","Ensure that action is taken to improve poor quality services."
"551","We will enable patients and staff to apply directly to our new National Inspectorate of Health and Social Care to carry out inspections and take action where deficiencies come to light."
"553","Community care. Our aim is to create a society in which people, whatever their needs, can live their lives with dignity."
"554","We will: Give people choice in the services they use and the way they are provided."
"555","We will require Councils to extend to those over 65 the right to arrange their own care privately, if they wish."
"556","This will promote independence and enable them to find better value for money."
"557","Care for carers."
"558","We will introduce a new Carer's Benefit, in place of the Independent Living Allowance, in order to meet more of the financial cost of caring."
"559","We will extend the Carer's Benefit, as resources allow, to those over retirement age and work to improve advice, information, training and counselling for carers."
"560","We will seek to increase access to respite care and ensure that carers and users are involved in decisions about care."
"561","We will draw up a Charter that sets out carers' rights and responsibilities."
"562","Establish high national standards for all community care services."
"563","Our new independent Inspectorate of Health and Social Care will publish codes of practice for residential and nursing homes, and have the power to close any home that consistently falls short of national standards."
"564","We will introduce national charging and eligibility guidelines to ensure a 'level playing field' of provision and charges."
"565","Protect people from the excessive cost of care."
"566","We will, as resources allow, raise the threshold at which older people are required to make a contribution to their long-term care."
"567","We are committed to working on a cross party basis, to establish a national agreement on a system for funding care services that does not penalise thrift."
"569","Which party will clean up the mess in our politics? Our aim: To restore trust in British politics."
"570","The problem: People know that British politics isn't working."
"571","Their politicians have lied to them, their Parliament has become tainted by sleaze and their government is out of touch and doesn't listen."
"572","Our commitment: Liberal Democrats will modernise Britain's outdated institutions, rebuild trust, renew democracy and give Britain's nations, regions and local communities a greater say over their affairs."
"573","Our priorities are to: Restore trust between people and government, by ending secrecy and guaranteeing peoples' rights and freedoms."
"574","Renew Britain's democracy, by creating a fair voting system, reforming Parliament and setting higher standards for politicians' conduct."
"575","Give government back to the people, by decentralising power to the nations, regions and communities of the United Kingdom."
"577","Restoring trust in politics. British politics remains far too secretive."
"578","We cannot rebuild trust in politics without making government more open and accountable."
"579","We will: Safeguard individual liberties, by establishing a Bill of Rights."
"580","As a first step, we will incorporate the European Convention on Human Rights into UK law so that it is enforceable by the courts in the UK."
"581","We will set up a Human Rights Commission to strengthen the protection of individual rights."
"582","We will create a Ministry for Justice responsible for protecting human rights and overseeing the administration of the legal system, the courts and legal aid."
"583","We oppose the introduction of Identity Cards."
"584","Break open the excessive secrecy of government, by passing a Freedom of Information Act establishing a citizens right to know."
"585","Cut back the quango state. "
"586","We will scrap unnecessary quangos, handing their functions over to elected bodies."
"587","We will require those that remain to meet in public and to list their members' interests."
"588","We will establish a fair, open and more representative appointment process for all quangos."
"589","Give people more say in decision-making."
"590","We will make greater use of national referendums for constitutional issues, for example, changing the voting system or any further transfer of power to European institutions."
"591","We will enable referendums to be held on specific local issues where there is public demand."
"593","Renewing democracy. Britain's political institutions are outdated and unrepresentative."
"594","We will: Modernise the House of Commons."
"595","We will reduce the number of MPs by 200 (one third) and introduce tougher rules for their conduct, behaviour and outside sources of income."
"596","We will improve drafting and consultation on legislation, and strengthen MPs' ability to hold the government to account."
"597","Create an effective and democratic upper house."
"598","We will, over two Parliaments, transform the House of Lords into a predominantly elected second chamber capable of representing the nations and regions of the UK and of playing a key role in scrutinising European legislation."
"599","Introduce a fair system of voting."
"600","We will introduce proportional representation for all elections, to put more power in the hands of voters and make government more representative."
"601","Make politics more stable."
"602","We will establish a fixed Parliamentary term of four years."
"603","Clean up party funding."
"604","We will reform the way political parties are funded and limit the amount they can spend on national election campaigns."
"605","We will make each party publish its accounts and list all large donors."
"607","Giving government back to the people. Far too much power has been concentrated in Westminster and Whitehall."
"608","Democratic government should be as close to ordinary people as possible."
"609","We will: Introduce Home Rule for Scotland, with the creation of a Scottish Parliament, elected by proportional representation, and able to raise and reduce income tax."
"610","Introduce Home Rule for Wales, with the creation of a Welsh Senedd, elected by proportional representation, and able to raise and reduce income tax."
"611","Create the framework to make existing regional decision-making in England democratically accountable, and enable the establishment of elected regional assemblies, where there is demonstrated public demand."
"612","We will create a strategic authority for London."
"613","Strengthen local government."
"614","We will establish a 'power of general competence', giving Councils wider scope for action."
"615","We will allow local authorities to raise more of their funds locally, give them greater discretion over spending and allow them, within strict limits, to go directly to the markets to raise finance for capital projects."
"616","We will, in the long-term replace Council Tax with a Local Income Tax, and replace the Uniform Business Rate with a fairer system of business rates, raised through local Councils and set in accordance with local priorities."
"618","Northern Ireland. Peace in Northern Ireland depends on containing and ultimately removing the entrenched hostility between the two main communities in Northern Ireland."
"619","We will: Establish a power-sharing executive for Northern Ireland, elected under a fair and proportional system of voting."
"620","We will press for a new constitutional settlement based on the protection of individual rights through a Bill of Rights, incorporating the European Convention."
"621","Give individuals more power and political responsibility."
"622","We will introduce a fair and proportional voting system for all elections, and reform and strengthen local government in the province."
"623","Ensure respect for civil liberties."
"624","We will introduce an independent procedure for investigating complaints against the security forces, and reform the Diplock system so that three judges instead of one preside over non-jury trials."
"625","We will urgently implement the North Report's recommendations for an independent commission to supervise parades and marches."
"626","Promote economic growth."
"627","We will strengthen the all-Ireland economy through the creation of effective cross-border agencies."
"628","We will invest in education and promote inward investment."
"629","Build on the Joint Declaration and the Framework Document, by working with the Irish Government to create agreement between as many of the constitutional parties as possible."
"630","Sinn Fein can only be admitted to this process if, in accordance with the Mitchell principles, they and the IRA turn their backs on terrorism."
"631","Meanwhile, we must remain vigilant and keep in place the present means for countering terrorism."
"633","Which party will give me the opportunity to make the most of my life? Our aim: To widen opportunities for everyone in Britain to make the most of their lives."
"634","The problem: Poverty, lack of training, low pay and discrimination deny too many people the opportunity to make the most of their lives."
"635","Meanwhile, the welfare system no longer meets the needs of a modern society."
"636","It locks too many into dependency and, too often, penalises those who wish to work and save."
"637","Our commitment: Liberal Democrats will promote individual self-reliance, strengthen equality for all before the law and in employment, and work for a society that cherishes diversity."
"638","Our priorities are to: Ensure that, by the millennium, every young person has had the opportunity to work learn, train and make a positive contribution to society."
"639","Give women greater opportunities to play a full role in work and in society."
"640","Ensure dignity in retirement."
"641","Break open the poverty trap that makes people better off on the dole than in work."
"642","Modernise Britain's welfare state for the twenty-first century, building a new cross-party partnership for reform."
"644","Breaking the poverty trap. Unemployment wastes the talents and denies people the opportunity to contribute to the well-being of their families and increase Britain's wealth."
"645","We will: Help long-term unemployed people back to work."
"646","We will establish a self-financing Benefit Transfer Programme allowing those who have been unemployed for a year or more to turn their unemployment benefits into an incentive for employers to recruit and train them."
"647","The value of the benefit to employers will gradually be reduced."
"648","Break open the poverty trap."
"649","We will take nearly 500,000 low earners out of income tax altogether by raising tax thresholds."
"650","This will provide lower taxes and new incentives to work, while cutting the benefits bill and reducing tax for 99.5 per cent of all income taxpayers."
"651","This will be paid for by introducing a new top tax rate of 5Op on taxable income of over £100,000 per year. "
"652","We will replace Income Support and Family Credit with a simpler, more efficient Low Income Benefit that increases financial incentives for people going back to work."
"653","Modernise Britain's welfare system."
"654","We will initiate a comprehensive review of the welfare system to build a new framework for welfare and opportunity, on a cross-party basis."
"655","Our aim is to provide a more effective safety net for the disadvantaged, to encourage work, without compulsion, and to widen opportunities."
"656","Help parents to return to work."
"657","We will develop a national childcare strategy, drawing on public and private provision."
"658","We will, over time, extend tax relief on workplace nurseries to other forms of day nursery care."
"659","Establish a voluntary Citizens Service to give people, especially young people, up to 2 years' work on such projects as environmental conservation, crime prevention, housing renovation, social services and the armed services."
"660","Encourage a flexible labour market, while protecting the low paid with a regionally variable, minimum hourly rate."
"661","Crack down on social security fraud and tax evasion and shift the money saved into new policies to enhance opportunities."
"662","We will tackle the high levels of fraud and overpayment in the social security budget."
"663","We will stop tax evasion and close off tax avoidance loopholes."
"665","Older people. Everyone in Britain should be able to look forward to a retirement of security, opportunity and dignity."
"666","Old people feel that they are fast becoming Britain's forgotten generation."
"667","We will: Guarantee everyone an acceptable minimum standard of living in retirement."
"668","We will create an additional top-up pension for pensioners with incomes below the Income Support level."
"669","This will be indexed to earnings and tapered as outside income increases."
"670","The basic state pension will remain indexed to prices."
"671","We will start to phase out the expensive, unfair contributory system and base the right to a state pension on citizenship and residence."
"672","Enable people to choose when to start drawing a pension."
"673","We will bring in a flexible 'decade of retirement', between the ages of 60 and 70."
"674","Protect the rights of older people."
"675","We will legislate against discrimination on the grounds of age."
"676","Expand private pensions and give people more control over their pensions."
"677","We wish to see more people making provision for their old age."
"678","We will replace the State Earnings Related Scheme (SERPS) with a scheme under which all employees have personal or occupational pensions."
"679","Existing accrued SERPS will, however, be preserved."
"680","We will expand occupational and personal pension schemes by giving all employees an entitlement to participate in a pension scheme of their choice, funded by contributions from employers and employees."
"681","Pension rights will be fully secured if people change jobs. "
"682","We will treat pensions as deferred income over which pension-holders have full rights of security, control and portability."
"683","Abolish standing charges for water and create a fairer system of charging."
"685","Young people. We propose a new deal for young people, in which new rights and new responsibilities go hand in hand."
"686","We will: Expand opportunities."
"687","Our aim is that every young person between the ages of 16 and 19 will have the opportunity to either work, learn, train or take a place on our new Citizens Service."
"688","Restore security to excluded young people."
"689","The withdrawal of benefit rights has condemned thousands of young people to life out of work and on the streets, at great long-term public cost."
"690","We will restore access to benefits for 16 and 17 year-olds."
"691","In the longer term, we aim to scrap the lower rate of income support for those under 25."
"692","Ensure that young people can learn their rights and responsibilities, with citizenship classes in every school and parenting classes for young adults."
"693","We will give children and young people access to information about their legal rights and obligations, review the age of majority and ensure that young people are represented on bodies that especially concern them."
"694","Expand local youth services."
"695","We will require local Councils to provide a statutory youth service in partnership with the voluntary sector. "
"697","Families. Families, in all their forms, are a basic building block of society."
"698","But the nature of families is changing."
"699","This has brought new stresses which must be addressed."
"700","But it has also brought new attitudes, such as the sharing of family responsibilities, which should be encouraged."
"701","We will: Give families more security."
"702","We will take nearly 500,000 low earners out of tax altogether, by raising tax thresholds."
"703","We will replace Income Support and Family Credit with a simpler, more efficient Low Income Benefit that helps people back to work. "
"704","We aim to improve the support for those caring for older people and people with disabilities."
"705","Introduce fair and workable child support legislation."
"706","We will repeal the Child Support Act and abolish the Child Support Agency."
"707","We believe that parents should financially support their children at an appropriate level."
"708","Where there are disputes between the parents, these should be decided by the courts, not by an inflexible formula."
"709","We will create a new system of unified family courts to decide these questions, after they have heard all the evidence."
"710","Promote good parenting."
"711","We will encourage the provision of parenting classes for young adults."
"712","We will increase the role of parents in education by extending home/school/pupil links, and develop home-school partnership arrangements, to assist in addressing the needs of the child."
"713","Expand parental rights."
"714","We will introduce a statutory right to parental leave and develop Maternity Benefit into a new, flexible parental benefit to be shared between partners."
"715","We will ensure that fostering and adoption law is based on the suitability of prospective fosterers and the needs of the child."
"716","Help parents to return to work."
"717","We will, over time, extend tax relief on workplace nurseries to other forms of day nursery care."
"718","We will develop a national childcare strategy, drawing on public and private provision."
"719","Encourage flexible working patterns."
"720","We will encourage job sharing and family-friendly employment practices, especially in the public sector. "
"721","We will give private sector employees approaching retirement age, or with responsibilities for young children, the right to negotiate reduced hours or a career break."
"723","Women. There is still a long way to go before women in Britain have equal opportunities."
"724","We will: Promote equality in the workplace."
"725","We will, over time, extend employment and pensions rights to part-time employees, on a pro-rata basis."
"726","We will bring in tougher obligations on employers to establish equal opportunities procedures and pursue the principle of equal pay for work of equal value."
"727","Make pensions fairer to women, by working to replace the contributory system with pension rights based on citizenship and residence in the UK."
"728","We will bring forward the introduction of pension splitting on divorce."
"729","Improve the services that women receive from the NHS."
"730","We will promote equal treatment of the sexes within the Health Service."
"731","We will set targets for the expansion of facilities which enable women to consult female health professionals."
"732","Make the legal system fairer to women."
"733","We will strengthen the civil law remedies for domestic violence and improve the treatment of rape victims by the court system."
"734","We will seek to improve the provision of refuge places for victims of domestic violence."
"735","Enhance the role of women in public life. "
"736","We will tackle the under-representation of women on public bodies by setting a target that within a decade at least one-third of all those on all public bodies should be women."
"737","We will reform the procedures and facilities of the House of Commons to make them more accommodating to women and families."
"739","Disabled people. Progress in equal opportunities for disabled people remains patchy and unacceptably slow."
"740","We will: Guarantee the rights of disabled people."
"741","We will ban discrimination on the grounds of disability and pass comprehensive legislation securing the civil rights of disabled people."
"742","We will draw up a Charter of Rights setting out what our new Bill of Rights means for disabled people."
"743","Give disabled people more independence."
"744","We will introduce a Partial Capacity Benefit, building on the Disability Working Allowance, to assist those in work who cannot fully support themselves financially."
"745","We aim to increase financial support for disabled people who cannot find work and to make provision for the real costs of disability."
"746","Improve access."
"747","We will publish a code of practice to improve access to buildings and transport."
"748","We will require government departments, local Councils and public organisations to make their key public literature available in Braille or where appropriate tape."
"749","Make education inclusive."
"750","As part of our £2 billion investment in education, we will increase funding for, and enforce implementation of, the Code of Practice for Special Educational Needs."
"752","Ethnic minorities. Despite progress over recent years, members of ethnic minorities are too often denied equal opportunities and have to face racism and discrimination on a daily basis."
"753","Diversity, pluralism and a multicultural society are sources of strength for Britain."
"754","We will: Strengthen action against discrimination."
"755","We will create a new Human Rights Commission, combining the Commission for Racial Equality and the Equal Opportunities Commission."
"756","We will give statutory force to the Commission for Racial Equality's Code of Practice in employment, and ensure that Britain plays a leading role in strengthening anti-discrimination legislation throughout the European Union."
"757","Ensure equal opportunities for all."
